7-Chanpatia [1-Paschim Champaran],121,"Prathamik Vidyalay, Turahapatti Uttar Bhag ka baya bhag",Auxiliary,626,1244,26.856937,84.480023,Yes,Yes,Yes
7-Chanpatia [1-Paschim Champaran],122,"Prathamik Vidyalay, Turahapatti Dachhin Bhag ka daya bhag",Main,1,569,26.56402684,84.326602,Yes,Yes,Yes
7-Chanpatia [1-Paschim Champaran],122,"Prathamik Vidyalay, Turahapatti Dachhin Bhag ka baya bhag",Auxiliary,570,1173,26.856955,84.480045,Yes,Yes,Yes
7-Chanpatia [1-Paschim Champaran],123,"Rajkiy Madhya Vidyalay, Jogiya Tola Purvi Bha ka daya bhag",Main,1,550,26.51311832,84.27563256,Yes,Yes,Yes
7-Chanpatia [1-Paschim Champaran],123,"Rajkiy Madhya Vidyalay, Jogiya Tola Purvi Bha ka baya bhag",Auxiliary,551,1139,26.51311832,84.27563256,Yes,Yes,Yes
7-Chanpatia [1-Paschim Champaran],124,"Rajkiya Madhya Vidyalay, Jogiya Tola Paschimi Bhag",Main,1,891,26.51311112,84.27563256,Yes,Yes,Yes
7-Chanpatia [1-Paschim Champaran],125,"Madhya Vidyalay, Badaharava, Uttar Bhag ka daya bhag",Main,1,551,26.8478885,84.461816,Yes,Yes,Yes
7-Chanpatia [1-Paschim Champaran],125,"Madhya Vidyalay, Badaharava, Uttar Bhag ka baya bhag",Auxiliary,552,1109,26.8478885,84.461816,Yes,Yes,Yes
7-Chanpatia [1-Paschim Champaran],126,"Madhya Vidyalay, Badaharava Dachhin  Bhag ka daya bhag",Main,1,533,26.8478885,84.461816,Yes,Yes,Yes
7-Chanpatia [1-Paschim Champaran],126,"Madhya Vidyalay, Badaharava Dachhin  Bhag ka baya bhag ",Auxiliary,534,1169,26.8478885,84.461816,Yes,Yes,Yes
7-Chanpatia [1-Paschim Champaran],127,"Utakramit Madhya Vidyalay , Guruvaliya Saskrit utari bhag",Main,1,976,26.848215,84.472136,Yes,Yes,Yes
7-Chanpatia [1-Paschim Champaran],128,utkramit madhy vidhyalay gurvalia sanskriti dakshin bhag,Main,1,919,26.848215,84.472136,Yes,Yes,Yes
7-Chanpatia [1-Paschim Champaran],129,"Prathamik Vidyalay, Guruvaliya Dusadh Tola utari bhag",Main,1,930,26.50175884,84.28148404,Yes,Yes,Yes
7-Chanpatia [1-Paschim Champaran],130,prathmik vidhyalay gurvaliya dusadh toli dakshini bhag,Main,1,1085,26.50177216,84.28150744,Yes,Yes,Yes
7-Chanpatia [1-Paschim Champaran],131,Prathamik Vidyalay Bharavatola Ramasurat Dube ke Tola Purbi Bhag ka daya bhag,Main,1,522,26.4946236,84.27333864,Yes,Yes,Yes
7-Chanpatia [1-Paschim Champaran],131,Prathamik Vidyalay Bharavatola Ramasurat Dube ke Tola Purbi Bhag ka baya bhag,Auxiliary,523,1093,26.4946236,84.27333864,Yes,Yes,Yes
7-Chanpatia [1-Paschim Champaran],132,Prathamik Vidyalay Bharavatola Ramasurat Dube ke Tola Paschimi Bhag ka daya bhag,Main,1,503,26.49466392,84.27327204,Yes,Yes,Yes
7-Chanpatia [1-Paschim Champaran],132,Prathamik Vidyalay Bharavatola Ramasurat Dube ke Tola Paschimi Bhag ka baya bhag,Auxiliary,504,1050,26.49466392,84.27327204,Yes,Yes,Yes
7-Chanpatia [1-Paschim Champaran],133,utkramit madhy vidhyalay bharpatia utar bhag ka daya bhag,Main,1,609,26.826641,84.484649,Yes,Yes,Yes
7-Chanpatia [1-Paschim Champaran],133,utkramit madhy vidhyalay bharpatia utar bhag ka baya bhag,Auxiliary,610,1280,26.826641,84.484649,Yes,Yes,Yes
7-Chanpatia [1-Paschim Champaran],134,utkramit madhy vidhyalay bharpatia dakshini bhag,Main,1,1058,26.826646,84.484652,Yes,Yes,Yes
7-Chanpatia [1-Paschim Champaran],135,"Utakramit Madhya Vidyalay, Patarakha utar bhag",Main,1,934,26.822141,84.443274,Yes,Yes,Yes
7-Chanpatia [1-Paschim Champaran],136,utkramit madhy vidhyalay patarkha dakshini bhag,Main,1,902,26.822174,84.443198,Yes,Yes,Yes
7-Chanpatia [1-Paschim Champaran],137,"Utakramit Madhya Vidyalay, Hirapakad utari bhag",Main,1,824,26.83114,84.45539,Yes,Yes,Yes
7-Chanpatia [1-Paschim Champaran],138,utkramit madhy vidhyalay hirapakad dakshini bhag,Main,1,873,26.833007,84.45392,Yes,Yes,Yes
7-Chanpatia [1-Paschim Champaran],139,"Utakramit Madhya Vidyalay, Parasa ka daya bhag",Main,1,531,26.839377,84.445477,Yes,Yes,Yes
7-Chanpatia [1-Paschim Champaran],139,"Utakramit Madhya Vidyalay, Parasa ka baya bhag",Auxiliary,532,1160,26.839273,84.445524,Yes,Yes,Yes
7-Chanpatia [1-Paschim Champaran],140,"prathmik Vidyalay, Tuniya Vishunapur purvi bhag",Main,1,762,26.821458,84.458588,Yes,Yes,Yes
7-Chanpatia [1-Paschim Champaran],141,prathmik vidhyalay tuniya vishunpur paschimi bhag,Main,1,841,26.821443,84.458706,Yes,Yes,Yes
7-Chanpatia [1-Paschim Champaran],142,Prathamik Vidyalay Lapatahi purvi bhag,Main,1,943,26.819247,84.478888,Yes,Yes,Yes
7-Chanpatia [1-Paschim Champaran],143,prathmik vidhyalay laptahi paschim bhag,Main,1,996,26.807173,84.502206,Yes,Yes,Yes
7-Chanpatia [1-Paschim Champaran],144,Buniyadi Vidyalay Shekhadhurava ka daya bhag,Main,1,729,26.8345932,84.5084271,Yes,Yes,Yes
7-Chanpatia [1-Paschim Champaran],144,Buniyadi Vidyalay Shekhadhurava ka baya bhag,Auxiliary,730,1501,26.8345932,84.5084271,Yes,Yes,Yes
7-Chanpatia [1-Paschim Champaran],145,"Buniyadi Vidyalay, Rayadhurava Uttari Bhag",Main,1,982,26.8452292,84.5168396,Yes,Yes,Yes
7-Chanpatia [1-Paschim Champaran],146,"Buniyadi Vidyalay, Rayadhurava Dakshini Bhag",Main,1,999,26.8448591,84.516804,Yes,Yes,Yes
7-Chanpatia [1-Paschim Champaran],147,"Utakramit Madhya Vidyalay, Khairatiya Purvi Bhag",Main,1,772,26.823443,84.5136667,Yes,Yes,Yes
7-Chanpatia [1-Paschim Champaran],148,Utkramit madhy vidhyalay khairatiya madhy bhag,Main,1,772,26.823443,84.5136667,Yes,Yes,Yes
7-Chanpatia [1-Paschim Champaran],149,"Utakramit Madhya Vidyalay, Khairatiya Pa0 Bhag",Main,1,594,26.823405,84.5195617,Yes,Yes,Yes
7-Chanpatia [1-Paschim Champaran],150,"Buniyadi Vidyalay, Shrinagar Chhavani",Main,1,718,26.8233992,84.5015737,Yes,Yes,Yes
7-Chanpatia [1-Paschim Champaran],151,"Buniyadi Vidyalay, Jokaha utari bhag",Main,1,907,26.816624,84.504263,Yes,Yes,Yes
7-Chanpatia [1-Paschim Champaran],152,Buniyadi vidhyalay jokaha dakshin bhag,Main,1,882,26.816624,84.504263,Yes,Yes,Yes
7-Chanpatia [1-Paschim Champaran],153,"Utakramit Madhya Vidyalay, Upadhay Tola",Main,1,915,26.854965,84.506021,Yes,Yes,Yes
7-Chanpatia [1-Paschim Champaran],154,Avar Pramandal karyalay (Nahar) Kumaravag ka daya bhag,Main,1,553,26.874878,84.515172,Yes,Yes,Yes
7-Chanpatia [1-Paschim Champaran],154,Avar Pramandal karyalay (Nahar) Kumarava ka baya bhag,Auxiliary,554,1117,26.874878,84.515172,Yes,Yes,Yes
7-Chanpatia [1-Paschim Champaran],155,Hayar Sekenadari Vi0 Kumaravag utari bhag ,Main,1,988,26.878026,84.511667,Yes,Yes,Yes
7-Chanpatia [1-Paschim Champaran],156,Hayar secendory vidhyalay kumar bag dakshini bhag,Main,1,925,26.8737786,84.516156,Yes,Yes,Yes
7-Chanpatia [1-Paschim Champaran],157,Buniyadi Vidyalay Mathiya  Bakuchiya ka daya bhag,Main,1,631,26.522548,84.494301,Yes,Yes,Yes
7-Chanpatia [1-Paschim Champaran],157,Buniyadi Vidyalay Mathiya  Bakuchiya ka baya bhag,Auxiliary,632,1336,26.522548,84.494301,Yes,Yes,Yes
7-Chanpatia [1-Paschim Champaran],158,"Buniyadi Vidyalay, Vishunapur Brita Uttari Bhag ",Main,1,903,26.859577,84.496983,Yes,Yes,Yes
7-Chanpatia [1-Paschim Champaran],159,"Buniyadi Vidyalay, Vishunapur Brita Dakshin Bhag",Main,1,844,26.859565,84.497002,Yes,Yes,Yes
7-Chanpatia [1-Paschim Champaran],160,"Buniyadi Vidyalay, Vishunapur Brita Pashchmi  Bhag",Main,1,906,26.8596183,84.4970633,Yes,Yes,Yes
7-Chanpatia [1-Paschim Champaran],161,buniyadi vidhyalay vishunpur vrit madhy bhag,Main,1,804,26.859566,84.497003,Yes,Yes,Yes
7-Chanpatia [1-Paschim Champaran],162,"Prathamik Vidyalay, Rmapurava ka daya bhag",Main,1,635,26.51429,84.314325,Yes,Yes,Yes
7-Chanpatia [1-Paschim Champaran],162,"Prathamik Vidyalay, Rmapurava ka baya bhag",Auxiliary,636,1332,26.51429,84.314325,Yes,Yes,Yes
7-Chanpatia [1-Paschim Champaran],163,"Buniyadi Vidyalay, Ranipur ka daya bhag",Main,1,618,26.85363,84.5126667,Yes,Yes,Yes
7-Chanpatia [1-Paschim Champaran],163,"Buniyadi Vidyalay, Ranipur ka baya bhag",Auxiliary,619,1277,26.85363,84.5126667,Yes,Yes,Yes
7-Chanpatia [1-Paschim Champaran],164,"Buniyadi Vidyalay, Vrindavan Rampurva",Main,1,984,26.860472,84.547015,Yes,Yes,Yes
7-Chanpatia [1-Paschim Champaran],165,"Prathamik Vidyalay, Tikachhapar Purbi Bhag",Main,1,894,26.855528,84.546118,Yes,Yes,Yes
7-Chanpatia [1-Paschim Champaran],166,"Prathamik Vidyalay, Tikachhapar Pashmi Bhag",Main,1,907,26.8542233,84.5418467,Yes,Yes,Yes
7-Chanpatia [1-Paschim Champaran],167,"Madhya Vidyalay,  Jabadaul Dusadapatti Purwee  Bhag",Main,1,918,26.859518,84.550272,Yes,Yes,Yes
7-Chanpatia [1-Paschim Champaran],168,"Madhya Vidyalay, Jabadaul Dusadapatti Pa0 Bhag",Main,1,980,26.859518,84.54550272,Yes,Yes,Yes
7-Chanpatia [1-Paschim Champaran],169,"Buniyadi Vidyalay, Belava",Main,1,1003,26.8397683,84.5301533,Yes,Yes,Yes
7-Chanpatia [1-Paschim Champaran],170,"Panchayat Bhavan, Avaraiya",Main,1,871,26.8430167,84.5331783,Yes,Yes,Yes
7-Chanpatia [1-Paschim Champaran],171,Buniyadi Vidyalay Avaraiya Purwee Bhag,Main,1,758,26.8421683,84.5409417,Yes,Yes,Yes
7-Chanpatia [1-Paschim Champaran],172,buniyadi vidhyalay avraiya utari bhag,Main,1,743,26.8421683,84.5409417,Yes,Yes,Yes
7-Chanpatia [1-Paschim Champaran],173,Buniyadi Vidyalayl Avaraiya Pa0 Bhag,Main,1,723,26.8422533,84.5406667,Yes,Yes,Yes
7-Chanpatia [1-Paschim Champaran],174,buniyadi vidhyalay avraiya dakshini bhag,Main,1,766,26.8422533,84.5406667,Yes,Yes,Yes
7-Chanpatia [1-Paschim Champaran],175,"Buniyadi Vidyalay, Lalagadh utari bhag",Main,1,925,26.8189783,84.5605567,Yes,Yes,Yes
7-Chanpatia [1-Paschim Champaran],176,buniyadi vidhyalay lalgagh dakshin bhag,Main,1,886,26.8189783,84.5605567,Yes,Yes,Yes
7-Chanpatia [1-Paschim Champaran],177,"Utakramit Madhya Vidyalay Vidyalay,Khasuad ka daya bhag",Main,1,539,26.81798,84.5508233,Yes,Yes,Yes
7-Chanpatia [1-Paschim Champaran],177,"Utakramit Madhya Vidyalay Vidyalay,Khasuad ka baya bhag'",Auxiliary,540,1126,26.81798,84.5508233,Yes,Yes,Yes
7-Chanpatia [1-Paschim Champaran],178,"Prathamik Vidyalay, Karanmaiya naya bhawan baya bhag",Main,1,1008,26.82589,84.5603217,Yes,Yes,Yes
7-Chanpatia [1-Paschim Champaran],179,"Prathamik Vidyalay, Karanmaiya naya bhawan daya Bhag",Main,1,997,26.82303,84.5661,Yes,Yes,Yes
7-Chanpatia [1-Paschim Champaran],180,"Buniyadi Vidyalay, Pandey Tola utari bhag",Main,1,888,26.831915,84.5686417,Yes,Yes,Yes
7-Chanpatia [1-Paschim Champaran],181,buniyadi vidhyalay pandey tola dakshini bhag,Main,1,847,26.831915,84.5686417,Yes,Yes,Yes
7-Chanpatia [1-Paschim Champaran],182,"Buniyadi Vidyalay, , Lohiariya",Main,1,868,26.8838133,84.5736317,Yes,Yes,Yes
7-Chanpatia [1-Paschim Champaran],183,"Prathamik Vidyalay, Banakatava ka daya bhag",Main,1,527,26.8897733,84.5534567,Yes,Yes,Yes
7-Chanpatia [1-Paschim Champaran],183,"Prathamik Vidyalay, Banakatava ka baya bhag",Auxiliary,528,1099,26.8897733,84.5534567,Yes,Yes,Yes
7-Chanpatia [1-Paschim Champaran],184,"Buniyadi Vidyalay, yadochhapar utari bhag",Main,1,896,26.87747,84.55257,Yes,Yes,Yes
7-Chanpatia [1-Paschim Champaran],185,Buniyadi vidhyalay yadochhapar dakshini bhag,Main,1,843,26.87747,84.55257,Yes,Yes,Yes
7-Chanpatia [1-Paschim Champaran],186,Prathmik vidhyalay navka tola purvi bhag,Main,1,819,26.873627,84.56634,Yes,Yes,Yes
7-Chanpatia [1-Paschim Champaran],187,prathmik vidhyalay navka tola paschimi bhag,Main,1,789,26.873489,84.561655,Yes,Yes,Yes
7-Chanpatia [1-Paschim Champaran],188,"Shyam Narayan Madhya Vidyalay, Banava Tola",Main,1,853,26.87156,84.57952,Yes,Yes,Yes
7-Chanpatia [1-Paschim Champaran],189,"Buniyadi Vidyalay, Mahuava Uttari Bhag",Main,1,1032,26.857455,84.5542083,Yes,Yes,Yes
7-Chanpatia [1-Paschim Champaran],190,"Buniyadi Vidyalay, Mahuava Dakshin Bhag ka daya bhag",Main,1,510,26.8574467,84.5542083,Yes,Yes,Yes
7-Chanpatia [1-Paschim Champaran],190,"Buniyadi Vidyalay, Mahuava Dakshin Bhag ka baya bhag",Auxiliary,511,1049,26.8574467,84.5542083,Yes,Yes,Yes
7-Chanpatia [1-Paschim Champaran],191,"Utakramit Madhy Vidyalay, Baliramapur daya bhag",Main,1,842,26.85132,84.572206,Yes,Yes,Yes
7-Chanpatia [1-Paschim Champaran],192,"Uttkramit Madhy Vidyalay Balirampur, (Baya Bhag) ka daya bhag",Main,1,524,26.85134,84.572254,Yes,Yes,Yes
7-Chanpatia [1-Paschim Champaran],192,"Uttkramit Madhy Vidyalay Balirampur, (Baya Bhag) ka baya bhag",Auxiliary,525,1113,26.854478,84.58223,Yes,Yes,Yes
7-Chanpatia [1-Paschim Champaran],193,"Rajakiy Utakramit Madhya Vidyalay, Aranahava, Purvi Bhag ka daya bhag",Main,1,512,26.854295,84.582065,Yes,Yes,Yes
7-Chanpatia [1-Paschim Champaran],193,"Rajakiy Utakramit Madhya Vidyalay, Aranahava, Purvi Bhag ka baya bhag",Auxiliary,513,1059,26.854398,84.582575,Yes,Yes,Yes
7-Chanpatia [1-Paschim Champaran],194,"Rajakiy prathmik Vidyalay, karesa tola",Main,1,950,26.854398,84.582575,Yes,Yes,Yes
7-Chanpatia [1-Paschim Champaran],195,"Rajakiy Utakramit Madhy Vidyalay, Aranhava Madhy Bhag ka daya bhag",Main,1,517,26.856602,84.585491,Yes,Yes,Yes
7-Chanpatia [1-Paschim Champaran],195,"Rajakiy Utakramit Madhy Vidyalay, Aranhava Madhy Bhag ka baya bhag",Auxiliary,518,1054,26.854536,84.597391,Yes,Yes,Yes
7-Chanpatia [1-Paschim Champaran],196,"Rajakiy Prathamik Vidyalay,Chanayan Bandh, Purwi Bhag",Main,1,938,26.854579,84.597683,Yes,Yes,Yes
7-Chanpatia [1-Paschim Champaran],197,"Rajakiy Prathamik Vidyalay, Chanayan Bandh, Pashchimi Bhag ka daya bhag",Main,1,542,26.854579,84.597683,Yes,Yes,Yes
7-Chanpatia [1-Paschim Champaran],197,"Rajakiy Prathamik Vidyalay, Chanayan Bandh, Pashchimi Bhag ka baya bhag",Auxiliary,543,1136,26.839678,84.599607,Yes,Yes,Yes
7-Chanpatia [1-Paschim Champaran],198,"Rajakiy Prathamik Vidyalay, Mirjapur ka daya bhag",Main,1,584,26.839678,84.599607,Yes,Yes,Yes
7-Chanpatia [1-Paschim Champaran],198,"Rajakiy Prathamik Vidyalay, Mirjapur ka baya bhag",Auxiliary,585,1142,26.831343,84.588537,Yes,Yes,Yes
7-Chanpatia [1-Paschim Champaran],199,Besik Skul Mahana Mirjapur ka daya bhag,Main,1,699,26.831343,84.588537,Yes,Yes,Yes
7-Chanpatia [1-Paschim Champaran],199,Besik Skul Mahana Mirjapur ka baya bhag,Auxiliary,700,1371,26.831094,84.588912,Yes,Yes,Yes
7-Chanpatia [1-Paschim Champaran],200,"Madhya Vidyalay, Ninhabaliya",Main,1,861,26.825317,84.578132,Yes,Yes,Yes
7-Chanpatia [1-Paschim Champaran],201,Besik Skul Mahana Mirjapur Maghya Bhag,Main,1,720,26.831117,84.588706,Yes,Yes,Yes
7-Chanpatia [1-Paschim Champaran],202,besik school mahna mirjapur baya bhag,Main,1,735,26.849262,84.606416,Yes,Yes,Yes
7-Chanpatia [1-Paschim Champaran],203,"Madhya Vidyalay, Paras Pakadi, Purvi Bhag",Main,1,869,26.849024,84.606924,Yes,Yes,Yes
7-Chanpatia [1-Paschim Champaran],204,"Madhya Vidyalay, Paras Pakadi, Paschim Bhag ka daya bhag",Main,1,550,26.849044,84.606932,Yes,Yes,Yes
7-Chanpatia [1-Paschim Champaran],204,"Madhya Vidyalay, Paras Pakadi, Paschim Bhag ka baya bhag",Auxiliary,551,1123,26.864695,84.619049,Yes,Yes,Yes
7-Chanpatia [1-Paschim Champaran],205,"Rajakiy Prathamik Vidyalay,Ratanamala",Main,1,898,26.867248,84.626525,Yes,Yes,Yes
7-Chanpatia [1-Paschim Champaran],206,Rajkiy prathmik vidhyalay ramkola,Main,1,932,26.876012,84.606678,Yes,Yes,Yes
7-Chanpatia [1-Paschim Champaran],207,"Besik School, Bhagadava, Purvi Bhag ka daya bhag",Main,1,569,26.876211,84.605868,Yes,Yes,Yes
7-Chanpatia [1-Paschim Champaran],207,"Besik School, Bhagadava, Purvi Bhag ka baya bhag",Auxiliary,570,1175,26.876177,84.606513,Yes,Yes,Yes
7-Chanpatia [1-Paschim Champaran],208,"Besik School, Bhagadava, Paschim Bhag",Main,1,611,26.87612,84.60656,Yes,Yes,Yes
7-Chanpatia [1-Paschim Champaran],209,Rajkiy prathmik vidhyalay kohadgar,Main,1,548,26.887634,84.604676,Yes,Yes,Yes
7-Chanpatia [1-Paschim Champaran],210,"uttkramit madhy Vidyalay, Patavandi Purbi Bhag ka daya bhag",Main,1,569,26.858464,84.606805,Yes,Yes,Yes
7-Chanpatia [1-Paschim Champaran],210,"uttkramit madhy Vidyalay, Patavandi Purbi Bhag ka baya bhag",Auxiliary,570,1025,26.887018,84.604627,Yes,Yes,Yes
7-Chanpatia [1-Paschim Champaran],211,"Uttkramit madhy Vidyalay, Patavandi Paschim Bhag",Main,1,861,26.878609,84.595495,Yes,Yes,Yes
7-Chanpatia [1-Paschim Champaran],212,Rajkiy Uttkramit madhy vidhyalay chhavraiya baya bhag,Main,1,869,26.883283,84.620277,Yes,Yes,Yes
7-Chanpatia [1-Paschim Champaran],213,"Rajakiy Utakramit Madhya Vidyalay, Chhavaraiya daya bhag",Main,1,780,26.878605,84.59558,Yes,Yes,Yes
7-Chanpatia [1-Paschim Champaran],214,"Siniyar Besik School, Bhagadava, Puranabhavan ka daya bhag",Main,1,611,26.876105,84.606443,Yes,Yes,Yes
7-Chanpatia [1-Paschim Champaran],214,"Siniyar Besik School, Bhagadava, Puranabhavan ka baya bhag",Auxiliary,612,1249,26.876105,84.606443,Yes,Yes,Yes
7-Chanpatia [1-Paschim Champaran],215,"Rajakiy Prathamik Vidyalay, Bharavaliya daya bhag",Main,1,788,26.896519,84.63383,Yes,Yes,Yes
7-Chanpatia [1-Paschim Champaran],216,Rajkya Prathmik Vidhyalay bharvalia baya bhag,Main,1,775,26.886771,84.611211,Yes,Yes,Yes
7-Chanpatia [1-Paschim Champaran],217,"Rajakiy Utakramit Madhya Vidyalay, Banakat Mushahari",Main,1,1002,26.878864,84.62379,Yes,Yes,Yes
7-Chanpatia [1-Paschim Champaran],218,"Uchcha Vidyalay, Sarisava, Daya Bhag ka daya bhag",Main,1,514,26.878863,84.623789,Yes,Yes,Yes
7-Chanpatia [1-Paschim Champaran],218,"Uchcha Vidyalay, Sarisava, Daya Bhag ka baya bhag",Auxiliary,515,1114,26.847752,84.613579,Yes,Yes,Yes
7-Chanpatia [1-Paschim Champaran],219,"Uchcha Vidyalay, Sarisava, Baya Bhag ka daya bhag",Main,1,504,26.827562,84.602046,Yes,Yes,Yes
7-Chanpatia [1-Paschim Champaran],219,"Uchcha Vidyalay, Sarisava, Baya Bhag ka baya bhag",Auxiliary,505,1065,26.775256,84.592646,Yes,Yes,Yes
7-Chanpatia [1-Paschim Champaran],220,Uchcha Vidyalay Sarisva (Madhy Bhag),Main,1,1009,26.844288,84.634669,Yes,Yes,Yes
7-Chanpatia [1-Paschim Champaran],221,"Madhya Vidyalay, Sarisava daya bhag",Main,1,950,26.874389,84.64477,Yes,Yes,Yes
7-Chanpatia [1-Paschim Champaran],222,Madhy Vidhyalay Sarisva baya Bhag,Main,1,964,26.864487,84.645286,Yes,Yes,Yes
7-Chanpatia [1-Paschim Champaran],223,"Rajakiy Prathamik Vidyalay, Dhanakutava daya bhag",Main,1,851,26.864383,84.64509,Yes,Yes,Yes
7-Chanpatia [1-Paschim Champaran],224,Rajkiy Prathmik Vidhyalay Dhankutva Baya Bhag,Main,1,884,26.857585,84.637698,Yes,Yes,Yes
7-Chanpatia [1-Paschim Champaran],225,"Rajakiy Prathamik Vidyalay, Ojha Mathiya ka daya bhag",Main,1,601,26.857553,84.637816,Yes,Yes,Yes
7-Chanpatia [1-Paschim Champaran],225,"Rajakiy Prathamik Vidyalay, Ojha Mathiya ka baya bhag",Auxiliary,602,1241,26.870037,84.65853,Yes,Yes,Yes
7-Chanpatia [1-Paschim Champaran],226,"Rajakiy Utakramit Madhya Vidyalay, Semaraghat, Uttari Bhag ka daya bhag",Main,1,599,26.870037,84.65853,Yes,Yes,Yes
7-Chanpatia [1-Paschim Champaran],226,"Rajakiy Utakramit Madhya Vidyalay, Semaraghat, Uttari Bhag ka baya bhag",Auxiliary,600,1346,26.869917,84.658562,Yes,Yes,Yes
7-Chanpatia [1-Paschim Champaran],227,"Rajakiy Utakramit Madhya Vidyalay, Semaraghat, Dakshini Bhag ka daya bhag",Main,1,740,26.869917,84.658562,Yes,Yes,Yes
7-Chanpatia [1-Paschim Champaran],227,"Rajakiy Utakramit Madhya Vidyalay, Semaraghat, Dakshini Bhag ka baya bhag",Auxiliary,741,1525,26.857758,84.653878,Yes,Yes,Yes
7-Chanpatia [1-Paschim Champaran],228,"Rajakiy Utakramit Madhya Vidyalay, Barava ka daya bhag",Main,1,690,26.845279,84.663441,Yes,Yes,Yes
7-Chanpatia [1-Paschim Champaran],228,"Rajakiy Utakramit Madhya Vidyalay, Barava ka baya bhag",Auxiliary,691,1479,26.870148,84.680538,Yes,Yes,Yes
7-Chanpatia [1-Paschim Champaran],229,"Kanya Rajakiy Prathamik Vidyalay, Bathana, Uttari Bhag",Main,1,971,26.870202,84.680575,Yes,Yes,Yes
7-Chanpatia [1-Paschim Champaran],230,Kanya Rajkiy Prathmik Vidhyalay Bathna Madhy Bhag,Main,1,932,26.870192,84.680608,Yes,Yes,Yes
7-Chanpatia [1-Paschim Champaran],231,"Kanya Rajakiy Prathamik Vidyalay,Bathana,Dakshini Bhag",Main,1,864,26.870207,84.680582,Yes,Yes,Yes
7-Chanpatia [1-Paschim Champaran],232,Kanya Rajkiy Prathmik Vidhyalay Bathna Purvi bhag,Main,1,823,26.870207,84.680582,Yes,Yes,Yes
7-Chanpatia [1-Paschim Champaran],233,"Madhya Vidyalay, Birava ka daya bhag",Main,1,690,26.870207,84.680582,Yes,Yes,Yes
7-Chanpatia [1-Paschim Champaran],233,"Madhya Vidyalay, Birava ka baya bhag",Auxiliary,691,1434,26.870207,84.637939,Yes,Yes,Yes
7-Chanpatia [1-Paschim Champaran],234,"Utkarmait Madhy Vidyalay, Harapur ka daya bhag",Main,1,534,26.867073,84.637939,Yes,Yes,Yes
7-Chanpatia [1-Paschim Champaran],234,"Utkarmait Madhy Vidyalay, Harapur ka baya bhag",Auxiliary,535,1087,26.865777,84.688446,Yes,Yes,Yes
7-Chanpatia [1-Paschim Champaran],235,"Rajakiy Prathamik Vidyalay, Kanya Gadhava Uttari Bhag ka daya bhag",Main,1,522,26.865842,84.688447,Yes,Yes,Yes
7-Chanpatia [1-Paschim Champaran],235,"Rajakiy Prathamik Vidyalay, Kanya Gadhava Uttari Bhag ka baya bhag",Auxiliary,523,1177,26.865798,84.688355,Yes,Yes,Yes
7-Chanpatia [1-Paschim Champaran],236,"Rajakiy Prathamik Vidyalay, Kanya Gadhava Da0 Bhag ka daya bhag",Main,1,548,26.865799,84.688356,Yes,Yes,Yes
7-Chanpatia [1-Paschim Champaran],236,"Rajakiy Prathamik Vidyalay, Kanya Gadhava Da0 Bhag",Auxiliary,549,1134,26.865799,84.688356,Yes,Yes,Yes
7-Chanpatia [1-Paschim Champaran],237,Rajkiy Prathmik Vidhyalay Kanya Gadva Purvi Bhag ka daya bhag,Main,1,590,26.865799,84.688356,Yes,Yes,Yes
7-Chanpatia [1-Paschim Champaran],237,Rajkiy Prathmik Vidhyalay Kanya Gadva Purvi Bhag ka baya bhag,Auxiliary,591,1216,26.863282,84.691958,Yes,Yes,Yes
7-Chanpatia [1-Paschim Champaran],238,"Rajakiy Utakramit Madhya Vidyalay,Gadhava Bhogadi Purwi Bhag",Main,1,886,26.863355,84.691975,Yes,Yes,Yes
7-Chanpatia [1-Paschim Champaran],239,Rajkiy Uttkramit Madhy Vidhyalay Ghadva Bhogadi Dakshini Bhag,Main,1,939,26.863173,84.691708,Yes,Yes,Yes
7-Chanpatia [1-Paschim Champaran],240,"Rajakiy Utakramit Madhya Vidyalay,Gadhava Bhogadi, Pashchim Bhag ka daya bhag",Main,1,578,26.863027,84.611788,Yes,Yes,Yes
7-Chanpatia [1-Paschim Champaran],240,"Rajakiy Utakramit Madhya Vidyalay,Gadhava Bhogadi, Pashchim Bhag ka baya bhag",Auxiliary,579,1131,26.863378,84.691716,Yes,Yes,Yes
7-Chanpatia [1-Paschim Champaran],241,"Rajakiy Utakramit Madhya Vidyalay,Gadhava Bhogadi, Madhya Bhag ka daya bhag",Main,1,537,26.863384,84.691754,Yes,Yes,Yes
7-Chanpatia [1-Paschim Champaran],241,"Rajakiy Utakramit Madhya Vidyalay,Gadhava Bhogadi, Madhya Bhag ka baya bhag",Auxiliary,538,1094,26.842045,84.710638,Yes,Yes,Yes
7-Chanpatia [1-Paschim Champaran],242,"Madhya Vidyalay, Dumari Mahanava, Uttari Bhag ka daya bhag",Main,1,518,26.846721,84.701948,Yes,Yes,Yes
7-Chanpatia [1-Paschim Champaran],242,"Madhya Vidyalay, Dumari Mahanava, Uttari Bhag ka baya bhag",Auxiliary,519,1090,26.841959,84.710485,Yes,Yes,Yes
7-Chanpatia [1-Paschim Champaran],243,"Madhya Vidyalay, Dumari Mahanava, Madhya Bhag",Main,1,820,26.84193,84.710581,Yes,Yes,Yes
7-Chanpatia [1-Paschim Champaran],244,"Madhya Vidyalay, Dumari Mahanava, Dakshini Bhag",Main,1,857,26.842031,84.710239,Yes,Yes,Yes
7-Chanpatia [1-Paschim Champaran],245,Madhy Vidhyalay Dumari Mahanava Purvi Bhag,Main,1,923,26.857008,84.712741,Yes,Yes,Yes
7-Chanpatia [1-Paschim Champaran],246,"Rajakiy Prathamik Vidyalay, Badhaiya Tola Urdu ka daya bhag",Main,1,619,26.857034,84.71279,Yes,Yes,Yes
7-Chanpatia [1-Paschim Champaran],246,"Rajakiy Prathamik Vidyalay, Badhaiya Tola Urdu ka baya bhag",Auxiliary,620,1264,26.860256,84.710493,Yes,Yes,Yes
7-Chanpatia [1-Paschim Champaran],247,Rajkiy Prathmik Vidhyalay Badhaiya Tola Daya Bhag,Main,1,806,26.857099,84.712715,Yes,Yes,Yes
7-Chanpatia [1-Paschim Champaran],248,"Rajakiy Prathamik Vidyalay, Badhaiya Tola Baya Bhag",Main,1,784,26.84966,84.677694,Yes,Yes,Yes
7-Chanpatia [1-Paschim Champaran],249,"Utakramit Madhya Vidyalay,Ramapurava ka daya bhag",Main,1,611,26.84966,84.677694,Yes,Yes,Yes
7-Chanpatia [1-Paschim Champaran],249,"Utakramit Madhya Vidyalay,Ramapurava ka baya bhag",Auxiliary,612,1251,26.827608,84.670966,Yes,Yes,Yes
7-Chanpatia [1-Paschim Champaran],250,"Utkramit Madhya Vidyalay, Raghunathpur Urdu ka daya bhag",Main,1,607,26.827743,84.670985,Yes,Yes,Yes
7-Chanpatia [1-Paschim Champaran],250,"Utkramit Madhya Vidyalay, Raghunathpur Urdu ka baya bhag",Auxiliary,608,1236,26.836806,84.72102,Yes,Yes,Yes
7-Chanpatia [1-Paschim Champaran],251,"Utakramit Madhya Vidyalay, Dumari, Utari Bhag ka daya bhag",Main,1,683,26.841263,84.725651,Yes,Yes,Yes
7-Chanpatia [1-Paschim Champaran],251,"Utakramit Madhya Vidyalay, Dumari, Utari Bhag ka baya bhag",Auxiliary,684,1434,26.836806,84.72102,Yes,Yes,Yes
7-Chanpatia [1-Paschim Champaran],252,"Utakramit Madhya Vidyalay, Dumari, Daschhin Bhag ka daya bhag",Main,1,567,26.841148,84.72588,Yes,Yes,Yes
7-Chanpatia [1-Paschim Champaran],252,"Utakramit Madhya Vidyalay, Dumari, Daschhin Bhag ka baya bhag",Auxiliary,668,1178,26.839734,84.64819,Yes,Yes,Yes
7-Chanpatia [1-Paschim Champaran],253,"Madhya Vidyalay, Nautan Khrurd, Dakshini Bhag",Main,1,837,26.839931,84.64289,Yes,Yes,Yes
7-Chanpatia [1-Paschim Champaran],254,Madhy Vidhyalay Nautan khurd Madhy Bhag,Main,1,770,26.839893,84.642929,Yes,Yes,Yes
7-Chanpatia [1-Paschim Champaran],255,Madhya Vidyalay Nautan Khurd Uttari Bhag ka daya bhag ,Main,1,555,26.839893,84.642929,Yes,Yes,Yes
7-Chanpatia [1-Paschim Champaran],255,Madhya Vidyalay Nautan Khurd Uttari Bhag ka baya bhag,Auxiliary,556,1354,26.818074,84.676052,Yes,Yes,Yes
7-Chanpatia [1-Paschim Champaran],256,"Utakramit Madhya Vidyalay, Semara Vritta, Urdu Naya Khand Purbi Bhag",Main,1,734,26.813081,84.675966,Yes,Yes,Yes
7-Chanpatia [1-Paschim Champaran],257,"Utakramit Madhya Vidyalay, Semara Vritta, Urdu Naya Khand Paschimi Bhag ka daya bhag",Main,1,507,26.813081,84.675966,Yes,Yes,Yes
7-Chanpatia [1-Paschim Champaran],257,"Utakramit Madhya Vidyalay, Semara Vritta, Urdu Naya Khand Paschimi Bhag ka daya bhag",Auxiliary,508,1154,26.810757,84.655024,Yes,Yes,Yes
7-Chanpatia [1-Paschim Champaran],258,Madhy Vidhyalay Mathiya Vrit Daya Bhag,Main,1,801,26.810651,84.655005,Yes,Yes,Yes
7-Chanpatia [1-Paschim Champaran],259,"Madhya Vidyalay, Mathiya Vritta Baya Bhag",Main,1,834,26.817989,84.645419,Yes,Yes,Yes
7-Chanpatia [1-Paschim Champaran],260,"Prathamik Vidyalay, Bekhabara ka daya bhag",Main,1,544,26.849267,84.668996,Yes,Yes,Yes
7-Chanpatia [1-Paschim Champaran],260,"Prathamik Vidyalay, Bekhabara ka baya bhag",Auxiliary,545,1115,26.855458,84.627249,Yes,Yes,Yes
7-Chanpatia [1-Paschim Champaran],261,"Rajakiy Utakramit Madhya Vidyalay, Dudha Mathiya Purwi Bhag ka daya bhag",Main,1,649,26.848226,84.62207,Yes,Yes,Yes
7-Chanpatia [1-Paschim Champaran],261,"Rajakiy Utakramit Madhya Vidyalay, Dudha Mathiya Purwi Bhag ka baya bhag",Auxiliary,650,1447,26.848226,84.62207,Yes,Yes,Yes
