3-Narkatiaganj [1-Paschim Champaran],051,"Utkramit Madhya Vidyalay,Maheshapur dakshin bhag",Main,1,894,27.036065,84.5174501,Yes,Yes,Yes
3-Narkatiaganj [1-Paschim Champaran],052,"Madhya Vidyalay Kukura, Uttri Bhag",Main,1,1004,27.0358593,84.5173874,Yes,Yes,Yes
3-Narkatiaganj [1-Paschim Champaran],053,"Madhya Vidyalay, Kukura, Dakshini Bhag(Daya Bhag)",Main,1,546,27.0358593,84.5173874,Yes,Yes,Yes
3-Narkatiaganj [1-Paschim Champaran],053,"Madhya Vidyalay, Kukura, Dakshini Bhag (Baya Bhag)",Auxiliary,547,1138,27.0358593,84.5173874,Yes,Yes,Yes
3-Narkatiaganj [1-Paschim Champaran],054,gandak karyalay maniyari Uttaribhag,Main,1,724,27.0361832,84.5174306,Yes,Yes,Yes
3-Narkatiaganj [1-Paschim Champaran],055,Gadank Karyalay Maniyari dakchin bhag,Main,1,765,27.0193417,84.4877367,Yes,Yes,Yes
3-Narkatiaganj [1-Paschim Champaran],056,"Samudaik Bhawan,Murali",Main,1,915,27.019325,84.4876717,Yes,Yes,Yes
3-Narkatiaganj [1-Paschim Champaran],057,"Utkramit Madhya Vidyalay, Odarava, UttariBhag",Main,1,975,27.019325,84.4876717,Yes,Yes,Yes
3-Narkatiaganj [1-Paschim Champaran],058,"Utakramit Madhya Vidyalay, Odrva, Dakshini Bhag (Daya Bhag)",Main,1,563,27.034985,84.501145,Yes,Yes,Yes
3-Narkatiaganj [1-Paschim Champaran],058,"Utakramit Madhya Vidyalay, Odrva, Dakshini Bhag (Baya Bhag)",Auxiliary,564,1128,27.0188883,84.5056733,Yes,Yes,Yes
3-Narkatiaganj [1-Paschim Champaran],059,"Rajkiya Prathmik Vidyalay, Padariya Uttaribhag",Main,1,835,27.019125,84.5055067,Yes,Yes,Yes
3-Narkatiaganj [1-Paschim Champaran],060,"Rajkiya Prathmik Vidyalay, Padariya dakchini bhag",Main,1,747,27.01909,84.5054917,Yes,Yes,Yes
3-Narkatiaganj [1-Paschim Champaran],061,"Madarasa Nautanava, Uttari Bhag (Daya Bhag)",Main,1,695,27.01905,84.5054767,Yes,Yes,Yes
3-Narkatiaganj [1-Paschim Champaran],061,"Madarasa Nautanava, Uttari Bhag (Baya Bhag)",Auxiliary,696,1393,27.01905,84.5054767,Yes,Yes,Yes
3-Narkatiaganj [1-Paschim Champaran],062,"Madarasa Nautanava, Madhya Bhag (Daya Bhag)",Main,1,534,27.01905,84.5054767,Yes,Yes,Yes
3-Narkatiaganj [1-Paschim Champaran],062,"Madarasa Nautanava, Madhya Bhag (Baya Bhag)",Auxiliary,535,1080,27.049855,84.4830017,Yes,Yes,Yes
3-Narkatiaganj [1-Paschim Champaran],063,"Madarasa Nautanava, Dakshini Bhag Ka Utar Bhag (Daya Bhag)",Main,1,520,27.0498617,84.4831867,Yes,Yes,Yes
3-Narkatiaganj [1-Paschim Champaran],063,"Madarasa Nautanava, Dakshini Bhag Ka Utar Bhag (Baya Bhag)",Auxiliary,521,1067,27.0498617,84.4831867,Yes,Yes,Yes
3-Narkatiaganj [1-Paschim Champaran],064,"Madarasa Nautanava, Dakshini Bhag Ka Dakshin Bhag(Daya Bhag)",Main,1,563,27.0342933,84.4683633,Yes,Yes,Yes
3-Narkatiaganj [1-Paschim Champaran],064,"Madarasa Nautanava, Dakshini Bhag Ka Dakshin Bhag (Baya Bhag)",Auxiliary,564,1129,27.0333267,84.468335,Yes,Yes,Yes
3-Narkatiaganj [1-Paschim Champaran],065,"Panchayat Bhawan, Fulavariya",Main,1,706,27.0342933,84.4683633,Yes,Yes,Yes
3-Narkatiaganj [1-Paschim Champaran],065,"Prathmik Vidyalay, Fulavariya",Auxiliary,707,1435,27.039095,84.4840667,Yes,Yes,Yes
3-Narkatiaganj [1-Paschim Champaran],066,"Utkramit Madhya Vidyalay, sukhwaniya pachimi bhag ka baya bhag",Main,1,709,27.039095,84.4840667,Yes,Yes,Yes
3-Narkatiaganj [1-Paschim Champaran],067,"Utkramit Madhya Vidyalay, sukhwaniya pachimi bhag ka daya bhag",Main,1,704,27.0371917,84.4873967,Yes,Yes,Yes
3-Narkatiaganj [1-Paschim Champaran],068,"Prathmik Vidyalay, Thathava",Main,1,858,27.0413783,84.4932983,Yes,Yes,Yes
3-Narkatiaganj [1-Paschim Champaran],069,"Utkramit Madhya Vidyalay,Durgavaliya (Daya Bhag)",Main,1,580,27.04885,84.4250442,Yes,Yes,Yes
3-Narkatiaganj [1-Paschim Champaran],069,"Utkramit Madhya Vidyalay,Durgavaliya (Baya Bhag)",Auxiliary,581,1193,27.04884,84.4250442,Yes,Yes,Yes
3-Narkatiaganj [1-Paschim Champaran],070,"Kanya Madhya Vidyalay, Gokhula Purvi Bhag (Daya Bhag)",Main,1,560,27.0487225,84.4248575,Yes,Yes,Yes
3-Narkatiaganj [1-Paschim Champaran],070,"Kanya Madhya Vidyalay, Gokhula Purvi Bhag (Baya Bhag)",Auxiliary,561,1127,27.0487225,84.4248575,Yes,Yes,Yes
3-Narkatiaganj [1-Paschim Champaran],071,kanya Madhya vidyalay gokhula Madhya bhag,Main,1,814,27.0540849,84.449004,Yes,Yes,Yes
3-Narkatiaganj [1-Paschim Champaran],072,"Utkramit Madhya Vidyalay, gadiyani (Daya Bhag)",Main,1,545,27.0540849,84.449004,Yes,Yes,Yes
3-Narkatiaganj [1-Paschim Champaran],072,"Utkramit Madhya Vidyalay, gadiyani (Baya Bhag)",Auxiliary,546,1106,27.0358215,84.4535718,Yes,Yes,Yes
3-Narkatiaganj [1-Paschim Champaran],073,"Madhya Vidyalay, Mathura, Purvi Bhag (Daya Bhag)",Main,1,531,27.0700988,84.5581268,Yes,Yes,Yes
3-Narkatiaganj [1-Paschim Champaran],073,"Madhya Vidyalay, Mathura, Purvi Bhag(Baya Bhag)",Auxiliary,532,1074,27.0700988,84.5581268,Yes,Yes,Yes
3-Narkatiaganj [1-Paschim Champaran],074,"Madhya Vidyalay, Mathura, Paschimi Bhag",Main,1,982,27.0700988,84.5581268,Yes,Yes,Yes
3-Narkatiaganj [1-Paschim Champaran],075,"Prathmik Vidyalay, Siyarahi (Daya Bhag)",Main,1,586,27.0580964,84.5824565,Yes,Yes,Yes
3-Narkatiaganj [1-Paschim Champaran],075,"Prathmik Vidyalay, Siyarahi (Baya Bhag)",Auxiliary,587,1220,27.0580964,84.5824565,Yes,Yes,Yes
3-Narkatiaganj [1-Paschim Champaran],076,"Prathmik Vidyalay, Nanhakar",Main,1,841,27.0948466,84.5530097,Yes,Yes,Yes
3-Narkatiaganj [1-Paschim Champaran],077,"Utkramit Madhya Vidyalay, Champapur (Daya Bhag)",Main,1,678,27.113645,84.54912,Yes,Yes,Yes
3-Narkatiaganj [1-Paschim Champaran],077,"Utkramit Madhya Vidyalay, Champapur(Baya Bhag)",Auxiliary,679,1427,27.113645,84.54912,Yes,Yes,Yes
3-Narkatiaganj [1-Paschim Champaran],078,"Prathmik Vidyalay, Budhava (Daya Bhag)",Main,1,526,27.112725,84.55472,Yes,Yes,Yes
3-Narkatiaganj [1-Paschim Champaran],078,"Prathmik Vidyalay, Budhava (Baya Bhag)",Auxiliary,527,1068,27.112725,84.55472,Yes,Yes,Yes
3-Narkatiaganj [1-Paschim Champaran],079,"Utkramit Madhya Vidyalay,motihari urari bhag",Main,1,782\,27.0987117,84.5491317,Yes,Yes,Yes
3-Narkatiaganj [1-Paschim Champaran],080,"Utkramit Madhya Vidyalay, Motihari dakshin bhag",Main,1,778,27.12769,84.5315867,Yes,Yes,Yes
3-Narkatiaganj [1-Paschim Champaran],081,"Utkarmit MadhyaVidyalay, Rakhahi Pashchimi Purwi Bhag",Main,1,1014,27.1275447,84.5315393,Yes,Yes,Yes
3-Narkatiaganj [1-Paschim Champaran],082,"Utkarmit Madhya Vidyalay, Rakhahi Pashchim Pashchim Bhag",Main,1,875,27.1275447,84.5315393,Yes,Yes,Yes
3-Narkatiaganj [1-Paschim Champaran],083,"Utkramti Madhya Vidyalay, sisaee puravi bhag",Main,1,825,27.1066317,84.5275883,Yes,Yes,Yes
3-Narkatiaganj [1-Paschim Champaran],084,"Utkramit Madhya Vidyalay, Sisahi pashchim bhag",Main,1,812,27.1066317,84.5275883,Yes,Yes,Yes
3-Narkatiaganj [1-Paschim Champaran],085,"Utkramit Madhya Vidyalay, Trilokava",Main,1,507,27.1673583,84.54724,Yes,Yes,Yes
3-Narkatiaganj [1-Paschim Champaran],086,"Utkramti Madhya Vidyalay, kesariya puravi bhag ka daya bhag",Main,1,964,27.1476478,84.5396629,Yes,Yes,Yes
3-Narkatiaganj [1-Paschim Champaran],087,"Utkramti Madhya Vidyalay, keshariya puravi bhag ka baya bhag",Main,1,980,27.1475584,84.5397801,Yes,Yes,Yes
3-Narkatiaganj [1-Paschim Champaran],088,"Utkramit Madhya Vidyalay, Keshariya,pachimi bhag ka baya bhag",Main,1,828,27.1475584,84.5397801,Yes,Yes,Yes
3-Narkatiaganj [1-Paschim Champaran],089,"Utkramti Madhya Vidyalay,keshariya pachimi bhag ka daya bhag",Main,1,866,27.1475584,84.5397801,Yes,Yes,Yes
3-Narkatiaganj [1-Paschim Champaran],090,"Rajkiya Madhay Vidhalaya, Dhobaha purvi bhag",Main,1,921,27.143108,84.5502455,Yes,Yes,Yes
3-Narkatiaganj [1-Paschim Champaran],091,"Rajkiyaa Madhya Vidayalay, Dhobahan, Paschimi Bhag",Main,1,894,27.1411933,84.5479566,Yes,Yes,Yes
3-Narkatiaganj [1-Paschim Champaran],092,"Utkramit Madhay Vidhalaya, Bhediharwa Tola , Dhobaha Purvi Bhag",Main,1,752,27.1411933,84.5479566,Yes,Yes,Yes
3-Narkatiaganj [1-Paschim Champaran],093,"Utkramit Madhya Vidyalay, Bhedihari Tola, Dhobaha, Paschmi Bhag",Main,1,830,27.1411933,84.5479566,Yes,Yes,Yes
3-Narkatiaganj [1-Paschim Champaran],094,"Prathmik Vidyalay, Mujauna",Main,1,546,27.1423163,84.528016,Yes,Yes,Yes
3-Narkatiaganj [1-Paschim Champaran],095,Panchayat Bhawan D. K. (Divanaji Ka) Shikarapur Purvi Bhag,Main,1,560,27.1403383,84.4941222,Yes,Yes,Yes
3-Narkatiaganj [1-Paschim Champaran],095,"Pacs Godown, D.K.(Divanaji Ka) Shikarapur",Auxiliary,561,1174,27.1380716,84.4952092,Yes,Yes,Yes
3-Narkatiaganj [1-Paschim Champaran],096,"Prathmik Vidyalay, D K (Divanji ka) Shikarpur, Paschimi Bhag",Main,1,941,27.1403383,84.4941222,Yes,Yes,Yes
3-Narkatiaganj [1-Paschim Champaran],097,Rajkiya Madhya Vidyalay D. K. Shikarpur Pashchim Bhag,Main,1,935,27.1404162,84.4940745,Yes,Yes,Yes
3-Narkatiaganj [1-Paschim Champaran],098,"Rajkiya Madhya Vidyalay,D.K. Shikarpur, Purvi Bhag Ka Baya Bhag (Daya Bhag)",Main,1,702,27.1380829,84.495162,Yes,Yes,Yes
3-Narkatiaganj [1-Paschim Champaran],098,"Rajkiya Madhya Vidyalay,D.K. Shikarpur, Purvi Bhag Ka Baya Bhag (Baya Bhag)",Auxiliary,703,1479,27.1380829,84.495162,Yes,Yes,Yes
3-Narkatiaganj [1-Paschim Champaran],099,Prathmik Vidyalay Kanya Shikarpur (Daya Bhag),Main,1,532,27.13562,84.4968723,Yes,Yes,Yes
3-Narkatiaganj [1-Paschim Champaran],099,Prathmik Vidyalay Kanya Shikarpur(Baya Bhag),Auxiliary,533,1096,27.13562,84.4968723,Yes,Yes,Yes
3-Narkatiaganj [1-Paschim Champaran],100,"Utakramit Madhaya Vidhalaya, Malda-Maldi",Main,1,902,27.151244,84.553274,Yes,Yes,Yes
3-Narkatiaganj [1-Paschim Champaran],101,Utakramit Madhya Vidyalay Bairiya Purvi Bhag,Main,1,739,27.1217659,84.4975462,Yes,Yes,Yes
3-Narkatiaganj [1-Paschim Champaran],102,"Utakramit Madhya Vidyalay Bairiya, Pachmi Bhag (Daya Bhag)",Main,1,520,27.1218044,84.4976259,Yes,Yes,Yes
3-Narkatiaganj [1-Paschim Champaran],102,"Utakramit Madhya Vidyalay Bairiya, Pachmi Bhag (Baya Bhag)",Auxiliary,521,1061,27.1218044,84.4976259,Yes,Yes,Yes
3-Narkatiaganj [1-Paschim Champaran],103,"Utakramit Madhya Vidyalay, Katagharava (Daya Bhag)",Main,1,517,27.0968873,84.4996151,Yes,Yes,Yes
3-Narkatiaganj [1-Paschim Champaran],103,"Utakramit Madhya Vidyalay, Katagharava (Baya Bhag)",Auxiliary,518,1054,27.0968873,84.4996151,Yes,Yes,Yes
3-Narkatiaganj [1-Paschim Champaran],104,"Prathmik Vidyalay, Narakatiya",Main,1,663,27.10292,84.4943235,Yes,Yes,Yes
3-Narkatiaganj [1-Paschim Champaran],105,Prathimik Vidhalya Bishunpurwa (Daya Bhag),Main,1,554,27.1169131,84.4931872,Yes,Yes,Yes
3-Narkatiaganj [1-Paschim Champaran],105,Prathimik Vidhalya Bishunpurwa(Baya Bhag),Auxiliary,555,1112,27.1169131,84.4931872,Yes,Yes,Yes
3-Narkatiaganj [1-Paschim Champaran],106,"Rajkiya Prathmik Vidyalay, Taraharava",Main,1,489,27.1047964,84.5006455,Yes,Yes,Yes
3-Narkatiaganj [1-Paschim Champaran],107,"Prathmik Vidayalay, Maldi (Daya Bhag)",Main,1,587,27.1237946,84.548214,Yes,Yes,Yes
3-Narkatiaganj [1-Paschim Champaran],107,"Prathmik Vidayalay, Maldi (Baya Bhag)",Auxiliary,588,1192,27.1237946,84.548218,Yes,Yes,Yes
3-Narkatiaganj [1-Paschim Champaran],108,"Rajkiya Prathmik Vidyalay, Chintamanapur",Main,1,594,27.1137946,84.518218,Yes,Yes,Yes
3-Narkatiaganj [1-Paschim Champaran],109,"Utakramit Madhya Vidyalay, Bhasurari, UttariBhag",Main,1,1006,27.0895332,84.5163523,Yes,Yes,Yes
3-Narkatiaganj [1-Paschim Champaran],110,"Utkramit Madhya Vidyalay, Bhasurari Dakhsni Bhag",Main,1,857,27.0894428,84.516305,Yes,Yes,Yes
3-Narkatiaganj [1-Paschim Champaran],111,T. P. Varma College Narakatiyaganj Purvi Bhag (Daya Bhag),Main,1,546,27.1210367,84.46629,Yes,Yes,Yes
3-Narkatiaganj [1-Paschim Champaran],111,T. P. Varma College Narakatiyaganj Purvi Bhag (Baya Bhag),Auxiliary,547,1125,27.1210367,84.46629,Yes,Yes,Yes
3-Narkatiaganj [1-Paschim Champaran],112,"T P Verma College, Narkatiaganj, Paschimi Bhag",Main,1,995,27.1410533,84.4863117,Yes,Yes,Yes
3-Narkatiaganj [1-Paschim Champaran],113,"Matisara Kunwar Balika Uchcha Vidyalay, Narakatiyaganj Purwi Bhag (Daya Bhag)",Main,1,719,27.1410533,84.4863117,Yes,Yes,Yes
3-Narkatiaganj [1-Paschim Champaran],113,"Matisara Kunwar Balika Uchcha Vidyalay, Narakatiyaganj Purwi Bhag (Baya Bhag)",Auxiliary,720,1474,27.1410533,84.4863117,Yes,Yes,Yes
3-Narkatiaganj [1-Paschim Champaran],114,"Matisara Kunwar Balika Unch Vidhalaya Narkatiaganj, Paschim Bhag Ka Baya Bhag",Main,1,841,27.1410533,84.4863117,Yes,Yes,Yes
3-Narkatiaganj [1-Paschim Champaran],115,"Matisara Kunwar Balika Unch Vidhalaya Narkatiaganj, Paschim Bhag Ka Baya Bhag",Main,1,873,27.1410533,84.4863117,Yes,Yes,Yes
3-Narkatiaganj [1-Paschim Champaran],116,"Prathmik Vidyalay, Nandapur, Purvi bhag (Daya Bhag)",Main,1,606,27.141254,84.55454,Yes,Yes,Yes
3-Narkatiaganj [1-Paschim Champaran],116,"Prathmik Vidyalay, Nandapur, Purvi bhag (Baya Bhag)",Auxiliary,607,1250,27.141254,84.55454,Yes,Yes,Yes
3-Narkatiaganj [1-Paschim Champaran],117,"Prathmik Vidyalay, Nandpur, Pachim Bhag (Daya Bhag)",Main,1,640,27.141254,84.55454,Yes,Yes,Yes
3-Narkatiaganj [1-Paschim Champaran],117,"Prathmik Vidyalay, Nandpur, Pachim Bhag (Baya Bhag)",Auxiliary,641,1295,27.141254,84.55454,Yes,Yes,Yes
3-Narkatiaganj [1-Paschim Champaran],118,"Rajkiya Prathmik Vidalaya, Khodi Nandpur Purvi Bhag",Main,1,820,27.131254,84.56454,Yes,Yes,Yes
3-Narkatiaganj [1-Paschim Champaran],119,"Rajkiya Prathmik Vidyalay, Khodi Nandapur Pachim Bhag",Main,1,884,27.141254,84.55454,Yes,Yes,Yes
3-Narkatiaganj [1-Paschim Champaran],120,"Rajkiya Madhya Vidyalay,Narakatiyaganj Hindi Daya Bhag (Daya Bhag)",Main,1,535,27.1088717,84.4683683,Yes,Yes,Yes
3-Narkatiaganj [1-Paschim Champaran],120,"Rajkiya Madhya Vidyalay,Narakatiyaganj Hindi , Daya Bhag (Baya Bhag)",Auxiliary,536,1084,27.1088717,84.4683683,Yes,Yes,Yes
3-Narkatiaganj [1-Paschim Champaran],121,"Rajkiya Madhya Vidyalay,Narakatiyaganj Hindi , Baya Bhag",Main,1,975,27.1088717,84.4683683,Yes,Yes,Yes
3-Narkatiaganj [1-Paschim Champaran],122,"Rajkiya Madhya Vidyalay,Narakatiyaganj Hindi Dakshini Bhag",Main,1,1011,27.1088483,84.468475,Yes,Yes,Yes
3-Narkatiaganj [1-Paschim Champaran],123,+2 Uchch Vidyalay Narakatiyaganj Purvi Bhag (Daya Bhag),Main,1,602,27.1210514,84.4654782,Yes,Yes,Yes
3-Narkatiaganj [1-Paschim Champaran],123,+2 Uchch Vidyalay Narakatiyaganj Purvi Bhag (Baya Bhag),Auxiliary,603,1278,27.1210514,84.4654782,Yes,Yes,Yes
3-Narkatiaganj [1-Paschim Champaran],124,+2 Uchch Vidyalay Narakatiyaganj Madhya Bhag ka Purvi Bhag (Daya Bhag),Main,1,578,27.1210514,84.4654782,Yes,Yes,Yes
3-Narkatiaganj [1-Paschim Champaran],124,+2 Uchch Vidyalay Narakatiyaganj Madhya Bhag ka Purvi Bhag (Baya Bhag),Auxiliary,579,1190,27.1210514,84.4654782,Yes,Yes,Yes
3-Narkatiaganj [1-Paschim Champaran],125,+2 Uchch Vidyalay Narakatiyaganj Madhya Bhag ka Pachim Bhag,Main,1,857,27.1210514,84.4654782,Yes,Yes,Yes
3-Narkatiaganj [1-Paschim Champaran],126,+2 Uchch Vidyalay Narakatiyaganj Madhya Bhag (Daya Bhag),Main,1,722,27.1210514,84.4654782,Yes,Yes,Yes
3-Narkatiaganj [1-Paschim Champaran],126,+2 Uchch Vidyalay Narakatiyaganj Madhya Bhag (Baya Bhag),Auxiliary,723,1457,27.1210514,84.4654782,Yes,Yes,Yes
3-Narkatiaganj [1-Paschim Champaran],127,Town club khelkud sansthan Narkatiaganj Purvi Bhawan,Main,1,1024,27.1126167,84.4648967,Yes,Yes,Yes
3-Narkatiaganj [1-Paschim Champaran],128,"Town club khelkud sansthan Narkatiaganj, Dakshini Bhawan",Main,1,966,27.1126167,84.4648967,Yes,Yes,Yes
3-Narkatiaganj [1-Paschim Champaran],129,Nibandhan Karyalay Shikarpur (Daya Bhag),Main,1,607,27.1110217,84.4663583,Yes,Yes,Yes
3-Narkatiaganj [1-Paschim Champaran],129,Nibandhan Karyalay Shikarpur (Baya Bhag),Auxiliary,608,1238,27.1110217,84.4663583,Yes,Yes,Yes
3-Narkatiaganj [1-Paschim Champaran],130,+2 Uchch Vidyalay Narakatiyaganj Paschimi Bhag Ka Baya Bhag,Main,1,905,27.1210514,84.4654782,Yes,Yes,Yes
3-Narkatiaganj [1-Paschim Champaran],131,+2 Uchch Vidyalay Narakatiyaganj Paschimi Bhag Ka Baya Bhag,Main,1,845,27.1210514,84.4654782,Yes,Yes,Yes
3-Narkatiaganj [1-Paschim Champaran],132,"Rajkiya Madhya Vidyalay Narakatiyaganj Kanya, Uttari Bhag (Daya Bhag)",Main,1,529,27.10564,84.47854,Yes,Yes,Yes
3-Narkatiaganj [1-Paschim Champaran],132,Rajkiya Madhya Vidyalay Narakatiyaganj Kanya Uttari Bhag (Baya Bhag),Auxiliary,530,1075,27.10564,84.47854,Yes,Yes,Yes
3-Narkatiaganj [1-Paschim Champaran],133,Rajkiya Madhya Vidyalay Narakatiyaganj Kanya Dakshini Bhag,Main,1,788,27.10564,84.47854,Yes,Yes,Yes
3-Narkatiaganj [1-Paschim Champaran],134,Railway Manoranjan Bhawan Narakatiyaganj,Main,1,811,27.10324,84.46297,Yes,Yes,Yes
3-Narkatiaganj [1-Paschim Champaran],135,"Parathamik Vidyalay Hardiya, Narkatiaganj UttariBhag",Main,1,931,27.11324,84.47297,Yes,Yes,Yes
3-Narkatiaganj [1-Paschim Champaran],136,Prathmik Vidyalay Haradiya Narakatiyaganj Dakshani Bhag,Main,1,801,27.11324,84.47297,Yes,Yes,Yes
3-Narkatiaganj [1-Paschim Champaran],137,"Janki Sanskrit Mahavidhalaya, Narkatiaganj Uttari Bhag ke Uttari Bhag (Daya Bhag)",Main,1,671,27.100915,84.4644533,Yes,Yes,Yes
3-Narkatiaganj [1-Paschim Champaran],137,"Janki Sanskrit Mahavidhalaya, Narkatiaganj UttariBhag ke UttariBhag (Baya Bhag)",Auxiliary,672,1334,27.100915,84.4644533,Yes,Yes,Yes
3-Narkatiaganj [1-Paschim Champaran],138,"Janki Sanskrit Mahavidhalaya, Narkatiaganj Dakshani Bhag ke Dakshani Bhag",Main,1,897,27.100915,84.4644533,Yes,Yes,Yes
3-Narkatiaganj [1-Paschim Champaran],139,"Janaki Sanskrit Mahavidhyala Narakatiyaganj, UttariBhag (Daya Bhag)",Main,1,587,27.1009,84.4644683,Yes,Yes,Yes
3-Narkatiaganj [1-Paschim Champaran],139,"Janaki Sanskrit Mahavidhyala Narakatiyaganj, Uttari Bhag (Baya Bhag)",Auxiliary,588,1185,27.1009,84.4644683,Yes,Yes,Yes
3-Narkatiaganj [1-Paschim Champaran],140,"Janaki Sanskrit Mahavidhyala Narakatiyaganj, Dakchni Bhag",Main,1,934,27.1009,84.4644683,Yes,Yes,Yes
3-Narkatiaganj [1-Paschim Champaran],141,"Railway Praveshika Vidyalay Narkatiaganj, Pachim Bhag",Main,1,837,27.10179,84.47094,Yes,Yes,Yes
3-Narkatiaganj [1-Paschim Champaran],142,Railway Praveshika Vidyalay Narkatiaganj Purvi Bhag,Main,1,868,27.10179,84.47094,Yes,Yes,Yes
3-Narkatiaganj [1-Paschim Champaran],143,"Vivah Bhawan, Prakhand Parisar, Narkatiaganj UttariBhag (Daya Bhag)",Main,1,600,27.1004307,84.4653504,Yes,Yes,Yes
3-Narkatiaganj [1-Paschim Champaran],143,"Vivah Bhawan, Prakhand Parisar, Narkatiaganj UttariBhag (Baya Bhag)",Auxiliary,601,1236,27.0988467,84.464235,Yes,Yes,Yes
3-Narkatiaganj [1-Paschim Champaran],144,"Railwy Praveshika Vidhalay, Narkatiaganj Dakshani Bhag",Main,1,905,27.10179,84.47094,Yes,Yes,Yes
3-Narkatiaganj [1-Paschim Champaran],145,"Vivah Bhawan, Prakhand Parisar, Narkatiaganj Dakshini Bhag (Daya Bhag)",Main,1,529,27.09894,84.464185,Yes,Yes,Yes
3-Narkatiaganj [1-Paschim Champaran],145,"Vivah Bhawan, Prakhand Parisar, Narkatiaganj Dakshini Bhag (Baya Bhag)",Auxiliary,530,1098,27.09894,84.464185,Yes,Yes,Yes
3-Narkatiaganj [1-Paschim Champaran],146,"Utkarmit Madhya Vidyalay, Jaymangalapur (Daya Bhag)",Main,1,651,27.0622695,84.464474,Yes,Yes,Yes
3-Narkatiaganj [1-Paschim Champaran],146,"Utkarmit Madhya Vidyalay, Jaymangalapur (Baya Bhag)",Auxiliary,652,1329,27.0622695,84.464474,Yes,Yes,Yes
3-Narkatiaganj [1-Paschim Champaran],147,Rajkiya Prathmik Vidyalay Barwa (Daya Bhag),Main,1,614,27.0894027,84.4778011,Yes,Yes,Yes
3-Narkatiaganj [1-Paschim Champaran],147,Rajkiya Prathmik Vidyalay Barwa (Baya Bhag),Auxiliary,615,1264,27.1030969,84.4449187,Yes,Yes,Yes
3-Narkatiaganj [1-Paschim Champaran],148,"Utkramit Madhya Vidyalay, Dhumnagar, Purwi Bhag Ka Daya bhag",Main,1,870,27.1030969,84.4449187,Yes,Yes,Yes
3-Narkatiaganj [1-Paschim Champaran],149,"Utkramit Madhay Vidhalaya, Dhumnagar, Purvi Bhag Ka Baya Bhag",Main,1,849,27.1030969,84.4449187,Yes,Yes,Yes
3-Narkatiaganj [1-Paschim Champaran],150,"Utkarmit Madhay Vidhalaya,Dhumnagar, Paschmi Bhag Ka Bhaya Bhag",Main,1,863,27.1028106,84.4446517,Yes,Yes,Yes
3-Narkatiaganj [1-Paschim Champaran],151,"Utkramit Madhya Vidyalay,Dhumnagar Paschmi Bhag ka Baya bhag",Main,1,863,27.1028106,84.4446517,Yes,Yes,Yes
3-Narkatiaganj [1-Paschim Champaran],152,"Rajkiyaa Prathmik Vidyalay,Gadiyani Shiksha Pariyojana Dhumnagar Purvi Bhag",Main,1,914,27.1024934,84.4564817,Yes,Yes,Yes
3-Narkatiaganj [1-Paschim Champaran],153,"Rajkiya Prathmik Vidhalaya, Gadiyani shiksha Pariyojna Dhumnagar Paschimi Bhag",Main,1,835,27.1024934,84.4564817,Yes,Yes,Yes
3-Narkatiaganj [1-Paschim Champaran],154,"Utakramit Madhya Vidyalay, Jamuniya (Daya Bhag)",Main,1,651,27.0781008,84.4663436,Yes,Yes,Yes
3-Narkatiaganj [1-Paschim Champaran],154,"Utakramit Madhya Vidyalay, Jamuniya (Baya Bhag)",Auxiliary,652,1313,27.0781008,84.4663436,Yes,Yes,Yes
3-Narkatiaganj [1-Paschim Champaran],155,"Prathmik Vidyalay, Takiya Paschimi Bhag (Daya Bhag)",Main,1,636,27.1352361,84.3621112,Yes,Yes,Yes
3-Narkatiaganj [1-Paschim Champaran],155,"Prathmik Vidyalay, Takiya Paschimi Bhag (Baya Bhag)",Auxiliary,637,1325,27.1352361,84.3621112,Yes,Yes,Yes
3-Narkatiaganj [1-Paschim Champaran],156,Utkramit Madhya Vidyalay Dhanakutava,Main,1,954,27.118931,84.3751751,Yes,Yes,Yes
3-Narkatiaganj [1-Paschim Champaran],157,"Samudayik Bhawan Dakahava,",Main,1,684,27.1024934,84.4564817,Yes,Yes,Yes
3-Narkatiaganj [1-Paschim Champaran],158,"Madhya Vidyalay, Siswa Bahuarava Uttari Bhag",Main,1,530,27.1114205,84.3984979,Yes,Yes,Yes
3-Narkatiaganj [1-Paschim Champaran],159,"Madhya Vidyalay, Siswa Bahuarava Madhya Bhag",Main,1,510,27.1114703,84.3984605,Yes,Yes,Yes
3-Narkatiaganj [1-Paschim Champaran],160,"Madhya Vidyalay, Siswa Bahuarava, Dakshini Bhag (Daya Bhag)",Main,1,669,27.1114205,84.3984979,Yes,Yes,Yes
3-Narkatiaganj [1-Paschim Champaran],160,"Madhya Vidyalay, Siswa Bahuarava, Dakshini Bhag (Baya Bhag)",Auxiliary,670,1366,27.1114703,84.3984605,Yes,Yes,Yes
3-Narkatiaganj [1-Paschim Champaran],161,"Prathmik Vidyalay, Serahava Dakahwa (Daya Bhag)",Main,1,559,27.125412,84.405645,Yes,Yes,Yes
3-Narkatiaganj [1-Paschim Champaran],161,"Prathmik Vidyalay, SerahavaDakahwa (Baya Bhag)",Auxiliary,560,1127,27.125412,84.405645,Yes,Yes,Yes
3-Narkatiaganj [1-Paschim Champaran],162,"Harijan Samudayik Bhawan, Serahava Bhantadih",Main,1,854,27.125412,84.405645,Yes,Yes,Yes
3-Narkatiaganj [1-Paschim Champaran],163,"Madhya Vidyalay, Dumariya Uttari Bhag Ka Daya Bhag",Main,1,915,27.1035473,84.4549606,Yes,Yes,Yes
3-Narkatiaganj [1-Paschim Champaran],164,"Madhaya Vidhalay Dumariya, UttariBhag Ka Baya Bhag",Main,1,843,27.1035473,84.4549606,Yes,Yes,Yes
3-Narkatiaganj [1-Paschim Champaran],165,"Rajkiya Madhya Vidyalay, Dumariya, Dakshini Bhag (Daya Bhag)",Main,1,549,27.1275832,84.3517215,Yes,Yes,Yes
3-Narkatiaganj [1-Paschim Champaran],165,"Rajkiya Madhya Vidyalay, Dumariya, Dakshini Bhag (Baya Bhag)",Auxiliary,550,1136,27.1035473,84.4549606,Yes,Yes,Yes
3-Narkatiaganj [1-Paschim Champaran],166,Utkramit Madhya Vidyalay Ramapur Sakaraul UttariBhag (Daya Bhag),Main,1,672,27.1275832,84.3517215,Yes,Yes,Yes
3-Narkatiaganj [1-Paschim Champaran],166,Utkramit Madhya Vidyalay Ramapur Sakaraul UttariBhag (Baya Bhag),Auxiliary,673,1396,27.1275832,84.3517215,Yes,Yes,Yes
3-Narkatiaganj [1-Paschim Champaran],167,"Utkramit Madhya Vidyalay Ramapur Sakaraul, Dakshini Bhag",Main,1,581,27.1275832,84.3517215,Yes,Yes,Yes
3-Narkatiaganj [1-Paschim Champaran],168,"Prathmik Vidyalay, Lediharava",Main,1,543,27.0967536,84.3580024,Yes,Yes,Yes
3-Narkatiaganj [1-Paschim Champaran],169,"Prathmik Vidyalay, Madhubani (Daya Bhag)",Main,1,710,27.1063191,84.3484949,Yes,Yes,Yes
3-Narkatiaganj [1-Paschim Champaran],169,"Prathmik Vidyalay, Madhubani (Baya Bhag)",Auxiliary,711,1439,27.1063191,84.3484949,Yes,Yes,Yes
3-Narkatiaganj [1-Paschim Champaran],170,"Prathmik Vidyalay, Murali (Daya Bhag)",Main,1,563,27.1020864,84.4867592,Yes,Yes,Yes
3-Narkatiaganj [1-Paschim Champaran],170,"Prathmik Vidyalay, Murali (Baya Bhag)",Auxiliary,564,1193,27.1020864,84.4867592,Yes,Yes,Yes
3-Narkatiaganj [1-Paschim Champaran],171,"Utkramit Madhya Vidyalay ,Pipara",Main,1,905,27.0980864,84.3867592,Yes,Yes,Yes
3-Narkatiaganj [1-Paschim Champaran],172,"Rajkiya Madhay Vidhalay, Sugauli,Purvi Bhag (Daya Bhag)",Main,1,644,27.0788086,84.406759,Yes,Yes,Yes
3-Narkatiaganj [1-Paschim Champaran],172,"Rajkiya Madhay Vidhalay, Sugauli,Purvi Bhag (Baya Bhag)",Auxiliary,645,1331,27.0788086,84.406759,Yes,Yes,Yes
3-Narkatiaganj [1-Paschim Champaran],173,"Rajkiya Madhay Vidhalay, Sugauli, paschim Bhag Ka Daya Bhag",Main,1,776,27.0788086,84.406759,Yes,Yes,Yes
3-Narkatiaganj [1-Paschim Champaran],174,"Rajkiya Madhya Vidyalay, Sugauli, Paschim Bhag ka Baya bhag",Main,1,848,27.0788086,84.406759,Yes,Yes,Yes
3-Narkatiaganj [1-Paschim Champaran],175,"Utkramit Madhya Vidyalay, Mujauna (Daya Bhag)",Main,1,711,27.078564,84.451254,Yes,Yes,Yes
3-Narkatiaganj [1-Paschim Champaran],175,"Utkramit Madhya Vidyalay, Mujauna (Baya Bhag)",Auxiliary,712,1410,27.078564,84.451254,Yes,Yes,Yes
3-Narkatiaganj [1-Paschim Champaran],176,"Prathmik Vidyalay, Laukariya",Main,1,829,27.065412,84.4456,Yes,Yes,Yes
3-Narkatiaganj [1-Paschim Champaran],177,"Utkarmit Madhay Vidhalaya, Anjua UttariBhag Ka Daya Bhag",Main,1,744,27.0755,84.4566,Yes,Yes,Yes
3-Narkatiaganj [1-Paschim Champaran],178,"Utkramit Madhya Vidyalay, Anjua UttariBhag ka Baya bhag",Main,1,724,27.0755,84.4566,Yes,Yes,Yes
3-Narkatiaganj [1-Paschim Champaran],179,"Utkramit Madhya Vidyalay,Anjua Dakshin Bhag",Main,1,713,27.0755,84.4566,Yes,Yes,Yes
3-Narkatiaganj [1-Paschim Champaran],180,"Utkramit Madhya Vidyalay, Anjua Paschimi Daya Bhag",Main,1,1019,27.0755,84.4566,Yes,Yes,Yes
3-Narkatiaganj [1-Paschim Champaran],181,"Utakramit Madhya Vidyalay, Ajua, Paschimi Baya Bhag",Main,1,977,27.0755,84.4566,Yes,Yes,Yes
3-Narkatiaganj [1-Paschim Champaran],182,Utkramit Madhya Vidyalay Chaturbhajava Purwi Bhag (Daya Bhag),Main,1,616,27.0655,84.470045,Yes,Yes,Yes
3-Narkatiaganj [1-Paschim Champaran],182,Utkramit Madhya Vidyalay Chaturbhajava Purwi Bhag (Baya Bhag),Auxiliary,617,1235,27.0655,84.470045,Yes,Yes,Yes
3-Narkatiaganj [1-Paschim Champaran],183,"Prathmik Vidyalay, Chartubhujava Purwi Bhag ka Pachmi Bhag",Main,1,1048,27.0655,84.470045,Yes,Yes,Yes
3-Narkatiaganj [1-Paschim Champaran],184,Utkramit Madhya Vidyalay Chaturbhajava Pachim Bhag,Main,1,576,27.0655,84.470045,Yes,Yes,Yes
3-Narkatiaganj [1-Paschim Champaran],185,"Utkramit Madhya Vidyalay, Banawariya (Daya Bhag)",Main,1,721,27.06879,84.471588,Yes,Yes,Yes
3-Narkatiaganj [1-Paschim Champaran],185,"Utkramit Madhya Vidyalay, Banawariya (Baya Bhag)",Auxiliary,722,1045,27.06879,84.471588,Yes,Yes,Yes
