128-Raghopur [18-Vaishali],291,"SAMUDAYIK BHAWAN, RAGHOPUR ROOM NO 2",Auxiliary,660,1266,25.570328,85.343825,Yes,Yes,Yes
128-Raghopur [18-Vaishali],292,"RAJKIYA PRATHMIK VIDHYALAY, RAGHOPUR CHAETOLA (PURVI BHAG) ROOM N0.-1",Main,1,675,25.570328,85.343825,Yes,Yes,Yes
128-Raghopur [18-Vaishali],292,"RAJKIYA PRATHMIK VIDHYALAY, RAGHOPUR CHAETOLA ROOM N0.-4",Auxiliary,676,1279,25.570328,85.343825,Yes,Yes,Yes
128-Raghopur [18-Vaishali],293,"RAJKIY PRATHMIK VIDHYALAY, RAGHOPUR CHAETOLA (PASHCHAMI BHAG) ROOM N0.- 3",Main,1,640,25.550801,85.333591,Yes,Yes,Yes
128-Raghopur [18-Vaishali],293,"RAJKIY PRATHMIK VIDHYALAY, RAGHOPUR CHAETOLA ROOM N0.- 2",Auxiliary,641,1244,25.550801,85.333591,Yes,Yes,Yes
128-Raghopur [18-Vaishali],294,"RAJKIY MADHY VIDHYALAY, RAGHOPUR BALIKA ( DAKSHANI BHAG) ROOM N0.- 1",Main,1,547,25.608833,85.370622,Yes,Yes,Yes
128-Raghopur [18-Vaishali],294,"RAJKIY MADHY VIDHYALAY, RAGHOPUR BALIKA ROOM N0.- 3",Auxiliary,548,1079,25.570328,85.343825,Yes,Yes,Yes
128-Raghopur [18-Vaishali],295,"RAJKIY MADHY VIDHYALAY, RAGHOPUR BALIKA ( PASHCHAMI BHAG) ROOM N0.- 2",Main,1,805,25.570328,85.343825,Yes,Yes,Yes
128-Raghopur [18-Vaishali],296,KAMAL SINGH SAMBHAL SINGH UCHCH VIDHYALAY RAGHOPUR ROOM N0.-1,Main,1,698,25.56034,85.33262,Yes,Yes,Yes
128-Raghopur [18-Vaishali],297,PANCHAYAT BHAWAN RAGHOPUR (PURVI BHAG),Main,1,714,25.549709,85.309425,Yes,Yes,Yes
128-Raghopur [18-Vaishali],297,PANCHAYAT BHAWAN RAGHOPUR ROOM NO 2,Auxiliary,715,1412,25.608833,85.370622,Yes,Yes,Yes
128-Raghopur [18-Vaishali],298,"UTAKRAMIT MADHY VIDYALAY, HAJPURVA ( PURVI BHAG) ROOM N0.-1",Main,1,644,25.570328,85.343825,Yes,Yes,Yes
128-Raghopur [18-Vaishali],298,"UTAKRAMIT MADHY VIDYALAY, HAJPURVA ROOM N0.-2",Auxiliary,645,1199,25.608833,85.370622,Yes,Yes,Yes
128-Raghopur [18-Vaishali],299,"UTAKRAMIT MADHY VIDYALAY, HAJPURVA ( PASHCHAMI BHAG) ROOM N0.-3",Main,1,678,25.570328,85.343825,Yes,Yes,Yes
128-Raghopur [18-Vaishali],299,"UTAKRAMIT MADHY VIDYALAY, HAJPURVA ROOM N0.-4",Auxiliary,679,1320,25.577004,85.344794,Yes,Yes,Yes
128-Raghopur [18-Vaishali],300,SAMUDAYIK BHAWAN (LOHIYA BHAWAN) RAGHOPUR PURVI (URTRI BHAG),Main,1,630,25.577004,85.344794,Yes,Yes,Yes
128-Raghopur [18-Vaishali],300,SAMUDAYIK BHAWAN (LOHIYA BHAWAN) RAGHOPUR PURVI CHALANT MATDAN KENDRA,Auxiliary,631,1227,25.577004,85.344794,No,No,No
128-Raghopur [18-Vaishali],301,SAMUDAYIK BHAWAN (LOHIYA BHAWAN) RAGHOPUR PURVI ( PURVI BHAG),Main,1,544,25.5564,85.323799,Yes,Yes,Yes
128-Raghopur [18-Vaishali],301,SAMUDAYIK BHAWAN (LOHIYA BHAWAN) RAGHOPUR PURVI CHALANT MATDAN KENDRA,Auxiliary,545,1084,25.55323,85.31309,No,No,No
128-Raghopur [18-Vaishali],302,NAV PRATHMIK VIDHYALAY DAKSHANI DOM TOLI RAGHOPUR PURVI (PASHCHIMI BHAG) Kamra N0.-1,Main,1,595,25.55323,85.31309,Yes,Yes,Yes
128-Raghopur [18-Vaishali],302,NAV PRATHMIK VIDHYALAY DAKSHANI DOM TOLI RAGHOPUR PURVI Kamra N0.-4,Auxiliary,596,1164,25.54746,85.311321,Yes,Yes,Yes
128-Raghopur [18-Vaishali],303,NAV PRATHMIK VIDHYALAY DAKSHANI DOM TOLI RAGHOPUR PURVI (PURVI BHAG) Kamra N0.-3,Main,1,530,25.549709,85.309425,Yes,Yes,Yes
128-Raghopur [18-Vaishali],303,NAV PRATHMIK VIDHYALAY DAKSHANI DOM TOLI RAGHOPUR PURVI Kamra N0.-3,Auxiliary,531,1037,25.608833,85.370622,Yes,Yes,Yes
128-Raghopur [18-Vaishali],304,"RAJKIY MADHY VIDHYALAY, RAGHOPUR BALAK Kamra N0.-1",Main,1,735,25.570328,85.343825,Yes,Yes,Yes
128-Raghopur [18-Vaishali],305,"THAKUR RAMSHARAN SINGH, UCHCH VIDHYALAY, JURAWANPUR (PURVI BHAG) Kamra NO- 01",Main,1,510,25.577004,85.344794,Yes,Yes,Yes
128-Raghopur [18-Vaishali],305,"THAKUR RAMSHARAN SINGH, UCHCH VIDHYALAY, JURAWANPUR NAYA BHAWAN Kamra NO- 06",Auxiliary,511,1001,25.577004,85.344794,Yes,Yes,Yes
128-Raghopur [18-Vaishali],306,"THAKUR RAMSHARAN SINGH, UCHCH VIDHYALAY, JURAWANPUR ( PASHCHAMI BHAG) Kamra N0.-2",Main,1,598,25.55323,85.31309,Yes,Yes,Yes
128-Raghopur [18-Vaishali],306,"THAKUR RAMSHARAN SINGH, UCHCH VIDHYALAY, JURAWANPUR Kamra N0.-2",Auxiliary,599,1163,25.570328,85.343825,Yes,Yes,Yes
128-Raghopur [18-Vaishali],307,"THAKUR RAMSHARAN SINGH, UCHCH VIDHYALAY, JURAWANPUR NAV NIRMIT BHAWAN Kamra N0.-4",Main,1,977,25.570328,85.343825,Yes,Yes,Yes
128-Raghopur [18-Vaishali],308,"THAKUR RAMSHARAN SINGH, UCHCH VIDHYALAY, NAYA BHAWAN PURVI BHAG Kamra N0.-5",Main,1,620,25.570328,85.343825,Yes,Yes,Yes
128-Raghopur [18-Vaishali],308,"THAKUR RAMSHARAN SINGH, UCHCH VIDHYALAY, NAYA BHAWAN PURVI BHAG Kamra N0.-5",Auxiliary,621,1240,25.570328,85.343825,Yes,Yes,Yes
128-Raghopur [18-Vaishali],309,"UTAKRAMIT MADHY VIDYALAY, JURAWANPUR KARARI NAYA BHAWAN Kamra N0.-03",Main,1,711,25.570328,85.343825,Yes,Yes,Yes
128-Raghopur [18-Vaishali],310,"UTAKRAMIT MADHY VIDYALAY, JURAWANPUR KARARI ( PASHCHAMI BHAG) Kamra N0.-2",Main,1,722,25.60373,85.284234,Yes,Yes,Yes
128-Raghopur [18-Vaishali],311,"UTAKRAMIT MADHY VIDYALAY, ISMAELPUR JURAWANPUR KARARI",Main,1,859,25.608811,85.2924,Yes,Yes,Yes
128-Raghopur [18-Vaishali],312,"UTAKRAMIT MADHY VIDYALAY, JURAWANPUR BIND TOLA (SHIV PUJAN MAHTO KE NIKAT)",Main,1,542,25.608811,85.2924,Yes,Yes,Yes
128-Raghopur [18-Vaishali],312,"UTAKRAMIT MADHY VIDYALAY, JURAWANPUR BIND TOLA (SHIV PUJAN MAHTO KE NIKAT) Kamra NO 02",Auxiliary,543,1068,25.608862,85.292401,Yes,Yes,Yes
128-Raghopur [18-Vaishali],313,"SAMUDAYIK BHAWAN, LAL BIHARI RAY KE NIKAT",Main,1,573,25.570328,85.343825,Yes,Yes,Yes
128-Raghopur [18-Vaishali],313,"SAMUDAYIK BHAWAN, LAL BIHARI RAY KE NIKAT Kamra NO 02",Auxiliary,574,1143,25.570328,85.343825,Yes,Yes,Yes
128-Raghopur [18-Vaishali],314,"RAJKIY MADHY VIDHYALAY, RAMPUR KARARI BARARI",Main,1,538,25.570328,85.343825,Yes,Yes,Yes
128-Raghopur [18-Vaishali],314,"RAJKIY MADHY VIDHYALAY, RAMPUR KARARI BARARI Kamra NO-02",Auxiliary,539,1065,25.550801,85.333591,Yes,Yes,Yes
128-Raghopur [18-Vaishali],315,"UTAKRAMIT MADHY VIDYALAY, JURAWANPUR BARARI BALUYA TOK",Main,1,585,25.552986,85.332521,Yes,Yes,Yes
128-Raghopur [18-Vaishali],315,"UTAKRAMIT MADHY VIDYALAY, JURAWANPUR BARARI BALUYA TOK Kamra NO-02",Auxiliary,586,1171,25.5564,85.323799,Yes,Yes,Yes
128-Raghopur [18-Vaishali],316,"UTAKRAMIT MADHY VIDYALAY, JURAWANPUR BARARI NAYA BHAWAN",Main,1,582,25.56034,85.33262,Yes,Yes,Yes
128-Raghopur [18-Vaishali],316,"UTAKRAMIT MADHY VIDYALAY, JURAWANPUR BARARI NAYA BHAWAN Kamra NO-02",Auxiliary,583,1139,25.561325,85.333625,Yes,Yes,Yes
128-Raghopur [18-Vaishali],317,"UTAKRAMIT MADHYA VIDYALAY, JURAWANPUR BARARI PURANA BHAWAN",Main,1,591,25.5564,85.323799,Yes,Yes,Yes
128-Raghopur [18-Vaishali],317,"UTAKRAMIT MADHYA VIDYALAY, JURAWANPUR BARARI PURANA BHAWAN Kamra NO-03",Auxiliary,592,1163,25.570327,85.343825,Yes,Yes,Yes
128-Raghopur [18-Vaishali],318,"UTAKRAMIT MADHY VIDYALAY, VIRPUR SINGAR TOLA",Main,1,513,25.570328,85.343825,Yes,Yes,Yes
128-Raghopur [18-Vaishali],318,"UTAKRAMIT MADHY VIDYALAY, VIRPUR SINGAR TOLA NAYA BHAWAN Kamra NO-01",Auxiliary,514,1023,25.550801,85.333591,Yes,Yes,Yes
128-Raghopur [18-Vaishali],319,"UTAKRAMIT MADHY VIDYALAY, VIRPUR SINGAR TOLA KA PURANA BHAWAN",Main,1,509,25.550801,85.333591,Yes,Yes,Yes
128-Raghopur [18-Vaishali],319,"UTAKRAMIT MADHY VIDYALAY, VIRPUR SINGAR TOLA KA NAYA BHAWAN Kamra NO -02",Auxiliary,510,1016,25.550801,85.333591,Yes,Yes,Yes
128-Raghopur [18-Vaishali],320,"UTAKRAMIT MADHY VIDYALAY, SHIV NAGAR LANKA TOLA CHAKSINGAR (PURVI BHAG) Kamra N0.-1",Main,1,705,25.550801,85.333591,Yes,Yes,Yes
128-Raghopur [18-Vaishali],321,"UTAKRAMIT MADHY VIDYALAY, SHIV NAGAR LANKA TOLA CHAKSINGAR (PASHCHAMI BHAG) Kamra N0.-2",Auxiliary,1,742,25.550801,85.333591,Yes,Yes,Yes
128-Raghopur [18-Vaishali],322,"RAJKIY MADHYA VIDYALAY, CHAKSINGAR (DAKSHANI BHAG) Kamra N0.-1",Main,1,947,25.550801,85.333591,Yes,Yes,Yes
128-Raghopur [18-Vaishali],323,"RAJKIY MADHY VIDYALAY, CHAKSINGAR (UTTARI BHAG) Kamra N0.-02",Main,1,889,25.612153,85.289701,Yes,Yes,Yes
128-Raghopur [18-Vaishali],324,"NAV PRATHMIK VIDHYALAY, CHAKSINGAR (ANUSHUCHIT JAATI) Kamra N0.-1",Main,1,647,25.612153,85.289701,Yes,Yes,Yes
128-Raghopur [18-Vaishali],324,"NAV PRATHMIK VIDHYALAY, CHAKSINGAR (ANUSHUCHIT JAATI) Kamra N0.-02",Auxiliary,648,1278,25.613666,85.299419,Yes,Yes,Yes
128-Raghopur [18-Vaishali],325,"UTAKRAMIT MADHY VIDYALAY, RAMPUR KARARI BARARI PURVI CHAKSINGAR (PURVI BHAG) Kamra N0.-1",Main,1,848,25.60373,85.284234,Yes,Yes,Yes
128-Raghopur [18-Vaishali],326,"UTAKRAMIT MADHY VIDYALAY, RAMPUR KARARI BARARI PURVI CHAKSINGAR (PASHICHIMI BHAG) Kamra NO 02",Main,1,743,25.60373,85.284234,Yes,Yes,Yes
128-Raghopur [18-Vaishali],327,"SAMUDAYIK BHAWAN, VIRPUR",Main,1,546,25.608811,85.2924,Yes,Yes,Yes
128-Raghopur [18-Vaishali],327,"SAMUDAYIK BHAWAN, VIRPUR Kamra NO-02",Auxiliary,547,1085,25.608811,85.2924,Yes,Yes,Yes
128-Raghopur [18-Vaishali],328,"RAJKIY MADHY VIDYALAY, VIRPUR (PURVI BHAG) Kamra N0.-1",Main,1,684,25.608862,85.292401,Yes,Yes,Yes
128-Raghopur [18-Vaishali],328,"RAJKIY MADHY VIDYALAY, VIRPUR Kamra N0.-2 NAYA BHAWAN",Auxiliary,685,1274,25.608726,85.292394,Yes,Yes,Yes
128-Raghopur [18-Vaishali],329,"RAJKIY MADHY VIDYALAY, VIRPUR (PASHCHAMI BHAG) Kamra N0.-3",Main,1,520,25.608726,85.292394,Yes,Yes,Yes
128-Raghopur [18-Vaishali],329,"RAJKIY MADHY VIDYALAY, VIRPUR Kamra N0.-6 NAYA BHAWAN",Auxiliary,521,1042,25.608726,85.292394,Yes,Yes,Yes
128-Raghopur [18-Vaishali],330,"RAJKIY MADHY VIDYALAY, VIRPUR (MADHY BHAG) Kamra N0.-4",Main,1,570,25.604871,85.320142,Yes,Yes,Yes
128-Raghopur [18-Vaishali],330,"RAJKIY MADHY VIDYALAY, VIRPUR Kamra N0.-5 NAYA BHAWAN",Auxiliary,571,1126,25.581522,85.255268,Yes,Yes,Yes
128-Raghopur [18-Vaishali],331,"UTAKRAMIT MADHY VIDYALAY, VIRPUR FENUABAD (UTAR BHAG) Kamra NO 01",Main,1,579,25.574234,85.281139,Yes,Yes,Yes
128-Raghopur [18-Vaishali],331,"UTAKRAMIT MADHY VIDYALAY, VIRPUR FENUABAD CHALANT MATDAN KENDRA",Auxiliary,580,1115,25.550801,85.333591,No,No,No
128-Raghopur [18-Vaishali],332,UTKARMIT MADHYA VIDHALYA BIRPUR FENUABAD (DAKSHINI BHAG) Kamra NO 02,Main,1,544,25.550801,85.333591,Yes,Yes,Yes
128-Raghopur [18-Vaishali],332,UTKARMIT MADHYA VIDHALYA BIRPUR FENUABAD CHALANT MATDAN KENDRA,Auxiliary,545,1055,25.550801,85.333591,No,No,No
128-Raghopur [18-Vaishali],333,UTKARMIT MADHYA VIDHALYA BIRPUR HARIJAN (PURVI BHAG) Kamra NO- 1,Main,1,635,25.550801,85.333591,Yes,Yes,Yes
128-Raghopur [18-Vaishali],333,UTKARMIT MADHYA VIDHALYA BIRPUR HARIJAN Kamra NO- 2,Auxiliary,636,1260,25.550801,85.333591,Yes,Yes,Yes
129-Mahnar [18-Vaishali],001, Utkramit Madhya Vidyalaya Rampur Borhan purav Bhag,Main,1,827,25.765163,85.430087,Yes,Yes,Yes
129-Mahnar [18-Vaishali],002, Utkramit Madhya Vidyalaya Rampur Borhan Pashchmi Bhag,Main,1,783,25.765147,85.429995,Yes,Yes,Yes
129-Mahnar [18-Vaishali],003, Utkramit Madhya Vidyalaya Borahan (purav Bhag),Main,1,868,25.760607,85.42976,Yes,Yes,Yes
129-Mahnar [18-Vaishali],004, Utkramit Madhya Vidyalaya Borahan Madhya Bhag-1,Main,1,900,25.760632,85.429655,Yes,Yes,Yes
129-Mahnar [18-Vaishali],005, Utkramit Madhya Vidyalaya Borahan Madhya Bhag-2,Main,1,854,25.760658,85.429692,Yes,Yes,Yes
129-Mahnar [18-Vaishali],006,", Utkramit Madhya Vidyalaya Borahan (Paschmi Bhag)",Main,1,901,25.760468,85.429707,Yes,Yes,Yes
129-Mahnar [18-Vaishali],007,", Uchcha Vidyalaya, Narharpur (Purav Bhag)",Main,1,744,25.740058,85.441668,Yes,Yes,Yes
129-Mahnar [18-Vaishali],008,"Uchcha Vidyalaya, Narharpur Madhya Bhag-1",Main,1,741,25.73972,85.441503,Yes,Yes,Yes
129-Mahnar [18-Vaishali],009," Uchcha Vidyalaya, Narharpur Madhya Bhag-2",Main,1,720,25.73972,85.441503,Yes,Yes,Yes
129-Mahnar [18-Vaishali],09A," Uchcha Vidyalaya, Narharpur Madhya Bhag-2",Auxiliary,721,1425,25.73972,85.441503,Yes,Yes,Yes
129-Mahnar [18-Vaishali],010,"10, Prathmik Vidyalaya, Chausima",Main,1,660,25.748222,85.442925,Yes,Yes,Yes
129-Mahnar [18-Vaishali],010A,"10, (A) Prathmik Vidyalaya, Chausima",Auxiliary,661,1267,25.748222,85.442925,Yes,Yes,Yes
129-Mahnar [18-Vaishali],011,"11, Utkramit Madhya Vidyalaya, Bahsi Damodar, purav Bhag",Main,1,630,25.733368,85.410632,Yes,Yes,Yes
129-Mahnar [18-Vaishali],011A,"11, (A) Utkramit Madhya Vidyalaya, Bahsi Damodar, purav Bhag",Auxiliary,631,1209,25.733368,85.410632,Yes,Yes,Yes
129-Mahnar [18-Vaishali],12,"12, Utkramit Madhya Vidyalaya, Bahsi Damodar, madhaya Bhag",Main,1,690,25.73604,85.385274,Yes,Yes,Yes
129-Mahnar [18-Vaishali],12A,"12, (A)Utkramit Madhya Vidyalaya, Bahsi Damodar, madhaya Bhag",Auxiliary,691,1326,25.73604,85.385274,Yes,Yes,Yes
129-Mahnar [18-Vaishali],13,"13, Madya Vidyalaya, Bahasi",Main,1,600,25.725593,85.421597,Yes,Yes,Yes
129-Mahnar [18-Vaishali],13A,"13 (A) Madya Vidyalaya, Bahasi",Auxiliary,601,1184,25.725593,85.421597,Yes,Yes,Yes
129-Mahnar [18-Vaishali],14,"14, Nav Sirjit Prathmik Vidyalaya, Bahasi Saidpur",Main,1,690,25.7228,85.417547,Yes,Yes,Yes
129-Mahnar [18-Vaishali],14A,"14 (A) Nav Sirjit Prathmik Vidyalaya, Bahasi Saidpur",Auxiliary,691,1347,25.7228,85.417547,Yes,Yes,Yes
129-Mahnar [18-Vaishali],15,"15, Utkramit Madhya Vidyalaya, Mukundpur",Main,1,902,25.73951,85.429381,Yes,Yes,Yes
129-Mahnar [18-Vaishali],16,"16, Madhya Vidyalaya Kadilpur Purav Bhag",Main,1,540,25.722306,85.434495,Yes,Yes,Yes
129-Mahnar [18-Vaishali],16A,"16, (A)Madhya Vidyalaya Kadilpur Purav Bhag",Auxiliary,541,1060,25.722306,85.434495,Yes,Yes,Yes
129-Mahnar [18-Vaishali],17,"17, Madhya Vidyalaya Kadilpur (Pashchmi Bhag)",Main,1,570,25.719236,85.442554,Yes,Yes,Yes
129-Mahnar [18-Vaishali],17A,"17, (A)Madhya Vidyalaya Kadilpur (Pashchmi Bhag)",Main,571,1120,25.719236,85.442554,Yes,Yes,Yes
129-Mahnar [18-Vaishali],18,"18, Utkramit Madhya Vidyalaya, Dhandhua purav bhag",Main,1,933,25.717451,85.424902,Yes,Yes,Yes
129-Mahnar [18-Vaishali],19,"19, Utkramit Madhya Vidyalaya, Dhandhua (Madhaya Bhag)",Main,1,954,25.717721,85.425205,Yes,Yes,Yes
129-Mahnar [18-Vaishali],20,"20, Utkramit Madhya Vidyalaya, Dhandhua (Pashchmi Bhag)",Main,1,600,25.717721,85.425205,Yes,Yes,Yes
129-Mahnar [18-Vaishali],20A,"20, (A) Utkramit Madhya Vidyalaya, Dhandhua (Pashchmi Bhag)",Auxiliary,601,1191,25.717721,85.425205,Yes,Yes,Yes
129-Mahnar [18-Vaishali],21,"21, Utkramit Madhya Vidyalaya, Basantpur (Purav Bhag)",Main,1,540,25.719299,85.440185,Yes,Yes,Yes
129-Mahnar [18-Vaishali],21A,"21,(A) Utkramit Madhya Vidyalaya, Basantpur (Purav Bhag)",Auxiliary,541,1022,25.719299,85.440185,Yes,Yes,Yes
129-Mahnar [18-Vaishali],22,"22, Utkramit Madhya Vidyalaya, Basantpur (PashchimBhag)",Main,1,957,25.719254,85.440227,Yes,Yes,Yes
129-Mahnar [18-Vaishali],23,"23, Prathmik Vidyalaya Kumhragadh Purav Bhag",Main,1,765,25.719221,85.456895,Yes,Yes,Yes
129-Mahnar [18-Vaishali],24,"24, Prathmik Vidyalaya Kumhragadh (PashchimBhag)",Main,1,833,25.721983,85.456813,Yes,Yes,Yes
129-Mahnar [18-Vaishali],25,"25, Madhya Vidyalaya Panapur Bateshwarnath Purav Bhag",Main,1,917,25.700434,85.441213,Yes,Yes,Yes
129-Mahnar [18-Vaishali],26,"26, Madhya Vidyalaya Panapur Bateshwarnath (PashchimBhag)",Main,1,933,25.700434,85.441253,Yes,Yes,Yes
129-Mahnar [18-Vaishali],27,"27, Prathmik Vidyalaya, hudhudpur Purav Bhag",Main,1,941,25.70429,85.407967,Yes,Yes,Yes
129-Mahnar [18-Vaishali],28,"28, Prathmik Vidyalaya, hudhudpur (Pashchim Bhag)",Main,1,962,25.704327,85.407888,Yes,Yes,Yes
129-Mahnar [18-Vaishali],29,"29, Prathmik Vidyalaya kamalpur",Main,1,720,25.706558,85.418722,Yes,Yes,Yes
129-Mahnar [18-Vaishali],29A,"29,(A) Prathmik Vidyalaya kamalpur",Auxiliary,721,1387,25.706558,85.418722,Yes,Yes,Yes
129-Mahnar [18-Vaishali],30,"30, Madhya Vidyalay Garahi Purav Bhag",Main,1,933,25.706272,85.420517,Yes,Yes,Yes
129-Mahnar [18-Vaishali],31,"31, Madhya Vidyalay Garahi Pashchim Bhag",Main,1,765,25.706195,85.420378,Yes,Yes,Yes
129-Mahnar [18-Vaishali],32,"32, Utkramit Madhya Vidyalaya Chakbajo Malahi",Main,1,630,25.703092,85.424458,Yes,Yes,Yes
129-Mahnar [18-Vaishali],32A,"32, (A) Utkramit Madhya Vidyalaya Chakbajo Malahi",Auxiliary,631,1199,25.703092,85.424458,Yes,Yes,Yes
129-Mahnar [18-Vaishali],33,"33, Utkramit Madhya Vidyalaya Urdu Malahi",Main,1,540,25.703045,85.424488,Yes,Yes,Yes
129-Mahnar [18-Vaishali],33A,"33,(A) Utkramit Madhya Vidyalaya Urdu Malahi",Auxiliary,541,1059,25.703045,85.424488,Yes,Yes,Yes
129-Mahnar [18-Vaishali],34,"34, Anganwari Kendra Bajitpur Malahi",Main,1,785,25.701133,85.437377,Yes,Yes,Yes
129-Mahnar [18-Vaishali],35,"35, Utkramit Madhya Vidyalaya Kajri Buzurg (Purav Bhag)",Main,1,570,25.696144,85.467034,Yes,Yes,Yes
129-Mahnar [18-Vaishali],35A,"35, (A)Utkramit Madhya Vidyalaya Kajri Buzurg (Purav Bhag)",Auxiliary,571,1118,25.696144,85.467034,Yes,Yes,Yes
129-Mahnar [18-Vaishali],36,"36, Utkramit Madhya Vidyalaya Kajri Buzurg Pashchim Bhag",Main,1,600,25.696144,85.467034,Yes,Yes,Yes
129-Mahnar [18-Vaishali],36A,"36,(A) Utkramit Madhya Vidyalaya Kajri Buzurg Pashchim Bhag",Auxiliary,601,1136,25.696144,85.467034,Yes,Yes,Yes
129-Mahnar [18-Vaishali],37,"37, Shiv Dular Singh Uchcha Vidyalaya Chakfatah Bhath",Main,1,759,25.704988,85.464483,Yes,Yes,Yes
129-Mahnar [18-Vaishali],38,"38, Utkramit Madhya Vidyalaya Kajri Khurd",Main,1,860,25.701383,85.455762,Yes,Yes,Yes
129-Mahnar [18-Vaishali],39,"39, Utkramit madhya Vidyalaya baht Uttari Vidyalaya purav bhag",Main,1,771,25.706189,85.475083,Yes,Yes,Yes
129-Mahnar [18-Vaishali],40,"40, Utkramit madhya Vidyalaya baht Uttari Vidyalaya pashchim bhag",Main,1,690,25.706089,85.47512,Yes,Yes,Yes
129-Mahnar [18-Vaishali],40A,"40,(A) Utkramit madhya Vidyalaya baht Uttari Vidyalaya pashchim bhag",Auxiliary,691,1368,25.706089,85.47512,Yes,Yes,Yes
129-Mahnar [18-Vaishali],41,"41, Utkramit madhya Vidyalaya baht Dakshni Vidyalaya Purav bhag",Main,1,876,25.697186,85.47719,Yes,Yes,Yes
129-Mahnar [18-Vaishali],42,"42, Utkramit madhya Vidyalaya baht Dakshni Vidyalaya pashchim bhag",Main,1,913,25.697318,85.476972,Yes,Yes,Yes
129-Mahnar [18-Vaishali],43,"43, Utkramit Madhya Vidyalaya vishunpur Silauthar purvi Bahag",Main,1,806,25.712306,85.471228,Yes,Yes,Yes
129-Mahnar [18-Vaishali],44,"44, Utkramit Madhya Vidyalaya Bishunpur Silauthar pashami Bhag",Main,1,871,25.712284,85.471223,Yes,Yes,Yes
129-Mahnar [18-Vaishali],45,"45, Utkramit Madhya Vidyalaya Bishunpur Silauthar Navin",Main,1,600,25.718773,85.483118,Yes,Yes,Yes
129-Mahnar [18-Vaishali],45A,"45, (A)Utkramit Madhya Vidyalaya Bishunpur Silauthar Navin",Auxiliary,601,1189,25.718773,85.483118,Yes,Yes,Yes
129-Mahnar [18-Vaishali],46,"46, Prathimik Vidyalaya Chakabdul gani purav Bhag",Main,1,913,25.727938,85.464331,Yes,Yes,Yes
129-Mahnar [18-Vaishali],47,"47, Prathimik Vidyalaya Chakabdul gani pashami Bhag",Main,1,885,25.724947,85.464338,Yes,Yes,Yes
129-Mahnar [18-Vaishali],48,"48, Madhya Vidyalaya Khopi Purav Bhag",Main,1,826,25.71975,85.474773,Yes,Yes,Yes
129-Mahnar [18-Vaishali],49,"49, Madhya Vidyalaya Khopi Madhya Bhag",Main,1,816,25.719925,85.474127,Yes,Yes,Yes
129-Mahnar [18-Vaishali],50,"50, Madhya Vidyalaya Khopi Pashchim Bhag",Main,1,660,25.719816,85.744173,Yes,Yes,Yes
129-Mahnar [18-Vaishali],50A,"50, (A)Madhya Vidyalaya Khopi Pashchim Bhag",Auxiliary,661,1256,25.719816,85.744173,Yes,Yes,Yes
129-Mahnar [18-Vaishali],51,"51, Utkramit Madhya Vidyalaya Hasanpur Buzurg Purav Bhag",Main,1,887,25.733944,85.464072,Yes,Yes,Yes
129-Mahnar [18-Vaishali],52,"52, Utkramit Madhya Vidyalaya Hasanpur Buzurg Pashchim Bhag",Main,1,891,25.733928,85.464059,Yes,Yes,Yes
129-Mahnar [18-Vaishali],53,"53, Prathmik Vidyalaya Bitandipur Purav Bhag",Main,1,916,25.733791,85.472053,Yes,Yes,Yes
129-Mahnar [18-Vaishali],54,"54, Prathmik Vidyalaya Bitandipur Pashchim Bhag",Main,1,979,25.733791,85.4720583,Yes,Yes,Yes
129-Mahnar [18-Vaishali],55,"55, Utkramit Madhya Vidyalaya Chakisa purvi bhag",Main,1,867,25.727365,85.485416,Yes,Yes,Yes
129-Mahnar [18-Vaishali],56,"56, Utkramit Madhya Vidyalaya Chakisa pashami Bhag",Main,1,733,25.727211,85.485408,Yes,Yes,Yes
129-Mahnar [18-Vaishali],57,"57, Panchayat Bhawan Bedauliya",Main,1,660,25.728007,85.475424,Yes,Yes,Yes
129-Mahnar [18-Vaishali],57A,"57, (A)Panchayat Bhawan Bedauliya",Auxiliary,1,1270,25.728007,85.475424,Yes,Yes,Yes
129-Mahnar [18-Vaishali],58,"58, Utkramit Madhya Vidyalaya Bedauliya Purav Bhag",Main,1,754,25.725949,85.499117,Yes,Yes,Yes
129-Mahnar [18-Vaishali],59,"59, Utkramit Madhya Vidyalaya Bedauliya pashami Bhag",Main,1,750,25.725939,85.49174,Yes,Yes,Yes
129-Mahnar [18-Vaishali],60,"60, Madhya Vidyalaya Bhathahi",Main,1,570,25.744965,85.466348,Yes,Yes,Yes
129-Mahnar [18-Vaishali],60A,"60, (A)Madhya Vidyalaya Bhathahi",Auxiliary,571,1070,25.744965,85.466348,Yes,Yes,Yes
129-Mahnar [18-Vaishali],61,"61, Pramthmik Vidyalaya Bhathahi, Anusuchit Jati (Purav Bhag)",Main,1,540,25.736874,85.467567,Yes,Yes,Yes
129-Mahnar [18-Vaishali],61A,"61, (A)Pramthmik Vidyalaya Bhathahi, Anusuchit Jati (Purav Bhag)",Auxiliary,541,1050,25.736874,85.467567,Yes,Yes,Yes
129-Mahnar [18-Vaishali],62,"62, Pramthmik Vidyalaya Bhathahi, Anusuchit Jati (Paschmi Bhag)",Main,1,980,25.736056,85.473169,Yes,Yes,Yes
129-Mahnar [18-Vaishali],63,"63, Utkramit Madhya Vidyalaya Chakmahdin(Purav Bhag)",Main,1,871,25.717045,85.517541,Yes,Yes,Yes
129-Mahnar [18-Vaishali],64,"64, Utkramit Madhya Vidyalaya Chakmahdin(Paschmi Bhag)",Main,1,932,25.716837,85.517362,Yes,Yes,Yes
129-Mahnar [18-Vaishali],65,"65, Prathmik Vidyalaya Saraiya",Main,1,826,25.717169,85.528372,Yes,Yes,Yes
129-Mahnar [18-Vaishali],66,"66, Utkramit Madhya Vidyalaya Rampur Chaklala Purab Bhag",Main,1,600,25.700715,85.511412,Yes,Yes,Yes
129-Mahnar [18-Vaishali],66A,"66, (A)Utkramit Madhya Vidyalaya Rampur Chaklala Purab Bhag",Auxiliary,601,1179,25.700715,85.511412,Yes,Yes,Yes
129-Mahnar [18-Vaishali],67,"67, Utkramit Madhya Vidyalaya Rampur Chaklala (Paschmi Bhag)",Main,1,630,25.720721,85.511249,Yes,Yes,Yes
129-Mahnar [18-Vaishali],67A,"67, (A)Utkramit Madhya Vidyalaya Rampur Chaklala (Paschmi Bhag)",Auxiliary,631,1239,25.720721,85.511249,Yes,Yes,Yes
129-Mahnar [18-Vaishali],68,"68, Prathmik Vidyalaya Rasalpur Urdu (Purav Bhag)",Main,1,540,25.731396,85.495757,Yes,Yes,Yes
129-Mahnar [18-Vaishali],68A,"68, (A)Prathmik Vidyalaya Rasalpur Urdu (Purav Bhag)",Auxiliary,541,1056,25.731396,85.495757,Yes,Yes,Yes
129-Mahnar [18-Vaishali],69,"69, Prathmik Vidyalaya Rasalpur Urdu (Paschmi Bhag)",Main,1,600,25.731429,85.495687,Yes,Yes,Yes
129-Mahnar [18-Vaishali],69A,"69,(A) Prathmik Vidyalaya Rasalpur Urdu (Paschmi Bhag)",Auxiliary,601,1181,25.731429,85.495687,Yes,Yes,Yes
129-Mahnar [18-Vaishali],70,"70, Utkramit Madhya Vidyalaya Chakfridabad",Main,1,510,25.727084,85.509158,Yes,Yes,Yes
129-Mahnar [18-Vaishali],70A,"70, (A)Utkramit Madhya Vidyalaya Chakfridabad",Auxiliary,511,1006,25.727084,85.509158,Yes,Yes,Yes
129-Mahnar [18-Vaishali],71,"71, Madhya Vidyalaya Rasalpur",Main,1,942,25.724479,85.497642,Yes,Yes,Yes
129-Mahnar [18-Vaishali],72,"72, Madhya Vidyalaya Salha (Purav Bhag)",Main,1,720,25.711057,85.521345,Yes,Yes,Yes
129-Mahnar [18-Vaishali],72A,"72, (A)Madhya Vidyalaya Salha (Purav Bhag)",Auxiliary,721,1363,25.711057,85.521345,Yes,Yes,Yes
129-Mahnar [18-Vaishali],73,"73, Madhya Vidyalaya Salha (Paschmi Bhag)",Main,1,690,25.710788,85.521344,Yes,Yes,Yes
129-Mahnar [18-Vaishali],73A,"73,(A) Madhya Vidyalaya Salha (Paschmi Bhag)",Auxiliary,691,1347,25.710788,85.521344,Yes,Yes,Yes
129-Mahnar [18-Vaishali],74,"74, Panchayat Bhawan Kalapahar",Main,1,994,25.715211,85.510187,Yes,Yes,Yes
129-Mahnar [18-Vaishali],75,"75, Utkramit Madhya Vidyalaya KalaPahar",Main,1,943,25.714686,85.510097,Yes,Yes,Yes
129-Mahnar [18-Vaishali],76,"76, Utkramit Madhyamik Vidyalaya Panapur Silauthar (Purav Bhag)",Main,1,690,25.717209,85.495558,Yes,Yes,Yes
129-Mahnar [18-Vaishali],76A,"76, (A)Utkramit Madhyamik Vidyalaya Panapur Silauthar (Purav Bhag)",Auxiliary,691,1364,25.717209,85.495558,Yes,Yes,Yes
129-Mahnar [18-Vaishali],77,"77, Utkramit Madhyamik Vidyalaya Panapur Silauthar (Paschmi Bhag)",Main,1,600,25.717339,85.495139,Yes,Yes,Yes
129-Mahnar [18-Vaishali],77A,"77,(A) Utkramit Madhyamik Vidyalaya Panapur Silauthar (Paschmi Bhag)",Auxiliary,601,1187,25.717339,85.495139,Yes,Yes,Yes
129-Mahnar [18-Vaishali],78,"78, Utkramit Madhya Vidyalaya Silauthar Urdu(Purav Bhag)",Main,1,844,25.716705,85.486984,Yes,Yes,Yes
129-Mahnar [18-Vaishali],79,"79, Utkramit Madhya Vidyalaya Silauthar Urdu(Paschmi Bhag)",Main,1,995,25.716781,85.486998,Yes,Yes,Yes
129-Mahnar [18-Vaishali],80,"80, Utkramit Madhya Vidyalaya Jandaha Urdu (Purv Bhag)",Main,1,600,25.710191,85.531658,Yes,Yes,Yes
129-Mahnar [18-Vaishali],80A,"80, (A)Utkramit Madhya Vidyalaya Jandaha Urdu (Purv Bhag)",Auxiliary,601,1132,25.710191,85.531658,Yes,Yes,Yes
129-Mahnar [18-Vaishali],81,"81, Utkramit Madhya Vidyalaya Jandaha Urdu (Madhya Bhag)",Main,1,842,25.710188,85.531657,Yes,Yes,Yes
129-Mahnar [18-Vaishali],82,"82, Utkramit Madhya Vidyalaya Jandaha Urdu (Pashchim Bhag)",Main,1,800,25.710121,85.531707,Yes,Yes,Yes
129-Mahnar [18-Vaishali],83,"83, Utkramit Madhya Vidyalaya Jhammanganj",Main,1,929,25.709338,85.52692,Yes,Yes,Yes
129-Mahnar [18-Vaishali],84,"84, Ramawatar shaya + 2 Vidyalaya Jandaha (Purv Bhag)",Main,1,660,25.712627,85.540854,Yes,Yes,Yes
129-Mahnar [18-Vaishali],84A,"84, (A)Ramawatar shaya + 2 Vidyalaya Jandaha (Purv Bhag)",Auxiliary,661,1261,25.712627,85.540854,Yes,Yes,Yes
129-Mahnar [18-Vaishali],85,"85, Ramawatar shaya + 2 Vidyalaya Jandaha (Madhya Bhag)",Main,1,690,25.712801,85.540599,Yes,Yes,Yes
129-Mahnar [18-Vaishali],85A,"85,(A) Ramawatar shaya + 2 Vidyalaya Jandaha (Madhya Bhag)",Auxiliary,691,1358,25.712801,85.540599,Yes,Yes,Yes
129-Mahnar [18-Vaishali],86,"86, Ramawatar shaya + 2 Vidyalaya Jandaha (Pashchim Bhag)",Main,1,540,25.712809,85.540478,Yes,Yes,Yes
129-Mahnar [18-Vaishali],86A,"86,(A) Ramawatar shaya + 2 Vidyalaya Jandaha (Pashchim Bhag)",Auxiliary,541,1044,25.712809,85.540478,Yes,Yes,Yes
129-Mahnar [18-Vaishali],87,"87, Utkramit Madhya Vidyalaya Arniya Balak",Main,1,570,25.71458,85.552789,Yes,Yes,Yes
129-Mahnar [18-Vaishali],87A,"87, (A)Utkramit Madhya Vidyalaya Arniya Balak",Auxiliary,571,1096,25.71458,85.552789,Yes,Yes,Yes
129-Mahnar [18-Vaishali],88,"88, Prathmik Vidyalaya Arniya Kanya (Purav Bhag)",Main,1,600,25.717293,85.549367,Yes,Yes,Yes
