126-Mahua [18-Vaishali],144,YUGAL SINGH HIGH SCHOOL HARPUR (EAST BHAG) ROOM N0 1,Main,1,530,25.816972,85.476814,Yes,Yes,Yes
126-Mahua [18-Vaishali],144,YUGAL SINGH HIGH SCHOOL HARPUR (EAST BHAG) ROOM N0 2,Auxiliary,531,1042,25.816973,85.476878,Yes,Yes,Yes
126-Mahua [18-Vaishali],145,YUGAL SINGH HIGH SCHOOL HARPUR (MADHAY BHAG) ROOM N0 1,Main,1,537,25.816922,85.47701,Yes,Yes,Yes
126-Mahua [18-Vaishali],145,YUGAL SINGH HIGH SCHOOL HARPUR (MADHAY BHAG) ROOM N0 2,Auxiliary,538,1060,25.816802,85.477127,Yes,Yes,Yes
126-Mahua [18-Vaishali],146,YUGAL SINGH HIGH SCHOOL HARPUR (WEST BHAG) ROOM N0 1,Main,1,537,25.816873,85.477308,Yes,Yes,Yes
126-Mahua [18-Vaishali],146,YUGAL SINGH HIGH SCHOOL HARPUR (WEST BHAG) ROOM N0 2,Auxiliary,538,1055,25.81673,85.477338,Yes,Yes,Yes
126-Mahua [18-Vaishali],147,U.M.S JAHANGEER PUR SALAKHANNI SOUTH BHAG (EAST BHAG),Main,1,693,25.82466,85.478049,Yes,Yes,Yes
126-Mahua [18-Vaishali],148,U.M.S JAHANGEER PUR SALAKHANNI SOUTH BHAG (WEST BHAG) ROOM N0 1,Main,1,526,25.824843,85.4781,Yes,Yes,Yes
126-Mahua [18-Vaishali],148,U.M.S JAHANGEER PUR SALAKHANNI SOUTH BHAG (WEST BHAG) ROOM N0 2,Auxiliary,527,1038,25.824857,85.478086,Yes,Yes,Yes
126-Mahua [18-Vaishali],149,U.M.S JAHANGEER PUR SALAKHANNI SOUTH (MADHAY BHAG),Main,1,950,25.824772,85.47803,Yes,Yes,Yes
126-Mahua [18-Vaishali],150,U.M.S SALKAHANNI NORTH (NORTH BHAG),Main,1,933,25.824772,85.470478,Yes,Yes,Yes
126-Mahua [18-Vaishali],151,U.M.S SALKAHANNI NORTH (SOUTH BHAG),Main,1,926,25.83,85.4783,Yes,Yes,Yes
126-Mahua [18-Vaishali],152,PANCHAYAT BHAWAN JAHANGEER PUR SALAKHANNI (NORTH BHAG),Main,1,987,25.83476,85.4783,Yes,Yes,Yes
126-Mahua [18-Vaishali],153,PANCHAYAT BHAWAN JAHANGEER PUR SALAKHANNI (SOUTH BHAG),Main,1,890,25.83,85.47,Yes,Yes,Yes
126-Mahua [18-Vaishali],154,U.M.S SAMSPURA (NORTH BHAG) ROOM N0 1,Main,1,513,25.81941,85.456794,Yes,Yes,Yes
126-Mahua [18-Vaishali],154,U.M.S SAMSPURA (NORTH BHAG) ROOM N0 2,Auxiliary,514,1007,25.81941,85.456794,Yes,Yes,Yes
126-Mahua [18-Vaishali],155,U.M.S SAMSPURA (MADHAY BHAG) ROOM N0 1,Main,1,577,25.81941,85.456794,Yes,Yes,Yes
126-Mahua [18-Vaishali],155,U.M.S SAMSPURA (MADHAY BHAG) ROOM N0 2,Auxiliary,578,1118,25.81941,85.456794,Yes,Yes,Yes
126-Mahua [18-Vaishali],156,U.M.S SAMSPURA (SOUTH BHAG) ROOM N0 1,Main,1,660,25.81941,85.456794,Yes,Yes,Yes
126-Mahua [18-Vaishali],156,U.M.S SAMSPURA (SOUTH BHAG) ROOM N0 2,Auxiliary,661,1320,25.81941,85.456794,Yes,Yes,Yes
126-Mahua [18-Vaishali],157,U.M.S KUSHAHAR (NORTH BHAG) ROOM N0 1,Main,1,535,25.80406,85.437742,Yes,Yes,Yes
126-Mahua [18-Vaishali],157,U.M.S KUSHAHAR (NORTH BHAG) ROOM N0 2,Auxiliary,536,1070,25.80406,85.437742,Yes,Yes,Yes
126-Mahua [18-Vaishali],158,U.M.S KUSHAHAR (MADHAY BHAG),Main,1,835,25.80406,85.437742,Yes,Yes,Yes
126-Mahua [18-Vaishali],159,U.M.S KUSHAHAR (SOUTH BHAG),Main,1,898,25.80406,85.437742,Yes,Yes,Yes
126-Mahua [18-Vaishali],160,U.M.S KHEERA CHAK (NORTH BHAG),Main,1,843,25.811335,85.449645,Yes,Yes,Yes
126-Mahua [18-Vaishali],161,U.M.S KHEERA CHAK (SOUTH BHAG),Main,1,841,25.811335,85.4409645,Yes,Yes,Yes
126-Mahua [18-Vaishali],162,M.S NIJHAMA ( NORTH BHAG),Main,1,965,25.813303,85.426221,Yes,Yes,Yes
126-Mahua [18-Vaishali],163,M.S NIJHAMA ( SOUTH BHAG) ROOM N0 1,Main,1,580,25.813303,85.426221,Yes,Yes,Yes
126-Mahua [18-Vaishali],163,M.S NIJHAMA ( SOUTH BHAG) ROOM N0 2,Auxiliary,581,1150,25.813303,85.426221,Yes,Yes,Yes
126-Mahua [18-Vaishali],164,P.S CHHATWARA KAPUR (BAYA BHAG) ROOM N0 1,Main,1,600,25.814378,85.398424,Yes,Yes,Yes
126-Mahua [18-Vaishali],164,P.S CHHATWARA KAPUR (BAYA BHAG) ROOM N0 2,Auxiliary,601,1181,25.809529,85.461664,Yes,Yes,Yes
126-Mahua [18-Vaishali],165,P.S CHHATWARA KAPUR (DAYA BHAG),Main,1,910,25.809529,85.461661,Yes,Yes,Yes
126-Mahua [18-Vaishali],166,P.S CHHATWARA RAY BHAN (NORTH BHAG),Main,1,727,25.808897,85.414538,Yes,Yes,Yes
126-Mahua [18-Vaishali],167,P.S CHHATWARA RAY BHAN (SOUTH BHAG),Main,1,731,25.808897,85.414538,Yes,Yes,Yes
126-Mahua [18-Vaishali],168,P.S SHERPUR CHHATWARA (NORTH BHAG),Main,1,820,25.809529,85.461664,Yes,Yes,Yes
126-Mahua [18-Vaishali],169,P.S SHERPUR CHHATWARA (SOUTH BHAG),Main,1,913,25.809213,85.438103,Yes,Yes,Yes
126-Mahua [18-Vaishali],170,U.M.S SHANKAR PUR (NORTH BHAG),Main,1,801,25.792712,85.408547,Yes,Yes,Yes
126-Mahua [18-Vaishali],171,U.M.S SHANKAR PUR (SOUTH BHAG),Main,1,783,25.792738,85.408517,Yes,Yes,Yes
126-Mahua [18-Vaishali],172,P.S CHAKMJAHID KANYA (EAST BHAG),Main,1,566,25.791393,85.402905,Yes,Yes,Yes
126-Mahua [18-Vaishali],172,P.S CHAKMJAHID KANYA (WEST BHAG),Auxiliary,567,1061,25.791424,85.402886,Yes,Yes,Yes
126-Mahua [18-Vaishali],173,RAJKIYE PRATHMIK VIDHALAY CHAKMJAHID URDU (EAST BHAG),Main,1,695,25.792376,85.399566,Yes,Yes,Yes
126-Mahua [18-Vaishali],173,RAJKIYE PRATHMIK VIDHALAY CHAKMJAHID URDU (WEST BHAG),Auxiliary,696,1360,25.792346,85.39953,Yes,Yes,Yes
126-Mahua [18-Vaishali],174,U.M.S KADIL PUR (NORTH BHAG),Main,1,696,25.797385,85.414619,Yes,Yes,Yes
126-Mahua [18-Vaishali],174,U.M.S KADIL PUR (SOUTH BHAG),Auxiliary,697,1369,25.79727,85.414665,Yes,Yes,Yes
126-Mahua [18-Vaishali],175,U.M.S MURADPUR,Main,1,703,25.801098,85.416694,Yes,Yes,Yes
126-Mahua [18-Vaishali],176,U.M.S GADDOPUR (NORTH BHAG),Main,1,765,25.806676,85.41795,Yes,Yes,Yes
126-Mahua [18-Vaishali],177,U.M.S GADDOPUR (SOUH BHAG),Main,1,714,25.806612,85.418304,Yes,Yes,Yes
126-Mahua [18-Vaishali],178,M.S MAHUA BALAK (NORTH BHAG) ROOM N0 1,Main,1,507,25.810036,85.397883,Yes,Yes,Yes
126-Mahua [18-Vaishali],178,M.S MAHUA BALAK (NORTH BHAG) ROOM N0 2,Auxiliary,508,1011,25.80994,85.397836,Yes,Yes,Yes
126-Mahua [18-Vaishali],179,M.S MAHUA BALAK (SOUTH BHAG),Main,1,929,25.809664,85.39778,Yes,Yes,Yes
126-Mahua [18-Vaishali],180,VAISHALI VIDHALAY MAHUA (EAST BHAG) ROOM N0 1,Main,1,640,25.807117,85.390206,Yes,Yes,Yes
126-Mahua [18-Vaishali],180,VAISHALI VIDHALAY MAHUA (EAST BHAG) ROOM N0 2,Auxiliary,641,1276,25.807148,85.390109,Yes,Yes,Yes
126-Mahua [18-Vaishali],181,VAISHALI VIDHALAY MAHUA (MADHAY BHAG) ROOM N0 1,Main,1,536,25.807183,85.389689,Yes,Yes,Yes
126-Mahua [18-Vaishali],181,VAISHALI VIDHALAY MAHUA (MADHAY BHAG) ROOM N0 2,Auxiliary,5387,1068,25.8072,85.389722,Yes,Yes,Yes
126-Mahua [18-Vaishali],182,VAISHALI VIDHALAY MAHUA (WEST BHAG),Main,1,971,25.806837,85.399615,Yes,Yes,Yes
126-Mahua [18-Vaishali],183,VAISHALI VIDHALAY MAHUA NAYA BHAWAN (WEST BHAG),Main,1,865,350806783,85.389671,Yes,Yes,Yes
126-Mahua [18-Vaishali],184,MADHAY VIDHALAY MAHUA KANYA (EAST BHAG),Main,1,916,25.8075549,85.399567,Yes,Yes,Yes
126-Mahua [18-Vaishali],185,MADHAY VIDHALAY MAHUA KANYA (MADHAY BHAG),Main,1,954,25.807565,85.399532,Yes,Yes,Yes
126-Mahua [18-Vaishali],186,MADHAY VIDHALAY MAHUA KANYA (WEST BHAG) ROOM N0 1,Main,1,715,25.807609,85.399521,Yes,Yes,Yes
126-Mahua [18-Vaishali],186,MADHAY VIDHALAY MAHUA KANYA (WEST BHAG) ROOM N0 2,Auxiliary,716,1425,25.807584,85.399457,Yes,Yes,Yes
126-Mahua [18-Vaishali],187,U.M. S FULWARIYA WEST (WEST BHAG) ROOM N0 1,Main,1,529,25.802122,85.374152,Yes,Yes,Yes
126-Mahua [18-Vaishali],187,U.M. S FULWARIYA WEST (WEST BHAG) ROOM N0 2,Auxiliary,630,1052,25.799469,85.377674,Yes,Yes,Yes
126-Mahua [18-Vaishali],188,PRATHMIK VIDHALAY KADHINIYA (EAST BHAG),Main,1,588,25.799769,85.375141,Yes,Yes,Yes
126-Mahua [18-Vaishali],188,PRATHMIK VIDHALAY KADHINIYA (WEST BHAG),Auxiliary,589,1175,25.799769,85.375141,Yes,Yes,Yes
126-Mahua [18-Vaishali],189,U.M.S FULWARIYA PURVI (EAST BHAG),Main,1,734,25.791941,85.375223,Yes,Yes,Yes
126-Mahua [18-Vaishali],190,U.M.S FULWARIYA PURVI (MADHAY BHAG),Main,1,787,25.799769,85.375141,Yes,Yes,Yes
126-Mahua [18-Vaishali],191,P.S CHAKKA JINIZAM (PURANA BHAWAN),Main,1,900,25.803803,85.397729,Yes,Yes,Yes
126-Mahua [18-Vaishali],192,P.S CHAKKA JINIZAM (NAYA BHAWAN),Main,1,954,25.792055,85.41127,Yes,Yes,Yes
126-Mahua [18-Vaishali],193,N.P.S HIDAYAT PUR DIH,Main,1,979,25.801183,85.373204,Yes,Yes,Yes
126-Mahua [18-Vaishali],194,U.M.S PARSONIYA (EAST BHAG),Main,1,895,25.785774,85.79474,Yes,Yes,Yes
126-Mahua [18-Vaishali],195,U.M.S PARSONIYA (WEST BHAG),Main,1,915,25.785775,85.379476,Yes,Yes,Yes
126-Mahua [18-Vaishali],196,U.M.S HASANPUR OSTI URDU (NORTH BHAG),Main,1,916,25.791941,85.375223,Yes,Yes,Yes
126-Mahua [18-Vaishali],197,U.M.S HASANPUR OSTI URDU (SOUTH BHAG),Main,1,919,25.791945,85.372425,Yes,Yes,Yes
126-Mahua [18-Vaishali],198,"AANGANWARI KENDRA HASANPUR OSTI (NORTH BHAG)",Main,1,758,25.78696,85.397776,Yes,Yes,Yes
126-Mahua [18-Vaishali],199,AANGANWARI KENDRA HASANPUR OSTI (SOUTH BHAG),Main,1,746,25.78945,85.386499,Yes,Yes,Yes
126-Mahua [18-Vaishali],200,U.M.S OSTI (EAST BHAG) ,Main,1,641,25.785774,85.379474,Yes,Yes,Yes
126-Mahua [18-Vaishali],200,U.M.S OSTI (WEST BHAG),Auxiliary,642,1267,25.785774,85.379474,Yes,Yes,Yes
126-Mahua [18-Vaishali],201,U.M.S HARPUR OSTI (NORTH B HAG),Main,1,947,25.778942,85.393212,Yes,Yes,Yes
126-Mahua [18-Vaishali],202,U.M.S HARPUR OSTI (SOUTH B HAG),Main,1,884,25.778973,85.39418,Yes,Yes,Yes
126-Mahua [18-Vaishali],203,U.M.S TAJPUR BUZURG (NORTH BHAG) ROOM N0 1,Main,1,680,25.771707,85.367504,Yes,Yes,Yes
126-Mahua [18-Vaishali],203,U.M.S TAJPUR BUZURG (NORTH BHAG) ROOM N0 2,Auxiliary,681,1362,25.7717,85.367552,Yes,Yes,Yes
126-Mahua [18-Vaishali],204,U.M.S TAJPUR BUZURG (SOUHT BHAG) ROOM N0 1,Main,1,712,25.771695,85.367545,Yes,Yes,Yes
126-Mahua [18-Vaishali],204,U.M.S TAJPUR BUZURG (SOUHT BHAG) ROOM N0 2,Auxiliary,713,1412,25.771696,85.367555,Yes,Yes,Yes
126-Mahua [18-Vaishali],205,U.M.S MADHOPUR (NORTH BHAG),Main,1,776,25.77881,85.373646,Yes,Yes,Yes
126-Mahua [18-Vaishali],206,U.M.S MADHOPUR (SOUTH BHAG),Main,1,710,25.778819,85.373652,Yes,Yes,Yes
126-Mahua [18-Vaishali],207,M.S KARIHO (NORTH BHAG),Main,1,820,25.76321,85.382747,Yes,Yes,Yes
126-Mahua [18-Vaishali],208,M.S KARIHO (SOUTH BHAG),Main,1,659,25.763199,85.382798,Yes,Yes,Yes
126-Mahua [18-Vaishali],209,U.M.S TAJPUR RAJO (BHORAHA ) WEST BHAG ROOM N0 1,Main,1,545,25.751665,85.391443,Yes,Yes,Yes
126-Mahua [18-Vaishali],209,U.M.S TAJPUR RAJO (BHORAHA ) WEST BHAG ROOM N0 2,Auxiliary,546,1055,25.751651,85.39149,Yes,Yes,Yes
126-Mahua [18-Vaishali],210,U.M.S TAJPUR RAJO (BHORAHA ) EAST BHAG ROOM N0 1,Main,1,596,25.757666,85.391504,Yes,Yes,Yes
126-Mahua [18-Vaishali],210,U.M.S TAJPUR RAJO (BHORAHA ) EAST BHAG ROOM N0 2,Auxiliary,597,1148,25.751678,85.391504,Yes,Yes,Yes
126-Mahua [18-Vaishali],211,M.S HASANPUR BHADWAS (EAST BHAG),Main,1,837,25.7544,85.3994025,Yes,Yes,Yes
126-Mahua [18-Vaishali],212,M.S HASANPUR BHADWAS (MADHAY BHAG),Main,1,811,25.754365,85.39955,Yes,Yes,Yes
126-Mahua [18-Vaishali],213,M.S HASANPUR BHADWAS (WEST BHAG),Main,1,893,25.754925,85.399546,Yes,Yes,Yes
126-Mahua [18-Vaishali],214,P.S BHADWAS URDU (NORTH BHAG),Main,1,946,25.758272,85.397746,Yes,Yes,Yes
126-Mahua [18-Vaishali],215,P.S BHADWAS URDU SOUTH (NORTH BHAG) ROOM N0 1,Main,1,551,25.758354,85.397649,Yes,Yes,Yes
126-Mahua [18-Vaishali],215,P.S BHADWAS URDU SOUTH (NORTH BHAG) ROOM N0 2,Auxiliary,552,1036,25.758397,85.397608,Yes,Yes,Yes
126-Mahua [18-Vaishali],216,RAJKIYE PRATHMIK VIDHALAY BHADWAS (HINDI) NORTH BHAG,Main,1,652,25.764016,85.401398,Yes,Yes,Yes
126-Mahua [18-Vaishali],216,RAJKIYE PRATHMIK VIDHALAY BHADWAS (HINDI) SOUTH BHAG,Auxiliary,653,1195,25.763974,85.401553,Yes,Yes,Yes
126-Mahua [18-Vaishali],217,P.S ALIPUR MUKUND URDU (EAST BHAG),Main,1,753,25.759102,85.406695,Yes,Yes,Yes
126-Mahua [18-Vaishali],218,P.S ALIPUR MUKUND URDU (WEST BHAG) ROOM N0 1,Main,1,501,25.759058,85.406581,Yes,Yes,Yes
126-Mahua [18-Vaishali],218,P.S ALIPUR MUKUND URDU (WEST BHAG) ROOM N0 2,Auxiliary,502,1003,25.75904,85.404256,Yes,Yes,Yes
126-Mahua [18-Vaishali],219,U.M.S SAHPUR CHAKUMAR (EAST BHAG) ROOM N0 1,Main,11,599,25.752225,85.407583,Yes,Yes,Yes
126-Mahua [18-Vaishali],219,P.S ALIPUR MUKUND URDU (WEST BHAG) ROOM N0 2,Auxiliary,600,1186,25.75225,85.40758,Yes,Yes,Yes
126-Mahua [18-Vaishali],220,U.M.S SAHPUR CHAKUMAR (WEST BHAG) ROOM N0 1,Main,1,596,25.75225,85.407578,Yes,Yes,Yes
126-Mahua [18-Vaishali],220,U.M.S SAHPUR CHAKUMAR (WEST BHAG) ROOM N0 2,Auxiliary,597,1208,25.75225,85.40758,Yes,Yes,Yes
126-Mahua [18-Vaishali],221,P.S LAXMIPUR (NORTH BHAG) ROOM N0 1,Main,1,570,25.73912,85.41289,Yes,Yes,Yes
126-Mahua [18-Vaishali],221,P.S LAXMIPUR (NORTH BHAG) ROOM N0 2,Auxiliary,571,1140,25.736432,85.41418,Yes,Yes,Yes
126-Mahua [18-Vaishali],222,P.S LAXMIPUR (SOUTH BHAG) ROOM N0 1,Main,1,581,25.736432,85.41418,Yes,Yes,Yes
126-Mahua [18-Vaishali],222,P.S LAXMIPUR (SOUTH BHAG) ROOM N0 2,Auxiliary,582,1139,25.739712,85.41289,Yes,Yes,Yes
126-Mahua [18-Vaishali],223,PANCHAYAT BHAWAN LAXMINARAYANPUR CHAKOLI RAMPUR ( NORTH BHAG),Main,1,665,25.738165,85.410632,Yes,Yes,Yes
126-Mahua [18-Vaishali],223,PANCHAYAT BHAWAN LAXMINARAYANPUR CHAKOLI RAMPUR ( SOUTH BHAG),Auxiliary,666,1292,25.738165,85.410632,Yes,Yes,Yes
126-Mahua [18-Vaishali],224,U.M.S CHAKOLI (NORTH BHAG),Main,1,848,25.742334,85.437719,Yes,Yes,Yes
126-Mahua [18-Vaishali],225,U.M.S CHAKOLI (SOUTH BHAG),Main,1,854,25.737099,85.411922,Yes,Yes,Yes
126-Mahua [18-Vaishali],226,U.M.S MIRJANAGAR MOKARI (SOUTH BHAG) ROOM N0 1,Main,1,528,25.771847,85.395891,Yes,Yes,Yes
126-Mahua [18-Vaishali],226,U.M.S MIRJANAGAR MOKARI (SOUTH BHAG) ROOM N0 2,Auxiliary,529,1055,25.770599,85.397729,Yes,Yes,Yes
126-Mahua [18-Vaishali],227,U.M.S MIRJANAGAR MOKARI,Main,1,924,25.771844,85.395889,Yes,Yes,Yes
126-Mahua [18-Vaishali],228,U.M.S MIRJANAGAR (NORTH BHAG) ROOM N0 1,Main,1,709,25.76482,85.389985,Yes,Yes,Yes
126-Mahua [18-Vaishali],228,U.M.S MIRJANAGAR (NORTH BHAG) ROOM N0 2,Auxiliary,710,1397,25.76482,85.389985,Yes,Yes,Yes
126-Mahua [18-Vaishali],229,U.M.S MIRJANAGAR (SOUTH BHAG) ROOM N0 1,Main,1,629,25.765199,85.390308,Yes,Yes,Yes
126-Mahua [18-Vaishali],229,U.M.S MIRJANAGAR (SOUTH BHAG) ROOM N0 2,Auxiliary,630,1251,25.76482,85.389985,Yes,Yes,Yes
126-Mahua [18-Vaishali],230,PANCHAYAT BHAWAN MIRJANAGAR (NORTH BHAG),Main,1,776,25.785774,85.319474,Yes,Yes,Yes
126-Mahua [18-Vaishali],231,PANCHAYAT BHAWAN MIRJANAGAR (SOUTH BHAG),Main,1,815,25.785774,85.379474,Yes,Yes,Yes
126-Mahua [18-Vaishali],232,N.P.S PAHARPUR,Main,1,580,25.770599,85.39772,Yes,Yes,Yes
126-Mahua [18-Vaishali],233,P.S CHAKDADAN KANYA (NORTH BHAG) ROOM N0 1,Main,1,524,25.788623,85.407729,Yes,Yes,Yes
126-Mahua [18-Vaishali],233,P.S CHAKDADAN KANYA (NORTH BHAG) ROOM N0 2,Auxiliary,525,1041,25.788017,85.411922,Yes,Yes,Yes
126-Mahua [18-Vaishali],234,U.M.S HARPUR GANGA RAM (NORTH BHAG),Main,1,1,25.783468,85.408051,Yes,Yes,Yes
126-Mahua [18-Vaishali],234,U.M.S HARPUR GANGA RAM (SOUTH BHAG),Auxiliary,615,1223,25.788623,85.407729,Yes,Yes,Yes
126-Mahua [18-Vaishali],235,U.M.S CHAINPUR,Main,1,665,25.783509,85.409342,Yes,Yes,Yes
126-Mahua [18-Vaishali],236,PANCHAYAT BHAWAN ABDULPUR,Main,1,831,25.787257,85.418256,Yes,Yes,Yes
126-Mahua [18-Vaishali],237,P.S PARAI (EAST BHAG),Main,1,753,25.797778,85.408697,Yes,Yes,Yes
126-Mahua [18-Vaishali],238,P.S PARAI (WESTBHAG) ROOM N0 1,Main,1,533,25.788623,85.407729,Yes,Yes,Yes
126-Mahua [18-Vaishali],238,P.S PARAI (WESTBHAG) ROOM N0 2,Auxiliary,534,1055,25.789635,85.416437,Yes,Yes,Yes
126-Mahua [18-Vaishali],239,U.M.S RUSULPUR MUBARAK (WEST BHAG) ROOM N0 1,Main,1,548,25.772385,85.41394,Yes,Yes,Yes
126-Mahua [18-Vaishali],239,U.M.S RUSULPUR MUBARAK (WEST BHAG) ROOM N0 2,Auxiliary,549,1072,25.772385,85.41934,Yes,Yes,Yes
126-Mahua [18-Vaishali],240,U.M.S RUSULPUR MUBARAK (EAST BHAG) ROOM N0 1,Main,1,574,25.772385,85.41934,Yes,Yes,Yes
126-Mahua [18-Vaishali],240,U.M.S RUSULPUR MUBARAK (EAST BHAG) ROOM N0 2,Auxiliary,575,1119,25.759744,85.428046,Yes,Yes,Yes
126-Mahua [18-Vaishali],241,U.M.S PARMANAND PUR (EAST B HAG),Main,1,690,25.77805,85.44725,Yes,Yes,Yes
126-Mahua [18-Vaishali],241,U.M.S PARMANAND PUR (WEST BHAG),Main,691,1348,25.778002,85.447505,Yes,Yes,Yes
126-Mahua [18-Vaishali],242,PANCHAYAT BHAWAN CHHITRAULI (EAST BHAG),Main,1,619,25.773482,85.442905,Yes,Yes,Yes
126-Mahua [18-Vaishali],242,PANCHAYAT BHAWAN CHHITRAULI (WEST BHAG),Auxiliary,620,1237,25.773482,85.44289,Yes,Yes,Yes
126-Mahua [18-Vaishali],243,U.M.S MOHAN PUR (EAST BHAG),Main,1,518,25.768918,85.426434,Yes,Yes,Yes
126-Mahua [18-Vaishali],243,U.M.S MOHAN PUR (WEST BHAG),Auxiliary,519,1015,25.771178,85.430242,Yes,Yes,Yes
126-Mahua [18-Vaishali],244,M.S AKHTIYARPUR (NORTH BHAG) ROOM N0 1,Main,1,639,25.77191,85.439352,Yes,Yes,Yes
126-Mahua [18-Vaishali],244,M.S AKHTIYARPUR (NORTH BHAG) ROOM N0 2,Auxiliary,640,1257,25.77185,85.439298,Yes,Yes,Yes
126-Mahua [18-Vaishali],245,M.S AKHTIYARPUR (SOUTH BHAG),Main,1,776,25.771832,85.439062,Yes,Yes,Yes
126-Mahua [18-Vaishali],246,P.S SHERPUR CHHITRAULI (NORTH BHAG),Main,1,850,25.771627,85.449277,Yes,Yes,Yes
126-Mahua [18-Vaishali],247,P.S SHERPUR CHHITRAULI (SOUTH BHAG),Main,1,805,25.771813,85.449238,Yes,Yes,Yes
126-Mahua [18-Vaishali],248,P.S BAHORI,Main,1,842,25.762522,85.450953,Yes,Yes,Yes
126-Mahua [18-Vaishali],249,M.S NILKANTHAPUR (NORTH BHAG),Main,1,762,25.789032,85.425775,Yes,Yes,Yes
126-Mahua [18-Vaishali],250,M.S NILKANTHAPUR (SOUTH BHAG),Main,1,808,25.785907,85.41969,Yes,Yes,Yes
126-Mahua [18-Vaishali],251,U.M.S MUKSUDPUR TAJ (NORTH BHAG),Main,1,799,25.785562,85.427045,Yes,Yes,Yes
126-Mahua [18-Vaishali],252,U.M.S MUKSUDPUR TAJ (SOUTH BHAG),Main,1,752,25.785505,85.427199,Yes,Yes,Yes
126-Mahua [18-Vaishali],253,U.M.S DAGRU DIH PURANA BHAWAN (NORTH BHAG),Main,1,844,25.800907,85.437598,Yes,Yes,Yes
126-Mahua [18-Vaishali],254,U.M.S RAMPUR CHANDRA BHAN URF DAGRU (PURANA BHAWAN SOUTH BHAG),Main,1,789,25.800936,85.437717,Yes,Yes,Yes
126-Mahua [18-Vaishali],255,U.M.S DAGRU DIH NAYA BHAWAN ROOM N0 1,Main,1,528,25.800944,85.437684,Yes,Yes,Yes
126-Mahua [18-Vaishali],255,U.M.S DAGRU DIH NAYA BHAWAN ROOM N0 2,Auxiliary,529,1039,25.800976,85.437691,Yes,Yes,Yes
126-Mahua [18-Vaishali],256,U.M.S PARMANANDPUR LAL (NORTH BHAG),Main,1,700,25.78514,85.45186,Yes,Yes,Yes
126-Mahua [18-Vaishali],257,U.M.S PARMANANDPUR LAL (SOUTH BHAG),Main,1,773,25.784893,85.452046,Yes,Yes,Yes
126-Mahua [18-Vaishali],258,LOHIYA LALDHARI RAY UCHHAY VIDHALAY BALUGHAT KHESRAHIYA (EAST BHAG),Main,1,540,25.7673,85.4709,Yes,Yes,Yes
126-Mahua [18-Vaishali],258,LOHIYA LALDHARI RAY UCHHAY VIDHALAY BALUGHAT KHESRAHIYA (WEST BHAG),Auxiliary,541,1077,25.7673,85.4709,Yes,Yes,Yes
126-Mahua [18-Vaishali],259,U.M.S KHESRAHIYA,Main,1,863,25.794,85.458,Yes,Yes,Yes
126-Mahua [18-Vaishali],260,U.M.S MEDHAPUR SINGHARA (EAST B HAG),Main,1,610,25.767,85.47,Yes,Yes,Yes
126-Mahua [18-Vaishali],260,U.M.S MEDHAPUR SINGHARA (WEST BHAG),Auxiliary,611,1214,25.767,85.47,Yes,Yes,Yes
126-Mahua [18-Vaishali],261,U.M.S BHARATPUR SINGHARA (NORTH BHAG),Main,1,958,25.7644,85.4496,Yes,Yes,Yes
126-Mahua [18-Vaishali],262,U.M.S BHARATPUR SINGHARA (SOUTH BHAG),Main,1,943,25.7644,85.4496,Yes,Yes,Yes
126-Mahua [18-Vaishali],263,U.M.S BHARATPUR SINGHARA (MADHAY BHAG),Main,1,778,25.7644,85.4496,Yes,Yes,Yes
126-Mahua [18-Vaishali],264,U.M.S MALPUR SINGHARA (NORTH BHAG),Main,1,758,25.829,85.144,Yes,Yes,Yes
126-Mahua [18-Vaishali],265,U.M.S MALPUR SINGHARA (SOUTH BHAG),Main,1,755,25.7787,85.4573,Yes,Yes,Yes
126-Mahua [18-Vaishali],266,BAHUDHANDHI SAHAYOG SAMITI GODAM BAWAN GHAT,Main,1,937,25.76735,85.4709,Yes,Yes,Yes
126-Mahua [18-Vaishali],267,P.S RAMPUR SINGHARA (URDU) NORTH BHAG ROOM N0 1,Main,1,662,25.78588,85.461569,Yes,Yes,Yes
126-Mahua [18-Vaishali],267,P.S RAMPUR SINGHARA (URDU) NORTH BHAG ROOM N0 2,Auxiliary,663,1325,25.78588,85.461569,Yes,Yes,Yes
126-Mahua [18-Vaishali],268,P.S RAMPUR SINGHARA (URDU) SOUTH BHAG ROOM N0 1,Main,1,547,25.787644,85.462948,Yes,Yes,Yes
126-Mahua [18-Vaishali],268,P.S RAMPUR SINGHARA (URDU) SOUTH BHAG ROOM N0 2,Auxiliary,548,1091,25.787645,85.462988,Yes,Yes,Yes
126-Mahua [18-Vaishali],269,M.S SINGHARA (NORTH BHAG),Main,1,669,25.79499,85.455625,Yes,Yes,Yes
126-Mahua [18-Vaishali],270,M.S SINGHARA (SOUTH BHAG),Main,1,821,25.794993,85.455625,Yes,Yes,Yes
126-Mahua [18-Vaishali],271,U.M.S MUKUNDPUR SINGHARA (NORTH BHAG) ROOM N0 1,Main,1,516,25.804593,85.446422,Yes,Yes,Yes
126-Mahua [18-Vaishali],271,U.M.S MUKUNDPUR SINGHARA (NORTH BHAG) ROOM N0 2,Auxiliary,517,1017,25.802484,85.446322,Yes,Yes,Yes
126-Mahua [18-Vaishali],272,U.M.S MUKUNDPUR SINGHARA (SOUTH BHAG) ROOM N0 1,Main,1,505,25.804593,85.446422,Yes,Yes,Yes
126-Mahua [18-Vaishali],272,U.M.S MUKUNDPUR SINGHARA (SOUTH BHAG) ROOM N0 2,Auxiliary,506,1003,25.80239,85.446744,Yes,Yes,Yes
126-Mahua [18-Vaishali],273,UCHCHAY VIDHALAY SINGHARA (EAST BHAG),Main,1,610,25.805494,85.458607,Yes,Yes,Yes
126-Mahua [18-Vaishali],273,UCHCHAY VIDHALAY SINGHARA (WEST BHAG),Auxiliary,611,1204,25.805528,85.45862,Yes,Yes,Yes
126-Mahua [18-Vaishali],274,P.S SINGHARA TARA (NORTH BHAG),Main,1,638,25.809989,85.456423,Yes,Yes,Yes
126-Mahua [18-Vaishali],274,P.S SINGHARA TARA (SOUTH BHAG),Auxiliary,639,1256,25.809983,85.456413,Yes,Yes,Yes
126-Mahua [18-Vaishali],275,PANCHAYAT BHAWAN SINGHARA,Main,1,966,25.795541,85.456836,Yes,Yes,Yes
126-Mahua [18-Vaishali],276,U.M.S HUSENIPUR (NORTH BHAG) ROOM N0 1,Main,1,632,25.814639,85.472847,Yes,Yes,Yes
126-Mahua [18-Vaishali],276,U.M.S HUSENIPUR (NORTH BHAG) ROOM N0 2,Auxiliary,633,1257,25.814639,85.472849,Yes,Yes,Yes
126-Mahua [18-Vaishali],277,AANGANWARI KENDRA LAXMI NARAYANPUR,Main,1,918,25.78704,85.480006,Yes,Yes,Yes
126-Mahua [18-Vaishali],278,U.M.S HUSENIPUR (EAST BHAG),Main,1,864,25.800733,85.472564,Yes,Yes,Yes
126-Mahua [18-Vaishali],279,U.M.S HUSENIPUR (WEST BHAG),Main,1,918,25.800733,85.472564,Yes,Yes,Yes
126-Mahua [18-Vaishali],280,U.M.S LAXMI NARAYANPUR PURANA BHAWAN (NORTH BHAG),Main,1,900,25.7809,85.4796,Yes,Yes,Yes
126-Mahua [18-Vaishali],281,U.M.S LAXMI NARAYANPUR PURANA BHAWAN (SOUTH BHAG) ROOM N0 1,Main,1,601,25.86888,85.47962,Yes,Yes,Yes
126-Mahua [18-Vaishali],281,U.M.S LAXMI NARAYANPUR PURANA BHAWAN (SOUTH BHAG) ROOM N0 2,Auxiliary,602,1157,25.78698,85.49608,Yes,Yes,Yes
126-Mahua [18-Vaishali],282,SAMUDAYIK BHAWAN GOVINDPUR (EAST BHAG),Main,1,978,25.796114,85.465901,Yes,Yes,Yes
126-Mahua [18-Vaishali],283,SAMUDAYIK BHAWAN GOVINDPUR (WEST BHAG),Main,1,957,25.79609,85.46595,Yes,Yes,Yes
127-Raja Pakar (SC) [18-Vaishali],1,"Prathamik Vidyalay , Damodarpur Kanya(Pashchim Bhag )",Main,1,600,25.779481,85.290329,Yes,Yes,Yes
127-Raja Pakar (SC) [18-Vaishali],1(A),"Prathamik Vidyalay , Damodarpur Kanya(Pashchim Bhag Madhya)",Auxiliary,601,1187,25.779652,85.290467,Yes,Yes,Yes
127-Raja Pakar (SC) [18-Vaishali],2,Prathamik Vidyalay Damodarpur Kanya(Purwi Bhag),Main,1,690,25.779659,85.290413,Yes,Yes,Yes
127-Raja Pakar (SC) [18-Vaishali],2(A),Prathamik Vidyalay Damodarpur Kanya(Purwi Bhag Madhya),Auxiliary,691,1353,25.779643,85.296189,Yes,Yes,Yes
127-Raja Pakar (SC) [18-Vaishali],3,"Prathamik Vidyalay, Vishnupur Dhannu",Main,1,521,25.777301,85.293174,Yes,Yes,Yes
127-Raja Pakar (SC) [18-Vaishali],4,"Prathmik Vidyalay,Matiyara (Daya Bhag)",Main,1,810,25.777254,85.293172,Yes,Yes,Yes
127-Raja Pakar (SC) [18-Vaishali],4(A),"Prathmik Vidyalay,Matiyara (Daya Bhag Madhya)",Auxiliary,811,1562,25.777948,85.286914,Yes,Yes,Yes
127-Raja Pakar (SC) [18-Vaishali],5,"Utkramit Madhya Vidyalay,Bhojpatti Daya Bhag",Main,1,660,25.763455,85.287039,Yes,Yes,Yes
127-Raja Pakar (SC) [18-Vaishali],5(A),"Utkramit Madhya Vidyalay,Bhojpatti Daya Bhag -1",Auxiliary,661,1285,25.76362,85.305108,Yes,Yes,Yes
127-Raja Pakar (SC) [18-Vaishali],6,"Utkramit Madhya Vidyalay,Bhojpatti Baya Bhag",Main,1,850,25.76362,85.305108,Yes,Yes,Yes
127-Raja Pakar (SC) [18-Vaishali],7,"Madhya Vidhalay,Rajepur Berai(Baya Bhag)",Main,1,961,25.75865,85.305314,Yes,Yes,Yes
127-Raja Pakar (SC) [18-Vaishali],8,"Madhya Vidhalay, Rajepur Berai Daya Bhag",Main,1,938,25.75865,85.306331,Yes,Yes,Yes
127-Raja Pakar (SC) [18-Vaishali],9,Prathmik Vidyalay Sarsai Uttari (Uttar Bhag,Main,1,847,25.758681,85.30611,Yes,Yes,Yes
127-Raja Pakar (SC) [18-Vaishali],10,Prathmik Vidyalay Sarsai Uttari (Dakshni Bhag,Main,1,758,25.791868,85.305914,Yes,Yes,Yes
127-Raja Pakar (SC) [18-Vaishali],11,Madhya vidyalay Sarsai (Uttar Bhag),Main,1,807,25.791776,85.305991,Yes,Yes,Yes
127-Raja Pakar (SC) [18-Vaishali],12,Madhya vidyalay Sarsai (Dakshni Bhag),Main,1,809,25.783323,85.309311,Yes,Yes,Yes
127-Raja Pakar (SC) [18-Vaishali],13,Panchayt bhavan rampur ratnakar (utari bhag ),Main,1,966,25.783216,85.309212,Yes,Yes,Yes
127-Raja Pakar (SC) [18-Vaishali],14,Panchayt bhavan rampur ratnakar (dakshni bhag ),Main,1,943,25.781864,85.308601,Yes,Yes,Yes
127-Raja Pakar (SC) [18-Vaishali],15,Utakarmit madhay vidyalay fatehpur utari bhag,Main,1,752,25.781882,85.306434,Yes,Yes,Yes
127-Raja Pakar (SC) [18-Vaishali],16,Utkarmit madhay vidyalay fatehpur (dashini bhag ),Main,1,707,25.778649,85.328645,Yes,Yes,Yes
127-Raja Pakar (SC) [18-Vaishali],17,"Prathamik Vidyalay, Mansipur, Fatehpur Phulwariya",Main,1,600,25.773507,85.326273,Yes,Yes,Yes
127-Raja Pakar (SC) [18-Vaishali],17(A),"Prathamik Vidyalay, Mansipur, Fatehpur Phulwariya Daya Bbag",Auxiliary,601,1102,25.773507,85.326273,Yes,Yes,Yes
127-Raja Pakar (SC) [18-Vaishali],18,Utkramit Madhya Vidhalay Dharampur,Main,1,976,25.763746,85.325091,Yes,Yes,Yes
127-Raja Pakar (SC) [18-Vaishali],19,"Utkramit Madhya Vidhalay, Patadh",Main,1,872,25.781687,85.325116,Yes,Yes,Yes
127-Raja Pakar (SC) [18-Vaishali],20,Samudayik Vikas Bhawan Mirapur Patadh,Main,1,570,25.780792,85.321034,Yes,Yes,Yes
127-Raja Pakar (SC) [18-Vaishali],20(A),Samudayik Vikas Bhawan Mirapur Patadh ke parisar me chalant booth,Auxiliary,571,1095,25.780792,85.321034,Yes,Yes,Yes
127-Raja Pakar (SC) [18-Vaishali],21,Utakarmit madhay vidhaly mukundpur (Uttar bhag ),Main,1,816,25.771612,85.320924,Yes,Yes,Yes
127-Raja Pakar (SC) [18-Vaishali],22,"Utkramit Madhya Vidhalay, Mukundpur (dakshini bhag )",Main,1,796,25.771618,85.39882,Yes,Yes,Yes
127-Raja Pakar (SC) [18-Vaishali],23,"Madhya Vidhalay, Dumari( utari bhag )",Main,1,757,25.77488,85.323759,Yes,Yes,Yes
127-Raja Pakar (SC) [18-Vaishali],24,"Madhya Vidhalay, Dumari (dakshini bhag)",Main,1,755,25.774679,85.310325,Yes,Yes,Yes
127-Raja Pakar (SC) [18-Vaishali],25,Tahsil Kachhari Laxmipur Bakhari,Main,1,630,25.771385,85.309622,Yes,Yes,Yes
