45-Chhatapur [6-Supaul],065,"Utkramit uchch Vidyalay, Hridaynagar Dakshin Bhag",Auxiliary,570,1070,26.4861167,87.0065355,Yes,Yes,Yes
45-Chhatapur [6-Supaul],066,"Madhya Vidyalay, Haridyanagar Pashchim Bhag",Main,1,945,26.4861162,87.006535,Yes,Yes,Yes
45-Chhatapur [6-Supaul],067,Utkarmit Madhay Vidyalay Bhavanipur Purab Bhag,Main,1,867,26.4688065,87.0018924,Yes,Yes,Yes
45-Chhatapur [6-Supaul],068,"Utkramit Madhay Vidyalay, Bhawanipur Pashchim Bhag",Main,1,818,26.4688064,87.0018922,Yes,Yes,Yes
45-Chhatapur [6-Supaul],069,"Prathamik Vidyalay, Sitapur Uttar",Main,1,779,26.461091,87.0030141,Yes,Yes,Yes
45-Chhatapur [6-Supaul],070,Utkarmit Madhay Vidyalay Sitapur Dakshin Pashchim Bhag,Main,1,908,26.453156,87.00296,Yes,Yes,Yes
45-Chhatapur [6-Supaul],071,Utkramit Madhya Vidyalay Sitapur Dakshin Dakshin Bhag,Main,1,941,26.4846325,87.0072333,Yes,Yes,Yes
45-Chhatapur [6-Supaul],072,"Prathamik Vidyalay, Kaitaiya Hindi Purvi Bhag Dakshin Kamra",Main,1,658,26.4637617,86.96449,Yes,Yes,No
45-Chhatapur [6-Supaul],073,"Prathmik Vidyalay, Rishidev Tola Kataiya",Main,1,848,26.4706932,86.9496749,Yes,Yes,Yes
45-Chhatapur [6-Supaul],074,"Prathamik Vidyalay, Kataiya Urdu, Uttari Kamra",Main,1,738,26.4732484,86.9641516,Yes,Yes,Yes
45-Chhatapur [6-Supaul],075,"Prathamik Vidyalay, Kataiya Urdu, Dakshin Bhag",Main,1,754,26.4732485,86.9641515,Yes,Yes,Yes
45-Chhatapur [6-Supaul],075,"Prathamik Vidyalay, Kataiya Urdu, Madhya Bhag",Auxiliary,755,1448,26.4732486,86.9641514,Yes,Yes,Yes
45-Chhatapur [6-Supaul],076,"Utkrmit Madhya Vidyalay, Kamalpur Uttar Bhag",Main,1,650,26.252625,86.454626,Yes,Yes,Yes
45-Chhatapur [6-Supaul],076,"Utkrmit Madhya Vidyalay, Kamalpur Uttar Bhag, Pashchimi Kamra",Auxiliary,651,1156,26.252622,86.454624,Yes,Yes,Yes
45-Chhatapur [6-Supaul],077,"Utkramit Madhya Vidyalay, Kamalpur Dakshin Bhag",Main,1,553,26.25262,86.454622,Yes,Yes,Yes
45-Chhatapur [6-Supaul],077,"Utkramit Madhya Vidyalay, Kamalpur, Naya Bhawan, Dakshin Bhag",Auxiliary,554,1113,26.26182,86.57161,Yes,Yes,Yes
45-Chhatapur [6-Supaul],078,"Utkramit Madhay Vidyalay, Dinbandhi Urdu Purvi Bhag",Main,1,639,26.252314,86.573417,Yes,Yes,Yes
45-Chhatapur [6-Supaul],078,"Utkramit Madhay Vidyalay, Dinbandhi Urdu Purvi Bhag, Dakshini Kamra",Auxiliary,640,1268,26.252312,86.573415,Yes,Yes,Yes
45-Chhatapur [6-Supaul],079,"Utkramit Madhay Vidyalay, Dinbandhi Urdu, Pashchimi Bhag",Main,1,536,26.25231,86.573412,Yes,Yes,Yes
45-Chhatapur [6-Supaul],079,"Utkramit Madhay Vidyalay, Dinbandhi Urdu, Pashchim Bhag Dakshini Kamra",Auxiliary,537,1038,26.252308,86.57341,Yes,Yes,Yes
45-Chhatapur [6-Supaul],080,Prathamik Vidyalay Raniganj,Main,1,661,26.4840016,86.9393891,Yes,Yes,Yes
45-Chhatapur [6-Supaul],081,"Prathamik Vidyalay, Shivnagar Dakshin Bhag, Uttari Kamra",Main,1,737,26.4812518,86.94249,Yes,Yes,Yes
45-Chhatapur [6-Supaul],081,"Prathamik Vidyalay, Shivnagar Dakshin Bhag, Dakshini Kamra",Auxiliary,738,1297,26.4812516,86.9425,Yes,Yes,Yes
45-Chhatapur [6-Supaul],082,Panchayat Bhavan Panchpadriya,Main,1,717,26.4560922,86.9223824,Yes,Yes,Yes
45-Chhatapur [6-Supaul],083,"Madhya Vidyalay Samda, Dakshin Bhag",Main,1,694,26.4688586,86.939452,Yes,Yes,Yes
45-Chhatapur [6-Supaul],083,"Madhya Vidyalay Samda, Purwi Bhag",Auxiliary,695,1539,26.4688587,86.9394521,Yes,Yes,Yes
45-Chhatapur [6-Supaul],084,Utkarmit Madhay Vidyalay Sahevan Pashchim Bhag,Main,1,493,26.4674314,86.9298919,Yes,Yes,Yes
45-Chhatapur [6-Supaul],084,Utkarmit Madhay Vidyalay Sahevan Uttar Bhag,Auxiliary,494,1004,26.4674642,86.9300659,Yes,Yes,Yes
45-Chhatapur [6-Supaul],085,Utkramit Madhay Vidyalay Sahevan Dakshin Bhag,Main,1,717,26.4674727,86.9299989,Yes,Yes,Yes
45-Chhatapur [6-Supaul],086,Utkrmit Madhya Vidyalay Bhagvanpur -1 Purab Bhag,Main,1,511,26.4516543,86.9184507,Yes,Yes,Yes
45-Chhatapur [6-Supaul],086,"Utkrmit Madhya Vidyalay Bhagvanpur -1 Purab Bhag, Uttari Kamra",Auxiliary,512,1094,26.451978,86.9185061,Yes,Yes,Yes
45-Chhatapur [6-Supaul],087,Utkramit Madhya Vidyalay Bhagwanpur 1 Dakshin Bhag,Main,1,586,26.4516543,86.9184507,Yes,Yes,Yes
45-Chhatapur [6-Supaul],088,"Madhya Vidyalay, Dhadha",Main,1,716,26.4271079,86.8813408,Yes,Yes,Yes
45-Chhatapur [6-Supaul],089,"Prathamik Vidyalay, Parsahi,",Main,1,444,26.4046284,86.848888,Yes,Yes,Yes
45-Chhatapur [6-Supaul],090,"Utkarmit madhya Vidyalay, Narapatpatti Uttar Bhag",Main,1,731,26.3986957,86.8396813,Yes,Yes,Yes
45-Chhatapur [6-Supaul],090,"Utkarmit madhya Vidyalay, Narapatpatti Dakshin Bhag, Kamra No-01",Auxiliary,732,1297,26.3986956,86.8396814,Yes,Yes,Yes
45-Chhatapur [6-Supaul],091,Utkarmit Madhya Vidyalay Narpatpatti Uttar Bhag Purvi Kamra,Main,1,492,26.234805,86.503214,Yes,Yes,Yes
45-Chhatapur [6-Supaul],091,"Utkarmit Madhya Vidyalay Narpatpatti Dakshin Bhag, Kamra No-02",Auxiliary,493,1048,26.234807,86.503212,Yes,Yes,Yes
45-Chhatapur [6-Supaul],092,Utkarmit Madhay VidyalaySatanpatti Purvi Bhag,Main,1,851,26.389726,86.850476,Yes,Yes,Yes
45-Chhatapur [6-Supaul],093,"Utkramit Madhay Vidyalay, Satanpatti Dakshin Bhag",Main,1,767,26.389726,86.850476,Yes,Yes,Yes
45-Chhatapur [6-Supaul],094,Madhya Vidyalay Piprahi Godh Lalmanpatti Uttar Bhag,Main,1,802,26.410921,86.867996,Yes,Yes,Yes
45-Chhatapur [6-Supaul],095,"Madhya Vidyalay Piprahi Goth, Lalmanpatti Dakshin Bhag",Main,1,695,26.41092,86.867997,Yes,Yes,Yes
45-Chhatapur [6-Supaul],096,"Prathamik Vidyalay, Kohabara Dakshin Bhag Purvi Kamra",Main,1,662,26.392893,86.869853,Yes,Yes,Yes
45-Chhatapur [6-Supaul],096,"Prathamik Vidyalay, Kohabara Dakshin Bhag",Auxiliary,663,1250,26.392891,86.869851,Yes,Yes,Yes
45-Chhatapur [6-Supaul],097,Utkarmit Madhay Vidyalay Piprahipatti Pashchim Bhag,Main,1,570,26.441519,86.897799,Yes,Yes,Yes
45-Chhatapur [6-Supaul],098,Utkramit Madhya Vidyalay Piprahipatti Purav Bhag,Main,1,573,26.441517,86.897798,Yes,Yes,Yes
45-Chhatapur [6-Supaul],098,Utkramit Madhya Vidyalay Piprahipatti Pashchim Bhag Dakshini Kamra,Auxiliary,574,1159,26.441516,86.897796,Yes,Yes,Yes
45-Chhatapur [6-Supaul],099,"Utkramit Madhay Vidyalay, Baijnathpur -2",Main,1,610,26.434573,86.89189,Yes,Yes,Yes
45-Chhatapur [6-Supaul],100,Utkrmit Madhya Vidyalay Gadhoa Bahuarva Pashchim Bhag,Main,1,990,26.440125,86.922791,Yes,Yes,Yes
45-Chhatapur [6-Supaul],101,Utkrmit Madhya Vidyalay Gadhoa Bahuarva Uttar bhag,Main,1,545,26.440124,86.92279,Yes,Yes,Yes
45-Chhatapur [6-Supaul],102,Panchayat Bhavan Ratanpur Ashthit Dhena,Main,1,794,26.439988,86.916984,Yes,Yes,Yes
45-Chhatapur [6-Supaul],103,Aganbari Kendra sankhiya 38 Bauhrava,Main,1,985,26.438728,86.915487,Yes,Yes,Yes
45-Chhatapur [6-Supaul],104,"Lalit Narayan Project Uchya Vidyalay, Ratanpur Dakshin Bhag",Main,1,629,26.429777,86.92227,Yes,Yes,Yes
45-Chhatapur [6-Supaul],105,"Lalit Narayan Project Uchya Vidyalay, Ratanpur Purab Bhag",Main,1,540,26.429776,86.92228,Yes,Yes,Yes
45-Chhatapur [6-Supaul],105,"Lalit Narayan Project Uchya Vidyalay, Ratanpur (Girls hostel) Pashchim Bhag",Auxiliary,541,1060,26.429774,86.92224,Yes,Yes,Yes
45-Chhatapur [6-Supaul],106,"Madhya Vidyalay, Ratanpur purvi Bhag Uttari Kamra",Main,1,616,26.4294147,86.9269787,Yes,Yes,Yes
45-Chhatapur [6-Supaul],106,"Madhya Vidyalay, Ratanpur purvi Bhag dakshini Kamra",Auxiliary,617,1194,26.4294146,86.9269785,Yes,Yes,Yes
45-Chhatapur [6-Supaul],107,Utkrmit Madhya Vidyalay Nirmali Purab Bhag,Main,1,572,26.402586,86.964142,Yes,Yes,Yes
45-Chhatapur [6-Supaul],107,Utkrmit Madhya Vidyalay Nirmali Dakshin Bhag,Auxiliary,573,1192,26.402584,86.96414,Yes,Yes,Yes
45-Chhatapur [6-Supaul],108,Sanskrit Uchch Vidyalaya Nirmali uttar Bhag Dakshini kamra,Main,1,589,26.402621,86.964491,Yes,Yes,Yes
45-Chhatapur [6-Supaul],108,Sanskrit Uchch Vidyalaya Nirmali uttari Bhag Madhya kamra,Auxiliary,590,1117,26.40262,86.96449,Yes,Yes,Yes
45-Chhatapur [6-Supaul],109,Panchayat Bhavan Nimali,Main,1,845,26.412921,86.968164,Yes,Yes,Yes
45-Chhatapur [6-Supaul],110,Prathmik vidyalay sariya Ansari Tola Parwaha,Main,1,967,26.41293,86.96815,Yes,Yes,Yes
45-Chhatapur [6-Supaul],111,Aanganavadi Kendra Panchayat Bhavan Prisar Sthit Nirmali,Main,1,861,26.41294,86.967484,Yes,Yes,Yes
45-Chhatapur [6-Supaul],112,Madhya vidyalay Shivnagar,Main,1,909,26.402622,86.949364,Yes,Yes,Yes
45-Chhatapur [6-Supaul],113,Utkarmit Madhay Vidyalay Rampur Uttar Bhag,Main,1,790,26.399897,86.960519,Yes,Yes,Yes
45-Chhatapur [6-Supaul],114,Utkarmit Madhay Vidyalay Rampur Dakshin Bhag,Main,1,680,26.399895,86.960514,Yes,Yes,Yes
45-Chhatapur [6-Supaul],115,"Utkramit Madhya Vidyalay, Vishanpur Chaudhary Pashchim Bhag",Main,1,604,26.435075,87.007694,Yes,Yes,Yes
45-Chhatapur [6-Supaul],115,"Utkramit Madhya Vidyalay, Vishanpur Chaudhary Dakshin Bhag",Auxiliary,605,1049,26.435073,87.007692,Yes,Yes,Yes
45-Chhatapur [6-Supaul],116,"Utkramit Madhya Vidyalay, Vishanpur Chaudhary Purab Bhag",Main,1,785,26.435548,87.007758,Yes,Yes,Yes
45-Chhatapur [6-Supaul],117,"Utkramit Madhya Vidyalay, Vishanpur Shivram Purab Bhag Uttari Kamra",Main,1,518,26.41907,87.018787,Yes,Yes,Yes
45-Chhatapur [6-Supaul],117,"Utkramit Madhya Vidyalay, Vishanpur Shivram Purab Bhag ",Auxiliary,519,1094,26.41905,87.018788,Yes,Yes,Yes
45-Chhatapur [6-Supaul],118,Panchayat Bhavan Vishanpur Shivram,Main,1,586,26.414687,87.011845,Yes,Yes,Yes
45-Chhatapur [6-Supaul],118,Panchayat Sarkar Bhavan Vishanpur Shivram,Auxiliary,587,1167,26.414686,87.011844,Yes,Yes,Yes
45-Chhatapur [6-Supaul],119,"Prathamik Vidyalay, Nathapatti (Pashchim Bhag) Kamra Number-01",Main,1,732,26.405439,87.04356,Yes,Yes,Yes
45-Chhatapur [6-Supaul],120,"Prathamik Vidyalay, Nathapatti Uttar Bhag",Main,1,600,26.40544,87.04354,Yes,No,Yes
45-Chhatapur [6-Supaul],120,"Prathamik Vidyalay, Nathapatti (Pashchim Bhag) Kamra Number-02",Auxiliary,601,1110,26.405438,87.04352,Yes,Yes,Yes
45-Chhatapur [6-Supaul],121,"Utkramit Madhay Vidyalay, Tulasipatti Dakshin Bhag",Main,1,646,26.402241,87.054664,Yes,Yes,Yes
45-Chhatapur [6-Supaul],121,"Utkramit Madhay Vidyalay, Tulasipatti Uttar Bhag",Auxiliary,647,1263,26.40224,87.054666,Yes,Yes,Yes
45-Chhatapur [6-Supaul],122,Prathamik Vidyalay Kushhar Eraji,Main,1,820,26.41152,87.052458,Yes,Yes,Yes
45-Chhatapur [6-Supaul],123,Aganbari Kendra sankhiya 136 Kushhar Dakshin,Main,1,838,26.411615,87.052384,Yes,Yes,Yes
45-Chhatapur [6-Supaul],124,Madhya Vidyalay Kushahrmal Purvi Bhag,Main,1,573,26.428002,87.045632,Yes,Yes,Yes
45-Chhatapur [6-Supaul],124,Madhya Vidyalay Kushahrmal Naya Bhavan Purab Bhag,Auxiliary,574,1049,26.428012,87.045628,Yes,Yes,Yes
45-Chhatapur [6-Supaul],125,Badh Ashray Astal Kushahr Mal Pashchim Bhag,Main,1,689,26.426245,87.045548,Yes,Yes,Yes
45-Chhatapur [6-Supaul],125,Badh Ashray Astal Kushahr Mal Purab Bhag,Auxiliary,690,1341,26.426244,87.045546,Yes,Yes,Yes
45-Chhatapur [6-Supaul],126,"Madhya Vidyalay, Kushahar Mal, Pashchimi Bhag",Main,1,538,26.4274822,87.045406,Yes,Yes,Yes
45-Chhatapur [6-Supaul],126,"Madhya Vidyalay, Kushahar Mal, Purab Bhag, Purvi Kamra",Auxiliary,539,1075,26.42782,87.045404,Yes,Yes,Yes
45-Chhatapur [6-Supaul],127,Utkrmit Madhya vidyalay Parsa Urdu Pashchim Bhag,Main,1,846,26.408047,87.067643,Yes,Yes,Yes
45-Chhatapur [6-Supaul],128,Utkrmit Madhya vidyalay Parsa Urdu Purab Bhag,Main,1,924,26.40846,87.069743,Yes,Yes,Yes
45-Chhatapur [6-Supaul],129,Samudayik Vikas Bhavan Parsa Anusuchit Jati Tola,Main,1,573,26.413238,87.025088,Yes,Yes,Yes
45-Chhatapur [6-Supaul],129,Prathmik Vidyalaya Paswan Tola Parsa,Auxiliary,574,1169,26.413568,87.025178,Yes,Yes,Yes
45-Chhatapur [6-Supaul],130,Madhya Vidyalay Balua Bazar Uttar Bhag,Main,1,600,26.406341,87.013509,Yes,Yes,Yes
45-Chhatapur [6-Supaul],130,"Madhya Vidyalay, Balua Bazar Paschim Bhag",Auxiliary,601,1145,26.406218,87.013477,Yes,Yes,Yes
45-Chhatapur [6-Supaul],131,"Madhya Vidyalay, Balua Bazar Purav Bhag",Main,1,858,26.406359,87.013732,Yes,Yes,Yes
45-Chhatapur [6-Supaul],132,Uchch Vidyalay Balua Bazar,Main,1,961,26.406376,87.017914,Yes,Yes,Yes
45-Chhatapur [6-Supaul],133,Prathamik Vidyalay Visanpur Gulami Uttar Bhag,Main,1,867,26.391882,87.011894,Yes,Yes,Yes
45-Chhatapur [6-Supaul],134,"Prathamik Vidyalay, Vishanapur Gulami Dakshin Bhag",Main,1,628,26.391905,87.012003,Yes,Yes,Yes
45-Chhatapur [6-Supaul],135,Utkramit Madhay Vidyalay Bhawanipur Tharha,Main,1,325,26.38852,86.990473,Yes,Yes,Yes
45-Chhatapur [6-Supaul],136,Badh ashray sthal gurdhariya ward no-01 uttar bhag,Main,1,600,26.397538,86.983148,Yes,Yes,Yes
45-Chhatapur [6-Supaul],136,Badh ashray sthal gurdhariya ward no-01 Dakshin bhag,Auxiliary,601,1111,26.397679,86.983226,Yes,Yes,Yes
45-Chhatapur [6-Supaul],137,Madhya Vidyalay Matiyari,Main,1,886,26.382182,87.009088,Yes,Yes,Yes
45-Chhatapur [6-Supaul],138,Sanskrit Madhya Vidyalay Matiyari Paschim Bhag,Main,1,600,26.377482,86.952259,Yes,Yes,Yes
45-Chhatapur [6-Supaul],138,Sanskrit Madhya Vidyalay Matiyari Purab Bhag,Auxiliary,601,1160,26.37759,86.95256,Yes,Yes,Yes
45-Chhatapur [6-Supaul],139,Utkramit Madhay Vidyalay Chainpur Purab Bhag,Main,1,720,26.386681,87.043298,Yes,Yes,Yes
45-Chhatapur [6-Supaul],139,Utkramit Madhay Vidyalay Chainpur Purab Bhag Dakshin kamra,Auxiliary,721,1410,26.386698,87.043268,Yes,Yes,Yes
45-Chhatapur [6-Supaul],140,Utkramit Madhay Vidyalay Chainpur Pashchim Bhag ,Main,1,700,26.386898,87.043184,Yes,Yes,Yes
45-Chhatapur [6-Supaul],140,Utkramit Madhay Vidyalay Chainpur Pashchim Bhag Uttar kamra,Auxiliary,701,1422,26.386888,87.043138,Yes,Yes,Yes
45-Chhatapur [6-Supaul],141,Madhya Vidyalay Thuthi Purab Bhag,Main,1,800,26.381986,87.066027,Yes,Yes,Yes
45-Chhatapur [6-Supaul],141,Madhya Vidyalay Thuthi Purab Bhag Uttari kamra,Auxiliary,801,1464,26.382044,87.065781,Yes,Yes,Yes
45-Chhatapur [6-Supaul],142,"Madhya Vidyalay Thuthi, Pashchim Bhag Dakshin Kamra",Main,1,600,26.351141,87.45155,Yes,Yes,Yes
45-Chhatapur [6-Supaul],142,"Madhya Vidyalay Thuthi, Pashchim Bhag Uttari kamra",Auxiliary,601,1152,26.312411,87.4524426,Yes,Yes,Yes
45-Chhatapur [6-Supaul],143,Utkramit Madhay Vidyalay Chapin Purab Bhag,Main,1,600,26.36209,87.045709,Yes,Yes,Yes
45-Chhatapur [6-Supaul],143,Utkramit Madhay Vidyalay Chapin Purab Bhag Uttari kamra,Auxiliary,601,1225,26.361666,87.045534,Yes,Yes,Yes
45-Chhatapur [6-Supaul],144,Utkramit Madhay Vidyalay Chapin Pashchim Bhag,Main,1,883,26.36164,87.045493,Yes,Yes,Yes
45-Chhatapur [6-Supaul],145,Madarasa Baramotra,Main,1,961,26.373447,86.9680643,Yes,Yes,Yes
45-Chhatapur [6-Supaul],146,"Samudayak Bhavan, Transfarmer Ke Nikat, Mahadevpatti",Main,1,913,26.371738,87.007968,No,Yes,Yes
45-Chhatapur [6-Supaul],147,"Prathmik Vidyalaya,Mahadevpatti Mallah tola Lakshminia",Main,1,911,26.372308,87.015242,Yes,Yes,Yes
45-Chhatapur [6-Supaul],148,Utkrmit Madhya Vidyalay Lakshminiya Purvi Bhag,Main,1,817,26.35599,87.003798,No,Yes,Yes
45-Chhatapur [6-Supaul],149,"Utkrmit Madhya Vidyalay Lakshminiya, Madhya Bhag",Main,1,908,26.356129,87.00359,Yes,Yes,Yes
45-Chhatapur [6-Supaul],150,"Utkrmit Madhya Vidyalay Lakshminiya, Pashchim Bhag",Main,1,600,26.356071,87.003595,Yes,Yes,Yes
45-Chhatapur [6-Supaul],150,"Utkrmit Madhya Vidyalay Lakshminiya, Pashchim Bhag Uttari Kamra",Auxiliary,601,1245,26.356058,87.003603,Yes,Yes,Yes
45-Chhatapur [6-Supaul],151,Utkarmit Madhay Vidyalay Lakshminiya Shekh Tola Uttar Bhag,Main,1,700,26.35942,87.014995,Yes,Yes,Yes
45-Chhatapur [6-Supaul],151,Utkarmit Madhay Vidyalay Lakshminiya Shekh Tola Uttar Bhag Dakshin Kamra,Auxiliary,701,1404,26.35919,87.0152,Yes,Yes,Yes
45-Chhatapur [6-Supaul],152,"Utkramit Madhay Vidyalay Lakshminiya, Shekh Tola Dakshin Bhag",Main,1,650,26.359192,87.015202,Yes,Yes,Yes
45-Chhatapur [6-Supaul],152,"Utkramit Madhay Vidyalay Lakshminiya, Shekh Tola Dakshin Bhag Uttar Kamra",Auxiliary,651,1305,26.359198,87.01512,Yes,Yes,Yes
45-Chhatapur [6-Supaul],153,Panchayat Bhavan Lakshminiya,Main,1,920,26.359079,87.015148,Yes,Yes,Yes
45-Chhatapur [6-Supaul],154,Uma Kant Sanskrit Prathmik Sah Madhya Vidyalaya Dodra Purav Bhag,Main,1,906,26.341893,87.004589,Yes,Yes,Yes
45-Chhatapur [6-Supaul],155,Uma Kant Sanskrit Prathmik Sah Madhya Vidyala Dodra Pashchim Bhag,Main,1,500,26.341893,87.004469,Yes,Yes,Yes
45-Chhatapur [6-Supaul],155,Uma Kant Sanskrit Prathmik Sah Madhya Vidyala Dodra Pashchim Bhag Uttar Kamra,Auxiliary,501,1050,26.341987,87.004728,Yes,Yes,Yes
45-Chhatapur [6-Supaul],156,"Madhya Vidyalay Madhubani, Uttar Bhag",Main,1,700,26.316161,86.999431,Yes,Yes,Yes
45-Chhatapur [6-Supaul],156,"Madhya Vidyalay Madhubani, Uttar Bhag Dakshin Kamra",Auxiliary,701,1309,26.317271,86.999792,Yes,Yes,Yes
45-Chhatapur [6-Supaul],157,Madhya Vidyalay Madhubani Naya Bhavan,Main,1,600,26.3161,86.999578,Yes,Yes,Yes
45-Chhatapur [6-Supaul],157,Madhya Vidyalay Madhubani Naya Bhavan Uttari Kamra,Auxiliary,601,1139,26.3168,86.999724,Yes,Yes,Yes
45-Chhatapur [6-Supaul],158,"Madhya Vidyalay Madhubani, Dakshin Bhag",Main,1,696,26.31602,86.999648,Yes,Yes,Yes
45-Chhatapur [6-Supaul],159,Sanskrit Uchya Vidyalay Madhubani,Main,1,365,26.312454,87.005461,Yes,Yes,Yes
45-Chhatapur [6-Supaul],160,Prathamik Vidyalay Madhubani Mehta Tola Purav Bhag,Main,1,920,26.332435,87.008849,Yes,Yes,Yes
45-Chhatapur [6-Supaul],161,"Prathamik Vidyalay Madhubani, Mehta Tola Pashchim Bhag",Main,1,740,26.323586,87.002848,Yes,Yes,Yes
45-Chhatapur [6-Supaul],162,Prathamik Vidyalay Kevla Purav Bhag,Main,1,700,26.205634,87.1452661,Yes,Yes,Yes
45-Chhatapur [6-Supaul],162,Prathamik Vidyalay Kevla Purav Bhag Uttari Kamra,Auxiliary,701,1318,26.205616,87.1448939,Yes,Yes,Yes
45-Chhatapur [6-Supaul],163,"Prathamik Vidyalay Kevla, Pashchim Bhag",Main,1,600,26.205611,87.1445166,Yes,Yes,Yes
45-Chhatapur [6-Supaul],163,"Prathamik Vidyalay Kevla, Pashchim Bhag Dakshini Kamra",Auxiliary,601,1223,26.205647,87.1445404,Yes,Yes,Yes
45-Chhatapur [6-Supaul],164,Madhay Vidyalay Bhimpur Uttar Bhag Kamra Sankhya-01,Main,1,700,26.20277,87.2353983,Yes,Yes,Yes
45-Chhatapur [6-Supaul],164,Madhay Vidyalay Bhimpur Uttar Bhag Dakshin Kamra,Auxiliary,701,1352,26.20276,87.2353259,Yes,Yes,Yes
45-Chhatapur [6-Supaul],165,"Madhya Vidyalay Bhimpur, Madhay Bhag",Main,1,500,26.202725,87.2348637,Yes,Yes,Yes
45-Chhatapur [6-Supaul],165,"Madhya Vidyalay Bhimpur, Madhay Bhag Uttari Kamra",Auxiliary,501,1030,26.202711,87.2352863,Yes,Yes,Yes
45-Chhatapur [6-Supaul],166,Utkarmit Madhay Vidyalay Bhimpur Ward 2 Pashchim Bhag,Main,1,822,26.211159,87.3260748,Yes,Yes,Yes
45-Chhatapur [6-Supaul],167,Utkarmit Madhay Vidyalay Bhimpur Ward 2 Purav Bhag,Main,1,798,26.21116,87.3260982,Yes,Yes,Yes
45-Chhatapur [6-Supaul],168,Madhya Vidyalay Bhimpur Uttar Bhag Kamra Sankhya-02,Main,1,818,26.202624,87.2356082,Yes,Yes,Yes
45-Chhatapur [6-Supaul],169,"Madhya Vidyalay , Bhimpur Dakshin Bhag",Main,1,849,26.202635,87.2352615,Yes,Yes,Yes
45-Chhatapur [6-Supaul],170,Madhya Vidyalay Jivachhpur Purav Bhag,Main,1,861,26.199636,87.2286742,Yes,Yes,Yes
45-Chhatapur [6-Supaul],171,Madhya Vidyalay Jivachhpur Pashchim Bhag,Main,1,766,26.19957,87.2282303,Yes,Yes,Yes
45-Chhatapur [6-Supaul],172,Madhya Vidyalaya Jivachhpur Atirikt Varg Kaksh Bhavan,Main,1,500,26.199138,87.2288614,Yes,Yes,Yes
45-Chhatapur [6-Supaul],172,Madhya Vidyalaya Jivachhpur Atirikt Varg Kaksh Bhavan Purvi Kamra,Auxiliary,501,1024,26.199139,87.2288702,Yes,Yes,Yes
45-Chhatapur [6-Supaul],173,"Panchayat Bhavan Jivachhpur,",Main,1,929,26.191159,87.2307014,Yes,Yes,Yes
45-Chhatapur [6-Supaul],174,Prathamik Vidyalay Belaganj Purvi Bhag,Main,1,500,26.183462,87.2291195,Yes,Yes,Yes
45-Chhatapur [6-Supaul],174,Prathamik Vidyalay Belaganj Purvi  Bhag Uttari Kamra,Auxiliary,501,1084,26.183462,87.2291246,Yes,Yes,Yes
45-Chhatapur [6-Supaul],175,"Prathamik Vidyalay Belaganj, Pashchim Bhag",Main,1,927,26.183461,87.2291307,Yes,Yes,Yes
45-Chhatapur [6-Supaul],176,Samudayik Bhavan Jivachhpur Palar,Main,1,996,26.19536,87.1233353,Yes,Yes,Yes
45-Chhatapur [6-Supaul],177,Aganbari Kendra Jivachhpur Palar Uttar Bhag,Main,1,600,26.195188,87.11952,Yes,Yes,Yes
45-Chhatapur [6-Supaul],177,Aganbari Kendra Jivachhpur Palar Dakshin Bhag(Chalant Matdan Kendra),Auxiliary,601,1260,26.195171,87.1196352,Yes,Yes,Yes
45-Chhatapur [6-Supaul],178,Samudayik Bhavan Kala Govindpur Anusuchit Jati Tola,Main,1,962,26.292436,87.0357235,Yes,Yes,Yes
45-Chhatapur [6-Supaul],179,"Samudayik Bhavan, Kala Govindpur Gera Nadi Se Pashchim Mandal Tola",Main,1,566,26.292848,87.036883,Yes,Yes,Yes
45-Chhatapur [6-Supaul],180,Madhya Vidyalay Mahddipur,Main,1,878,26.283593,87.0290869,Yes,Yes,Yes
45-Chhatapur [6-Supaul],181,Sanskrit Madhya Vidyalay Udhampur Dakshini Kamra,Main,1,600,26.289746,87.0025969,Yes,Yes,Yes
45-Chhatapur [6-Supaul],181,Sanskrit Madhya Vidyalay Udhampur Uttari Kamra,Auxiliary,601,1226,26.28983,87.0025196,Yes,Yes,Yes
45-Chhatapur [6-Supaul],182,Utkarmit Madhya Vidyalay Udhampur Uttari Kamra,Main,1,600,26.300151,87.0049554,Yes,Yes,Yes
45-Chhatapur [6-Supaul],182,Utkarmit Madhya Vidyalay Udhampur Dakshini Kamra,Auxiliary,601,1149,26.34325,87.0049559,Yes,Yes,Yes
45-Chhatapur [6-Supaul],183,Prathamik Vidyalay Bhagvatpur Purav Bhag,Main,1,500,26.29327,87.0279228,Yes,Yes,Yes
45-Chhatapur [6-Supaul],183,Prathamik Vidyalay Bhagvatpur Purav Bhag Uttari Kamra,Auxiliary,501,1005,26.29408,87.0279321,Yes,Yes,Yes
45-Chhatapur [6-Supaul],184,Prathamik Vidyalay Bhagwatpur Pashchim Bhag,Main,1,849,26.29327,87.0279228,Yes,Yes,Yes
45-Chhatapur [6-Supaul],185,Madhay Vidyalay Pariyahi Purv Dakshini Kamra,Main,1,600,26.279161,87.0161501,Yes,Yes,Yes
45-Chhatapur [6-Supaul],185,Madhay Vidyalay Pariyahi Purv Uttari Kamra,Auxiliary,601,1289,26.279465,87.0161681,Yes,Yes,Yes
45-Chhatapur [6-Supaul],186,Panchayat Bhavan Pariyahi,Main,1,825,26.273785,87.007128,Yes,Yes,Yes
45-Chhatapur [6-Supaul],187,Utkarmit Madhay Vidyalay Pariyahi Geradhar Se Pashchim (Pashchim Bhag),Main,1,889,26.28489,86.9980917,Yes,Yes,Yes
45-Chhatapur [6-Supaul],188,"UtkramitMadhya Vidyalay, Pariyahi Geradhar Se Pashchim Purab Bhag",Main,1,734,26.284901,86.9980599,Yes,Yes,Yes
45-Chhatapur [6-Supaul],189,Utkramit Madhya Vidyalay Lalganj Tilathi Dakshin Bhag,Main,1,600,26.242665,86.9940074,Yes,Yes,Yes
45-Chhatapur [6-Supaul],189,Utkramit Madhya Vidyalay Lalganj Tilathi Dakshin Bhag Purab Kamra,Auxiliary,601,1107,26.248868,86.9944274,Yes,Yes,Yes
45-Chhatapur [6-Supaul],190,"Utkramit Madhya Vidyalay, Lalganj Tilathi Uttar Bhag",Main,1,501,26.9433,86.595846,Yes,Yes,Yes
45-Chhatapur [6-Supaul],190,"Utkramit Madhya Vidyalay, Lalganj Tilathi Uttar Bhag Dakshin Kamra",Auxiliary,502,1031,26.943342,86.5958962,Yes,Yes,Yes
45-Chhatapur [6-Supaul],191,Prathamik Vidyalay Tilathi Pashchim Bhag,Main,1,839,26.164392,87.237729,Yes,Yes,Yes
45-Chhatapur [6-Supaul],192,"Prathamik Vidyalay Tilathi, Purav uttar  Bhag",Main,1,884,26.164353,87.236791,Yes,Yes,Yes
45-Chhatapur [6-Supaul],193,"Prathamik Vidyalay Tilathi, Purab Bhag",Main,1,800,26.316555,87.2369972,Yes,Yes,Yes
45-Chhatapur [6-Supaul],193,"Prathamik Vidyalay Tilathi, Purab Bhag Uttari Kamra",Auxiliary,801,1375,26.165678,87.236129,Yes,Yes,Yes
45-Chhatapur [6-Supaul],194,Urdu Madhya Vidyalay Mahddipur,Main,1,998,26.164298,87.236717,Yes,Yes,Yes
45-Chhatapur [6-Supaul],195,"Prathamik Vidyalay Madhopur, Kaji Tola, Purab Bhag",Main,1,600,26.18195,87.2220984,Yes,Yes,Yes
45-Chhatapur [6-Supaul],195,"Prathamik Vidyalay Madhopur, Kaji Tola, Purab Bhag Uttari Kamra",Auxiliary,601,1145,26.172062,87.242955,Yes,Yes,Yes
45-Chhatapur [6-Supaul],196,"Prathamik Vidyalay Madhopur, Kaji Tola Pashchim Bhag",Main,1,833,26.172062,87.2429392,Yes,Yes,Yes
45-Chhatapur [6-Supaul],197,"Prathamik Vidyalay Madhopur, Kaji Tola Madhya Bhag",Main,1,859,26.174045,87.2592047,Yes,Yes,Yes
45-Chhatapur [6-Supaul],198,Prathamik Vidyalay Hariharpur Pashchim Bhag,Main,1,867,26.167494,87.1528571,Yes,Yes,Yes
45-Chhatapur [6-Supaul],199,Prathamik Vidyalay Hariharpur Purav Bhag,Main,1,813,26.161841,87.2747852,Yes,Yes,Yes
45-Chhatapur [6-Supaul],200,Panchayat Bhavan Harahirpur Dakshini Kamra,Main,1,700,26.161053,87.2173112,Yes,Yes,Yes
45-Chhatapur [6-Supaul],200,Panchayat Bhavan Harihirpur Uttari Kamra (Chalant Matdan Kendra),Auxiliary,701,1380,26.161054,87.2175416,Yes,Yes,Yes
45-Chhatapur [6-Supaul],201,Madarasa Ajijiya Hanifiya Hariharpur Dakshini Kamra,Main,1,710,26.16281,87.2265966,Yes,Yes,Yes
45-Chhatapur [6-Supaul],201,Madarasa Ajijiya Hanifiya Hariharpur Uttari kamra,Auxiliary,711,1380,26.163688,87.1573564,Yes,Yes,Yes
45-Chhatapur [6-Supaul],202,Madarasa Pratapnagar Dakshini Kamra,Main,1,731,26.254518,87.033262,Yes,Yes,Yes
45-Chhatapur [6-Supaul],202,Madarasa Pratapnagar Uttari Kamra,Auxiliary,732,1261,26.254009,87.033998,Yes,Yes,Yes
45-Chhatapur [6-Supaul],203,Utkarmit Madhay Vidyalay Indarpur Purav Bhag,Main,1,968,26.254321,87.0331256,Yes,Yes,Yes
45-Chhatapur [6-Supaul],204,Utkramit Madhay Vidyalay Indarpur Pashchim Bhag,Main,1,917,26.250091,87.0331372,Yes,Yes,Yes
45-Chhatapur [6-Supaul],205,Madhya Vidyalay Rampur,Main,1,532,26.154216,87.1472335,Yes,Yes,Yes
45-Chhatapur [6-Supaul],206,"Utkramit Madhay Vidyalay Lalpur, Brahaman Tola",Main,1,896,26.151652,87.159692,Yes,Yes,Yes
45-Chhatapur [6-Supaul],207,Utkrmit Madhya Vidyalay Lalpur Nanhiki Tola Purav Bhag Daksini Kamra,Main,1,600,26.24786,87.047426,Yes,Yes,Yes
45-Chhatapur [6-Supaul],207,Utkrmit Madhya Vidyalay Lalpur Nanhiki Tola Purav Bhag Uttari kamra,Auxiliary,601,1094,26.247902,87.047529,Yes,Yes,Yes
45-Chhatapur [6-Supaul],208,Utkramit Madhay Vidyalay Lalpur Nanhiki Tola Pashchim Bhag,Main,1,721,26.249982,87.0476022,Yes,Yes,Yes
45-Chhatapur [6-Supaul],209,Prathamik Vidyalay Rampur Sidhiki Chauk se Purab Bhag Dakshini Kamra,Main,1,600,26.144155,87.1561108,Yes,Yes,Yes
45-Chhatapur [6-Supaul],209,Prathamik Vidyalay Rampur Sidiki Chauk se Purab Bhag Uttari Kamra,Auxiliary,601,1216,26.145355,87.1786144,Yes,Yes,Yes
45-Chhatapur [6-Supaul],210,Prathamik Vidyalay Rampur Sidhiki Chauk se Pashchim Bhag Dakshini Kamra,Main,1,600,26.145488,87.1786144,Yes,Yes,Yes
45-Chhatapur [6-Supaul],210,Prathamik Vidyalay Rampur Sidhiki Chauk se Pashchim Bhag Uttari Kamra,Auxiliary,601,1236,26.144955,87.1473608,Yes,Yes,Yes
45-Chhatapur [6-Supaul],211,Prathamik Vidyalay Mohanpur Purav Bhag Dakshini Kamra,Main,1,500,26.143901,87.3447793,Yes,Yes,Yes
45-Chhatapur [6-Supaul],211,Prathamik Vidyalay Mohanpur Purav Bhag Uttari Kamra,Auxiliary,501,1064,26.143845,87.3445179,Yes,Yes,Yes
45-Chhatapur [6-Supaul],212,Prathamik Vidyalay Mohanpur Pashchim Bhag Uttari Kamra,Main,1,600,26.143946,87.3445233,Yes,Yes,Yes
